place_id,place_name,place_address,city/regency,image,desc,total_review,ave_rating,art_gallery,bakery,bar,cafe,food,liquor_store,lodging,meal_delivery,meal_takeaway,night_club,restaurant,school,store
ChIJqUG4acYvMTARWSccb4HAFU4,Desadesa Resto,"Jl. Setia Budi No.190/12, Tj. Rejo, Kec. Medan Sunggal, Kota Medan, Sumatera Utara 20154, Indonesia",Medan,Belum Ada Foto,Belum Ada Deskripsi,2333,4.3,0,0,0,0,1,0,0,0,0,0,1,0,0
ChIJ93BP2tMxMTARSDkoM-5OmoE,The Edge Restaurant,"Jl. S. Parman No.217, Petisah Tengah, Kec. Medan Petisah, Kota Medan, Sumatera Utara 20111, Indonesia",Medan,Belum Ada Foto,Belum Ada Deskripsi,180,4.3,0,0,1,0,1,0,0,0,0,0,1,0,0
ChIJdUTg9NsxMTARlXSFBZ7hO_s,Golden kitchen restaurant,"Jl. Waringin No No.9kl, Sekip, Kec. Medan Petisah, Kota Medan, Sumatera Utara 20111, Indonesia",Medan,Belum Ada Foto,Belum Ada Deskripsi,13,5.0,0,0,0,0,1,0,0,0,0,0,1,0,0
ChIJf2ChD88xMTARmyPLaycMwRg,Wisma Benteng Restaurant,"Jl. Kapten Maulana Lubis No.6, Petisah Tengah, Kec. Medan Petisah, Kota Medan, Sumatera Utara 20236, Indonesia",Medan,Belum Ada Foto,Belum Ada Deskripsi,1601,4.5,0,0,0,0,1,0,0,0,0,0,1,0,0
ChIJMxj5cTYwMTARCsQAHovw7Xg,Sawasdee Thai Restaurant,"Jl. Multatuli Raya, Blok-FF No.36-37, Hamdan, Kec. Medan Maimun, Kota Medan, Sumatera Utara 20151, Indonesia",Medan,Belum Ada Foto,Belum Ada Deskripsi,850,4.5,0,0,0,0,1,0,0,0,0,0,1,0,0
ChIJ-bgUAXIxMTARcot-k7cNMzQ,Li Kung Restaurant,"JL. Kol Sugiono No.7A, Medan, North Sumatera, 20152, A U R, Medan Maimun, Medan City, North Sumatra 20212, Indonesia",Medan,Belum Ada Foto,Belum Ada Deskripsi,226,4.5,0,0,0,0,1,0,0,0,0,0,1,0,0
ChIJu-aHgN8xMTARSsNj___fiU8,OnDo Grill Batak,"Jl. Pabrik Tenun No.45, Sei Putih Tengah, Kec. Medan Petisah, Kota Medan, Sumatera Utara 20118, Indonesia",Medan,Belum Ada Foto,Belum Ada Deskripsi,1467,4.5,0,0,0,0,1,0,0,0,0,0,1,0,0
ChIJW3hdoJQxMTARXQXFmDs8Es4,Restoran Pondok Indah,"Jl. Hasanuddin No.1, Petisah Hulu, Kec. Medan Baru, Kota Medan, Sumatera Utara 20153, Indonesia",Medan,Belum Ada Foto,Belum Ada Deskripsi,265,4.3,0,0,0,0,1,0,0,0,0,0,1,0,0
ChIJW4rCJTcuMTAR0IuV2imT5mo,Mie Aceh Titi Bobrok,"Jl. Setia Budi No.17 D, Sei Sikambing B, Kec. Medan Sunggal, Kota Medan, Sumatera Utara 20122, Indonesia",Medan,Belum Ada Foto,Belum Ada Deskripsi,9321,4.3,0,0,0,0,1,0,0,0,0,0,1,0,0
ChIJXaUAQbYxMTARSfeqs2KYqkg,Restoran Ria,"Jl. Letjen MT. Haryono No. 11-15, Ps. Baru, Kec. Medan Kota, Kota Medan, Sumatera Utara 20212, Indonesia",Medan,Belum Ada Foto,Belum Ada Deskripsi,1438,4.6,0,0,0,0,1,0,0,0,0,0,1,0,0
ChIJ19Bl5cMxMTARj2EEi2tBIuk,SOHO Capital Medan,"Capital Building, 2nd Floor, Jl. Putri Hijau No.1A, Kesawan, Kec. Medan Bar., Kota Medan, Sumatera Utara 20111, Indonesia",Medan,Belum Ada Foto,Belum Ada Deskripsi,1402,4.6,0,0,1,0,1,0,0,0,0,1,1,0,0
ChIJqbccgL8xMTARSWjLssGXF5E,Orchid Restaurant,"Jl. Sutomo No.1, Perintis, Kec. Medan Tim., Kota Medan, Sumatera Utara 20235, Indonesia",Medan,Belum Ada Foto,Belum Ada Deskripsi,42,4.4,0,0,0,0,1,0,0,0,0,0,1,0,0
ChIJCX_mdtMxMTAR26VY8gNGmoU,LA NINAS MEDAN,"Jl. Hasanuddin No.3, Petisah Hulu, Kec. Medan Baru, Kota Medan, Sumatera Utara 20153, Indonesia",Medan,Belum Ada Foto,Belum Ada Deskripsi,420,4.5,0,0,0,0,1,0,0,0,0,0,1,0,0
ChIJVR9ikbUxMTAR92cqRe91rqU,Restoran Mikado,"Jl. Palangkaraya No.1-3, Petisah Tengah, Kec. Medan Petisah, Kota Medan, Sumatera Utara 20212, Indonesia",Medan,Belum Ada Foto,Belum Ada Deskripsi,235,4.5,0,0,0,0,1,0,0,0,0,0,1,0,0
ChIJ0W8nzq8xMTARZzDr1G5tKuM,Royal Garden Restaurant,"Jl. Tapanuli No.109, Pandau Hulu I, Kec. Medan Kota, Kota Medan, Sumatera Utara 20233, Indonesia",Medan,Belum Ada Foto,Belum Ada Deskripsi,614,4.4,0,0,0,0,1,0,0,0,0,0,1,0,0
ChIJv_OhW8IxMTARLnT1SmUQwJg,Jumbo Sea Food Restaurant,"Jalan Putri Hijau No.8ABCD, Kesawan, Kec. Medan Bar., Kota Medan, Sumatera Utara 20236, Indonesia",Medan,Belum Ada Foto,Belum Ada Deskripsi,1063,4.5,0,0,0,0,1,0,0,0,0,0,1,0,0
ChIJl0jtfjYwMTAR0nUky8AA2_s,The Thirty-Six,"Jl. Multatuli No.36, Hamdan, Kec. Medan Maimun, Kota Medan, Sumatera Utara 20151, Indonesia",Medan,Belum Ada Foto,Belum Ada Deskripsi,1984,4.5,0,0,0,1,1,0,0,0,0,0,1,0,1
ChIJV71NuDUwMTAR8FW-BrsHsIg,sanresto,"Jl. H. Misbah No.14 G, Hamdan, Kec. Medan Maimun, Kota Medan, Sumatera Utara 20212, Indonesia",Medan,Belum Ada Foto,Belum Ada Deskripsi,70,4.3,0,0,0,0,1,0,0,0,0,0,1,0,0
ChIJDSZlZs4xMTARNyGxQIrNK_E,The Big Eyed,"Jl. Imam Bonjol No.6, Petisah Tengah, Kec. Medan Petisah, Kota Medan, Sumatera Utara 20112, Indonesia",Medan,Belum Ada Foto,Belum Ada Deskripsi,223,4.4,0,0,0,1,1,0,0,0,0,0,1,0,0
ChIJKY_scMIxMTARbKwDyI-RUk4,Grand Maximum Seafood Restaurant,"Jl. Putri Merak Jingga No.2D, Kesawan, Kec. Medan Bar., Kota Medan, Sumatera Utara 20236, Indonesia",Medan,Belum Ada Foto,Belum Ada Deskripsi,440,4.5,0,0,0,0,1,0,0,0,0,0,1,0,0
ChIJB6BbN2sxMTARICkS1Jw0_vg,Tempat makan enak,"Jl. Mesjid No.164c, Kesawan, Kec. Medan Bar., Kota Medan, Sumatera Utara 20111, Indonesia",Medan,Belum Ada Foto,Belum Ada Deskripsi,11,4.5,0,0,0,0,1,0,0,0,0,0,1,0,0
ChIJQ-27X9IxMTARMRFoCdhC_bY,Socrates Vegan,"Jl. Airlangga No.14 - C, Petisah Tengah, Kec. Medan Petisah, Kota Medan, Sumatera Utara 20112, Indonesia",Medan,Belum Ada Foto,Belum Ada Deskripsi,325,4.6,0,0,0,0,1,0,0,0,0,0,1,0,0
ChIJVRivM9MxMTARYKH8CGz_xZ4,Restoran Pohon Pisang,"Komplek The Crown, Jl. S. Parman No.16-17, Petisah Hulu, Kec. Medan Baru, Kota Medan, Sumatera Utara 20153, Indonesia",Medan,Belum Ada Foto,Belum Ada Deskripsi,466,4.3,0,0,0,0,1,0,0,0,0,0,1,0,0
ChIJd87vkccxMTARKHhqGU8EjEQ,Healy Macs Bar And Restaurant Medan,"Ruko Centre Point, 15-16, Jl. Timor Blok M No.23, Gg. Buntu, Kec. Medan Tim., Kota Medan, Sumatera Utara 20231, Indonesia",Medan,Belum Ada Foto,Belum Ada Deskripsi,489,4.5,0,0,1,0,1,0,0,0,0,0,1,0,0
ChIJEROSqNoxMTARPxPv6HPLJcI,Kwetiau Kerang & Resto Njo Nja,"Jl. S. Parman No.22 - 24, Petisah Tengah, Kec. Medan Petisah, Kota Medan, Sumatera Utara 20112, Indonesia",Medan,Belum Ada Foto,Belum Ada Deskripsi,364,4.3,0,0,0,0,1,0,0,0,0,0,1,0,0
ChIJ0S4au9ExMTARUthN86dEsJg,Tong's Cafe,"Jl. Kejaksaan No.7-D, Petisah Tengah, Kec. Medan Petisah, Kota Medan, Sumatera Utara 20112, Indonesia",Medan,Belum Ada Foto,Belum Ada Deskripsi,688,4.4,0,0,0,0,1,0,0,0,0,0,1,0,0
ChIJ-Q9Q92ExMTARgbji8AxfyyQ,RM ANA,"Jl. Orion No.91, Petisah Tengah, Kec. Medan Petisah, Kota Medan, Sumatera Utara 20111, Indonesia",Medan,Belum Ada Foto,Belum Ada Deskripsi,129,4.7,0,0,0,0,1,0,0,0,0,0,1,0,0
ChIJPak-byAxMTAR4Y3WovQcDDE,Lebanon Restaurant,"Petisah Tengah, Medan Petisah, Medan City, North Sumatra, Indonesia",Medan,Belum Ada Foto,Belum Ada Deskripsi,162,4.5,0,0,0,0,1,0,0,0,0,0,1,0,0
ChIJ4ZWJgMcxMTARlwUaVf3iNwM,Mie Zhou (周家麵 - Zhou's Noodles),"Jalan Timor No.10 TT/47, Gg. Buntu, Kec. Medan Tim., Kota Medan, Sumatera Utara 20232, Indonesia",Medan,Belum Ada Foto,Belum Ada Deskripsi,413,4.6,0,0,0,0,1,0,0,0,0,0,1,0,0
ChIJq6qqqtUvMTAR1UbjRddsMYM,Al Jazeerah Restaurant & Cafe Medan,"Jl. K.H. Wahid Hasyim No.66, Babura, Kec. Medan Baru, Kota Medan, Sumatera Utara 20154, Indonesia",Medan,Belum Ada Foto,Belum Ada Deskripsi,634,4.4,0,0,0,0,1,0,0,0,0,0,1,0,0
ChIJ75t4V6MvMTARxxX2MXLomkM,RESTAURANT GARUDA,"Jl. Bunga Asoka No No.126kel, Asam Kumbang, Kec. Medan Selayang, Kota Medan, Sumatera Utara 20133, Indonesia",Medan,Belum Ada Foto,Belum Ada Deskripsi,1478,4.5,0,0,0,0,1,0,0,0,0,0,1,0,0
ChIJow416cMxMTARsO8WwFO6-0E,Prime Steakhouse,"JW Marriott Hotel, Jl. Putri Hijau No.10, Kesawan, Kec. Medan Bar., Kota Medan, Sumatera Utara 20111, Indonesia",Medan,Belum Ada Foto,Belum Ada Deskripsi,69,4.4,0,0,0,0,1,0,0,0,0,0,1,0,0
ChIJOyktESouMTARpRYtKV7yxzM,Restoran Garuda medan,"Jl. Gajah Mada No.8, Petisah Tengah, Kec. Medan Petisah, Kota Medan, Sumatera Utara 20152, Indonesia",Medan,Belum Ada Foto,Belum Ada Deskripsi,2185,4.5,0,0,0,0,1,0,0,0,0,0,1,0,0
ChIJD2vxWNIxMTARcN6V9EPkj3Y,Medan Vegetarian,"JL. Airlangga No. 23A-25, Madras Hulu, Kec. Medan Polonia, Kota Medan, Sumatera Utara 20151, Indonesia",Medan,Belum Ada Foto,Belum Ada Deskripsi,457,4.5,0,0,0,0,1,0,0,0,0,0,1,0,0
ChIJkyChcM0xMTARtcnOhLuj3gA,Marugame Udon,"Jl. Muara Takus No.25, Petisah Tengah, Kec. Medan Petisah, Kota Medan, Sumatera Utara 20152, Indonesia",Medan,Belum Ada Foto,Belum Ada Deskripsi,1815,4.6,0,0,0,0,1,0,0,0,0,0,1,0,0
ChIJVYDsACwwMTARxalXNHNY9Sc,Rumah Makan Garuda,"Jl. Kapten Patimura No.328, Darat, Kec. Medan Baru, Kota Medan, Sumatera Utara 20152, Indonesia",Medan,Belum Ada Foto,Belum Ada Deskripsi,1794,4.5,0,0,0,0,1,0,0,0,0,0,1,0,0
ChIJU4OmlMcxMTARXQmU4v3BG9w,Hanamasa Medan,"UG 15 Mall Centre Point (Medan, Jl. Jawa, Gg. Buntu, Kec. Medan Tim., Kota Medan, Sumatera Utara 20232, Indonesia",Medan,Belum Ada Foto,Belum Ada Deskripsi,912,4.6,0,0,0,0,1,0,0,0,0,0,1,0,0
ChIJvwo5-50xMTARz1xfp_kSW5Y,Kimukatsu Deli Park Medan,"Jl. Putri Hijau No.1, Kesawan, Kec. Medan Bar., Kota Medan, Sumatera Utara 20231, Indonesia",Medan,Belum Ada Foto,Belum Ada Deskripsi,3239,5.0,0,0,0,0,1,0,0,0,0,0,1,0,0
ChIJw_4WGYcxMTARe11EQ5Htm38,Trattoria,"Jl. Kapten Patimura No.342, Darat, Kec. Medan Baru, Kota Medan, Sumatera Utara 20152, Indonesia",Medan,Belum Ada Foto,Belum Ada Deskripsi,155,4.3,0,0,0,0,1,0,0,0,0,0,1,0,0
ChIJWze0ApAxMTARCfvsN7fdmFU,Nelayan Kafe - Delipark Mall Medan,"HMVG+M58, Kesawan, Medan Barat, Medan City, North Sumatra, Indonesia",Medan,Belum Ada Foto,Belum Ada Deskripsi,172,4.6,0,0,0,0,1,0,0,0,0,0,1,0,0
ChIJza5vQ64xMTARzdLzvjjfSc0,Happy Seafood Medan,"Jl. Bakaran Batu No.4, Sei Rengas II, Kec. Medan Area, Kota Medan, Sumatera Utara 20214, Indonesia",Medan,Belum Ada Foto,Belum Ada Deskripsi,387,4.4,0,0,0,0,1,0,0,0,0,0,1,0,0
ChIJDdvxCNgxMTARS8qDUPQ6CcU,Restoran Sederhana,"Jl. Putri Hijau No.8m, Kesawan, Kec. Medan Bar., Kota Medan, Sumatera Utara 20236, Indonesia",Medan,Belum Ada Foto,Belum Ada Deskripsi,602,4.5,0,0,0,0,1,0,0,0,0,0,1,0,0
ChIJLX570_QxMTARUZKNXF9HQ4U,"Marugame Udon, Deli Park Medan","Jalan Guru Patimpus Blok OPQ No 1, Kesawan, Kec. Medan Bar., Kota Medan, Sumatera Utara 20111, Indonesia",Medan,Belum Ada Foto,Belum Ada Deskripsi,317,4.6,0,0,0,0,1,0,0,0,0,0,1,0,0
ChIJXXwJSykwMTARxWcp1fT4Bbc,The Traders Restaurant,"Jl. Kapten Patimura No.423, Darat, Kec. Medan Baru, Kota Medan, Sumatera Utara 20153, Indonesia",Medan,Belum Ada Foto,Belum Ada Deskripsi,1516,4.5,0,0,1,0,1,0,0,0,0,0,1,0,0
ChIJqyCkH9UvMTARumKuWRzzRDg,Golden Yen,"Business Center, Medan, Jl. S. Parman No.10-11, Petisah Tengah, Kec. Medan Petisah, Kota Medan, Sumatera Utara 20153, Indonesia",Medan,Belum Ada Foto,Belum Ada Deskripsi,1574,4.4,0,0,0,0,1,0,0,0,0,0,1,0,0
ChIJaSuW3c0xMTARg4ltyvupyxc,Jasmine Chinese Restaurant,"Adimulia Hotel, Jl. Pangeran Diponegoro No.8, Petisah Tengah, Kec. Medan Petisah, Kota Medan, Sumatera Utara 20112, Indonesia",Medan,Belum Ada Foto,Belum Ada Deskripsi,26,4.4,0,0,0,0,1,0,0,0,0,0,1,0,0
ChIJkUVJJRUxMTARsukjISxnf2U,Solaria - Mall Deli Park Medan,"Solaria Mall Deli Park Medan Lantai 3A Jalan Guru Patimpus OPQ No.1, Kesawan, Kec. Medan Bar., Kota Medan, Sumatera Utara 20111, Indonesia",Medan,Belum Ada Foto,Belum Ada Deskripsi,362,4.5,0,0,0,0,1,0,0,0,0,0,1,0,0
ChIJVUUQeM0xMTAR7eEG33KWIXI,Sushi Tei Sun Plaza,"Sun Plaza Lantai LG Zona A No. 01, Jalan Kh. Zainul Arifin No. 7, Madras Hulu, Medan Polonia, Madras Hulu, Kec. Medan Polonia, Kota Medan, Sumatera Utara 20151, Indonesia",Medan,Belum Ada Foto,Belum Ada Deskripsi,1231,4.6,0,0,0,0,1,0,0,0,0,0,1,0,0
ChIJhzH_5M4xMTARzJ-SX90Y7u8,Restaurant Royal Thamrin,"Jl. M.H Thamrin No.15a/55, Pandau Hilir, Medan Perjuangan, Medan City, North Sumatra 20232, Indonesia",Medan,Belum Ada Foto,Belum Ada Deskripsi,109,4.4,0,0,0,0,1,0,0,0,0,0,1,0,0
ChIJ5bQXocgxMTARvc9ZE5gAvA8,Spoon Dining,"Jl. Balai Kota No. 1 Petisah Tengah Medan Petisah Medan, Kesawan, Kec. Medan Bar., Kota Medan, Sumatera Utara 20236, Indonesia",Medan,Belum Ada Foto,Belum Ada Deskripsi,43,4.4,0,0,0,0,1,0,0,0,0,0,1,0,0
ChIJVTQsvMcxMTARNvrLkN7ommI,Fish & Co - Centre Point Medan,"Gang Buntu, Medan Timur, Medan City, North Sumatra 20232, Indonesia",Medan,Belum Ada Foto,Belum Ada Deskripsi,435,4.5,0,0,0,0,1,0,0,0,0,0,1,0,0
ChIJQW9V0g0xMTARnV65BDfXzp8,Rumah Makan Kapau HJ. Uni Emi,"Jl. Rotan No.82, Petisah Tengah, Kec. Medan Petisah, Kota Medan, Sumatera Utara 20111, Indonesia",Medan,Belum Ada Foto,Belum Ada Deskripsi,498,4.6,0,0,0,0,1,0,0,0,0,0,1,0,0
ChIJ3XyrDDMvMTARHYMMeDQBeco,Oui Dining,"Jl. Sei Belutu No.66, Padang Bulan Selayang I, Kec. Medan Selayang, Kota Medan, Sumatera Utara 20131, Indonesia",Medan,Belum Ada Foto,Belum Ada Deskripsi,86,4.8,0,0,0,0,1,0,0,0,0,0,1,0,0
ChIJU0u4wsAxMTARa3xqiqdnL1s,DaeBak Korean BBQ Restaurant,"T1&T2 Jati Junction, Jl. Timor, Perintis, Kec. Medan Tim., Kota Medan, Sumatera Utara 20236, Indonesia",Medan,Belum Ada Foto,Belum Ada Deskripsi,659,4.3,0,0,0,0,1,0,0,0,0,0,1,0,0
ChIJ6yEycQQWei4R0SpuVsPL2OY,Rumah Makan Medan Jaya,"Jl. Diponegoro No.2, Dusun III, Madegondo, Kec. Grogol, Kabupaten Sukoharjo, Jawa Tengah 57552, Indonesia",Surakarta,Belum Ada Foto,Belum Ada Deskripsi,59,4.5,0,0,0,0,1,0,0,0,0,0,1,0,0
ChIJ6WblKMkxMTAR-v-JcK5Uz78,Rumah Makan David,"Jl. Hindu No.3, Kesawan, Kec. Medan Bar., Kota Medan, Sumatera Utara 20231, Indonesia",Medan,Belum Ada Foto,Belum Ada Deskripsi,95,4.5,0,0,0,0,1,0,0,0,0,0,1,0,0
ChIJa9V65GnmaC4RK2VkdPV8lKM,Gormeteria,"Jl. Pasir Kaliki No.176, Pasir Kaliki, Kec. Cicendo, Kota Bandung, Jawa Barat 40173, Indonesia",Bandung,Belum Ada Foto,Belum Ada Deskripsi,6658,4.6,0,0,0,0,1,0,0,0,0,0,1,0,0
ChIJd5G4NvPmaC4RBd-NWFwpSRg,La Costilla (Affordable Casual Dining),"Jl. Prof. Dr. Sutami No.98, Pasteur, Kec. Sukasari, Kota Bandung, Jawa Barat 40533, Indonesia",Bandung,Belum Ada Foto,Belum Ada Deskripsi,1094,4.4,0,0,0,0,1,0,0,0,0,0,1,0,0
ChIJlesM_RXmaC4R54fStJCsL58,Fresco Bandung,"Fresco Bandung, Jl. HOS. Cokroaminoto No.41-43, Arjuna, Kec. Cicendo, Kota Bandung, Jawa Barat 40172, Indonesia",Bandung,Belum Ada Foto,Belum Ada Deskripsi,88,4.5,0,0,0,0,1,0,0,0,0,0,1,0,0
ChIJR5gv3UjmaC4RwnivXflmOg4,MASA,"Jl. Trunojoyo No.29, Citarum, Kec. Bandung Wetan, Kota Bandung, Jawa Barat 40115, Indonesia",Bandung,Belum Ada Foto,Belum Ada Deskripsi,1881,4.4,0,0,0,0,1,0,0,0,0,0,1,0,0
ChIJ6xjQYILoaC4R0dKCUDv_bhw,Atmosphere Resort Café,"Jl. Lengkong Besar No.97, Paledang, Kec. Lengkong, Kota Bandung, Jawa Barat 40261, Indonesia",Bandung,Belum Ada Foto,Belum Ada Deskripsi,7075,4.5,0,0,0,0,1,0,0,0,0,0,1,0,0
ChIJIbRneujmaC4RRAGka69dSLM,Miss Bee Providore,"Jl. Rancabentang No.11A, Ciumbuleuit, Kec. Cidadap, Kota Bandung, Jawa Barat 40142, Indonesia",Bandung,Belum Ada Foto,Belum Ada Deskripsi,5294,4.5,0,0,0,0,1,0,0,0,0,0,1,0,0
ChIJY23nzVfmaC4RiJ_kfU7wHjI,Kapulaga Indonesian Bistro,"Jl. Dayang Sumbi No.3, Lb. Siliwangi, Kecamatan Coblong, Kota Bandung, Jawa Barat 40132, Indonesia",Bandung,Belum Ada Foto,Belum Ada Deskripsi,3168,4.4,0,0,0,0,1,0,0,0,0,0,1,0,0
ChIJoQgWQ3rnaC4REmtAU_kfHkg,Sadrasa Kitchen & Bar,"Jl. Diponegoro No.27, Citarum, Kec. Bandung Wetan, Kota Bandung, Jawa Barat 40115, Indonesia",Bandung,Belum Ada Foto,Belum Ada Deskripsi,1957,5.0,0,0,0,0,1,0,0,0,0,0,1,0,0
ChIJ2dX2tM3naC4RG6Gcgz_vyWU,Bawean Resto,"Jl. Gandapura No.43, Merdeka, Kec. Sumur Bandung, Kota Bandung, Jawa Barat 40113, Indonesia",Bandung,Belum Ada Foto,Belum Ada Deskripsi,645,4.5,0,0,0,0,1,0,0,0,0,0,1,0,0
ChIJXzqQwUrmaC4RJlZIdEnuJH8,Paviliun Sunda,"LLRE Martadinata St No.97, Citarum, Bandung Wetan, Bandung City, West Java 40115, Indonesia",Bandung,Belum Ada Foto,Belum Ada Deskripsi,4456,4.3,0,0,0,0,1,0,0,0,0,0,1,0,0
ChIJTyC3j8rnaC4RQ2JS9b3JBvE,Karnivor Restaurant,"LLRE Martadinata St No.127, Cihapit, Bandung Wetan, Bandung City, West Java 40114, Indonesia",Bandung,Belum Ada Foto,Belum Ada Deskripsi,13329,4.5,0,0,0,0,1,0,0,0,0,0,1,0,0
ChIJPTRbitjnaC4RV1Fox_lQg_0,The Restaurant at The Trans Luxury Hotel Bandung,"Trans Studio Bandung, Lantai 3, Jl. Gatot Subroto No.289, Cibangkong, Kec. Batununggal, Kota Bandung, Jawa Barat 40273, Indonesia",Bandung,Belum Ada Foto,Belum Ada Deskripsi,312,4.6,0,0,0,0,1,0,0,0,0,0,1,0,0
ChIJr8LAK7f8aC4RFAgksf1ccQM,Sindang Reret Bandung,"Jl. Surapati No.53, Sadang Serang, Kecamatan Coblong, Kota Bandung, Jawa Barat 40133, Indonesia",Bandung,Belum Ada Foto,Belum Ada Deskripsi,4596,4.4,0,0,0,0,1,0,0,0,0,0,1,0,0
ChIJdQqkHT7maC4RmyyxbA6uBLE,Purnawarman Restaurant,"Lobby Level, Jl. HOS. Cokroaminoto No.41-43, Arjuna, Cicendo, Bandung City, West Java 40172, Indonesia",Bandung,Belum Ada Foto,Belum Ada Deskripsi,403,4.5,0,0,0,0,1,0,0,0,0,0,1,0,0
ChIJc3V35SHnaC4RoZJiIPRr68I,The Stone Cafe,"Dago Coblong, Jl. Rancakendal Luhur No.5, Ciburial, Kec. Cimenyan, Kabupaten Bandung, Jawa Barat 40198, Indonesia",Bandung,Belum Ada Foto,Belum Ada Deskripsi,3243,4.4,0,0,0,1,1,0,0,0,0,0,1,0,0
ChIJR5gv3UjmaC4RPaHFVdjX3YA,Dakken Restaurant,"LLRE Martadinata St No.67, Citarum, Bandung Wetan, Bandung City, West Java 40113, Indonesia",Bandung,Belum Ada Foto,Belum Ada Deskripsi,4441,4.5,0,0,0,0,1,0,0,0,0,0,1,0,0
ChIJNxvsqjrmaC4RxcNddIhDE3w,Preanger Restaurant,"Grand Hotel Preanger, Jl. Asia Afrika No.81, Braga, Sumurbandung, Bandung City, West Java 40111, Indonesia",Bandung,Belum Ada Foto,Belum Ada Deskripsi,79,4.7,0,0,0,0,1,0,0,0,0,0,1,0,0
ChIJYcavE0TmaC4RFGGXY3BKxPg,The Square Restaurant Bandung,"No 25, Jl. Cihampelas No.23, Tamansari, Bandung Wetan, Bandung City, West Java 40171, Indonesia",Bandung,Belum Ada Foto,Belum Ada Deskripsi,60,4.4,0,0,0,0,1,0,0,0,0,0,1,0,0
ChIJf75qd3bnaC4RnZDVtLe_IoM,Pago Restaurant,"Jl. Gatot Subroto No.83, Malabar, Kec. Lengkong, Kota Bandung, Jawa Barat 40262, Indonesia",Bandung,Belum Ada Foto,Belum Ada Deskripsi,143,4.8,0,0,0,0,1,0,0,0,0,0,1,0,0
ChIJ60IS-uLmaC4RtcQcZ2BeGdk,Feast Restaurant,"Hotel & Towers, Sheraton Bandung, Jl. Ir. H. Juanda No.390, Dago, Kecamatan Coblong, Kota Bandung, Jawa Barat 40135, Indonesia",Bandung,Belum Ada Foto,Belum Ada Deskripsi,171,4.5,0,0,0,0,1,0,0,0,0,0,1,0,0
ChIJpWhkYRXmaC4REHyC-PncG9c,Rijsttafel Resto,"Jl. Pasir Kaliki No.67, Arjuna, Kec. Cicendo, Kota Bandung, Jawa Barat 40171, Indonesia",Bandung,Belum Ada Foto,Belum Ada Deskripsi,2399,4.4,0,0,0,0,1,0,0,0,0,0,1,0,0
ChIJawtYCDXmaC4RVol2ECy4yRY,Sonoma Cafe|Resto (Sonoma Gold),"Jl. Lombok No.29, Merdeka, Kec. Sumur Bandung, Kota Bandung, Jawa Barat 40113, Indonesia",Bandung,Belum Ada Foto,Belum Ada Deskripsi,1804,4.5,0,0,0,1,1,0,0,0,0,0,1,0,1
ChIJYSa0w8LmaC4RCQhSEjQErqU,The Restaurant - Padma Hotel Bandung,"Jl. Rancabentang No.56-58, Ciumbuleuit, Kec. Cidadap, Kota Bandung, Jawa Barat 40142, Indonesia",Bandung,Belum Ada Foto,Belum Ada Deskripsi,1722,4.6,0,0,0,0,1,0,0,0,0,0,1,0,0
ChIJg3qxVkDmaC4RInFihzM44MQ,Warung Suluh Restaurant,"Jl. Dr. Cipto No.8, Pasir Kaliki, Kec. Cicendo, Kota Bandung, Jawa Barat 40171, Indonesia",Bandung,Belum Ada Foto,Belum Ada Deskripsi,1084,4.4,0,0,0,0,1,0,0,0,0,0,1,0,0
ChIJIQnijbTnaC4RG8p4wAd4s9w,Alas Daun Restaurant,"Jl. Citarum No.34, Cihapit, Kec. Bandung Wetan, Kota Bandung, Jawa Barat 40116, Indonesia",Bandung,Belum Ada Foto,Belum Ada Deskripsi,9527,4.3,0,0,0,0,1,0,0,0,0,0,1,0,0
ChIJaa4yq0vmaC4Rlp_TQ2P0LHY,Hummingbird Eatery & Space,"Jl. Progo No.16, Citarum, Kec. Bandung Wetan, Kota Bandung, Jawa Barat 40115, Indonesia",Bandung,Belum Ada Foto,Belum Ada Deskripsi,5183,4.5,0,0,0,1,1,0,0,0,0,0,1,0,0
ChIJ7-ROc57oaC4RXJpkK7Lo5Lc,D'poet Resto,"d'best Hotel, Jl. Otto Iskandar Dinata No.460, Nyengseret, Astanaanyar, Bandung City, West Java 40242, Indonesia",Bandung,Belum Ada Foto,Belum Ada Deskripsi,14,4.6,0,0,0,0,1,0,0,0,0,0,1,0,0
ChIJVVVVFSXmaC4RO1ijktzs0a0,BOJA Eatery & Bar Bandung,"Sumatra, Jl. Sumatera No.21, Kota Bandung, Jawa Barat 40111, Indonesia",Bandung,Belum Ada Foto,Belum Ada Deskripsi,696,4.6,0,0,0,0,1,0,0,0,0,0,1,0,0
ChIJ2SYApDrmaC4RP9LMuL_TkvQ,Bandung Suki,"Jl. Braga No.70, Braga, Kec. Sumur Bandung, Kota Bandung, Jawa Barat 40111, Indonesia",Bandung,Belum Ada Foto,Belum Ada Deskripsi,1014,4.4,0,0,0,0,1,0,0,0,0,0,1,0,0
ChIJ476OI7XnaC4Rc1tv9-1hpyQ,Glosis Restaurant,"Jl. Citarum No.12, Cihapit, Kec. Bandung Wetan, Kota Bandung, Jawa Barat 40114, Indonesia",Bandung,Belum Ada Foto,Belum Ada Deskripsi,2620,4.5,0,0,0,0,1,0,0,0,0,0,1,0,0
ChIJz394wWXmaC4Rm4S6t_7kyso,Raja Sunda,"Jl. Dr. Djunjunan No.63, Pajajaran, Kec. Cicendo, Kota Bandung, Jawa Barat 40242, Indonesia",Bandung,Belum Ada Foto,Belum Ada Deskripsi,5675,4.4,0,0,0,0,1,0,0,0,0,0,1,0,0
ChIJ3xLW4rLnaC4R0YW8Jl98_u0,Rumah Makan Khas Sunda Bale Gazeeboe Bandung,"Jl. Surapati No.49, Sadang Serang, Kecamatan Coblong, Kota Bandung, Jawa Barat 40132, Indonesia",Bandung,Belum Ada Foto,Belum Ada Deskripsi,700,4.0,0,0,0,0,1,0,0,0,0,0,1,0,0
ChIJzTERXS_maC4R18PKQnyp-lI,Queen Restaurant,"Jl. Dalem Kaum No.79, Cikawao, Kec. Lengkong, Kota Bandung, Jawa Barat 40261, Indonesia",Bandung,Belum Ada Foto,Belum Ada Deskripsi,2661,4.6,0,0,0,0,1,0,0,0,0,0,1,0,0
ChIJ_2OTUd3maC4RFvAtf5jkcn4,Kalpa Tree Dine and Chill,"Jl. Kiputih No.37, Ciumbuleuit, Kec. Cidadap, Kota Bandung, Jawa Barat 40142, Indonesia",Bandung,Belum Ada Foto,Belum Ada Deskripsi,6047,4.4,0,0,1,1,1,0,0,0,0,1,1,0,0
ChIJQ-i3aovmaC4RkAWCzCehpZE,Tjendana Bistro,"Jl. Sukajadi No.181, Cipedes, Kec. Sukajadi, Kota Bandung, Jawa Barat 40162, Indonesia",Bandung,Belum Ada Foto,Belum Ada Deskripsi,2554,4.6,0,0,0,0,1,0,0,0,0,0,1,0,0
ChIJj-uhrFHmaC4R1u4otaapK3Y,Madame Sari Restaurant,"Jl. Ir. H. Juanda No.85, Lb. Siliwangi, Kecamatan Coblong, Kota Bandung, Jawa Barat 40132, Indonesia",Bandung,Belum Ada Foto,Belum Ada Deskripsi,847,4.5,0,0,0,0,1,0,0,0,0,0,1,0,0
ChIJcUL9uernaC4Rx7VzUbLCZp8,Restoran 499,"Jl. A. Yani No.687, Padasuka, Kec. Cibeunying Kidul, Kota Bandung, Jawa Barat 40281, Indonesia",Bandung,Belum Ada Foto,Belum Ada Deskripsi,1353,4.5,0,0,0,0,1,0,0,0,0,0,1,0,0
ChIJT5SKsC_maC4Rf5xpdyIa8G4,Restaurant Rasa,"Jl. Tamblong No.15, Cibeunying, Kec. Sumur Bandung, Kota Bandung, Jawa Barat 40111, Indonesia",Bandung,Belum Ada Foto,Belum Ada Deskripsi,23,4.0,0,0,0,0,1,0,0,0,0,0,1,0,0
ChIJS07xqDrmaC4RzZQFjNhp928,Braga Permai,"Jl. Braga No.58, Braga, Kec. Sumur Bandung, Kota Bandung, Jawa Barat 40111, Indonesia",Bandung,Belum Ada Foto,Belum Ada Deskripsi,6308,4.5,0,0,0,0,1,0,0,0,0,0,1,0,0
ChIJD12mDUjmaC4RTSF1E2w38hI,SODA Resto & Bar,"The 101 Bandung Dago, Jl. Ir. H. Djuanda No. 3, Tamansari, Bandung Wetan, Tamansari, Kec. Bandung Wetan, Kota Bandung, Jawa Barat 40115, Indonesia",Bandung,Belum Ada Foto,Belum Ada Deskripsi,217,4.6,0,0,0,0,1,0,0,0,0,0,1,0,0
ChIJaVZJ8srnaC4REbvnRwxSJP4,90 Gourmet,"LLRE Martadinata St No.90, Cihapit, Bandung Wetan, Bandung City, West Java 40114, Indonesia",Bandung,Belum Ada Foto,Belum Ada Deskripsi,1790,4.3,0,0,0,0,1,0,0,0,0,0,1,0,0
ChIJzTXT-ADnaC4R7rV6xc5cCks,restoran paradise,"Jl. Gandapura No.71a, Merdeka, Kec. Sumur Bandung, Kota Bandung, Jawa Barat 40113, Indonesia",Bandung,Belum Ada Foto,Belum Ada Deskripsi,26,4.5,0,0,0,0,1,0,0,0,0,0,1,0,0
ChIJ5XTisirmaC4Rcvp7ZxbDoX8,Rose Flower Restaurant,"Jl. Jend. A. Yani No.32, Burangrang, Lengkong, Malabar, Kec. Lengkong, Kota Bandung, Jawa Barat 40262, Indonesia",Bandung,Belum Ada Foto,Belum Ada Deskripsi,583,4.5,0,0,0,0,1,0,0,0,0,0,1,0,0
ChIJ9RgV6c7naC4RFa2HeJrbdt0,Cafe Bali,"LLRE Martadinata St No.211-215, Cihapit, Bandung Wetan, Bandung City, West Java 40114, Indonesia",Bandung,Belum Ada Foto,Belum Ada Deskripsi,4688,4.4,0,0,0,1,1,0,0,0,0,0,1,0,0
ChIJJbn0YfPmaC4RgYofiBUORSo,AhMei Cafe Bandung,"Jl. Dr. Setiabudi No.41, Pasteur, Kec. Sukajadi, Kota Bandung, Jawa Barat 40171, Indonesia",Bandung,Belum Ada Foto,Belum Ada Deskripsi,117,4.3,0,0,0,0,1,0,0,0,0,0,1,0,0
ChIJH2HlKSznaC4R65AbfE-jqTs,Jendela Resto,"Jl. Imam Bonjol No.1, Lebakgede, Kecamatan Coblong, Kota Bandung, Jawa Barat 40132, Indonesia",Bandung,Belum Ada Foto,Belum Ada Deskripsi,36,4.9,0,0,0,0,1,0,0,0,0,0,1,0,0
ChIJ0d4VAEHmaC4RD3ChrnuCTeU,The White Clover Resto & Dine,"Jl. Dr. Cipto No.24, Pasir Kaliki, Kec. Cicendo, Kota Bandung, Jawa Barat 40171, Indonesia",Bandung,Belum Ada Foto,Belum Ada Deskripsi,895,4.5,0,0,0,0,1,0,0,0,0,0,1,1,0
ChIJPyNB3k7maC4RLd3zl7l6gAo,Blackpepper resto & cafe,"Jl. Maulana Yusuf No.10, Citarum, Kec. Bandung Wetan, Kota Bandung, Jawa Barat 40115, Indonesia",Bandung,Belum Ada Foto,Belum Ada Deskripsi,750,4.4,0,0,0,0,1,0,0,0,0,0,1,0,0
ChIJ6XtKddDnaC4RNcIJMfp8Ibo,Tilu Kitchen and Patisserie,"Jl L.L.R.E.Martadinata No 81,Riau, Kota Bandung, Jawa Barat 40115, Indonesia",Bandung,Belum Ada Foto,Belum Ada Deskripsi,1820,4.6,0,1,0,0,1,0,0,0,0,0,1,0,1
ChIJY8asbPDnaC4R0oPsnQUcoo8,Liliwetan Resto & Cafe,"Jl. Supratman No.37, Cihapit, Kec. Bandung Wetan, Kota Bandung, Jawa Barat 40114, Indonesia",Bandung,Belum Ada Foto,Belum Ada Deskripsi,131,4.4,0,0,0,1,1,0,0,0,0,0,1,0,0
ChIJEcf6qjrmaC4RzCe1SmMQdM0,Hong Sin Restaurant,"Jl. Banceuy No.110, Braga, Kec. Sumur Bandung, Kota Bandung, Jawa Barat 40111, Indonesia",Bandung,Belum Ada Foto,Belum Ada Deskripsi,960,4.2,0,0,0,0,1,0,0,0,0,0,1,0,0
ChIJJZpEGjbmaC4RxUCmB3A1adA,Al Jazeerah Signature Middle East Restaurant And Cafe Bandung,"Jl. Ternate No.3, Citarum, Kec. Bandung Wetan, Kota Bandung, Jawa Barat 40115, Indonesia",Bandung,Belum Ada Foto,Belum Ada Deskripsi,3992,4.4,0,0,0,0,1,0,0,0,0,0,1,0,0
ChIJ2X3CpK7naC4RoswIfnzCpoQ,Mad Cow Wine & Grill Bandung,"Jl. Diponegoro No.27, Citarum, Kec. Bandung Wetan, Kota Bandung, Jawa Barat 40115, Indonesia",Bandung,Belum Ada Foto,Belum Ada Deskripsi,626,4.9,0,0,0,0,1,0,0,0,0,0,1,0,0
ChIJAwL03-3naC4RAjHS6foQUws,Hachi Grill Sutami Bandung,"Jl. Prof. Dr. Sutami No.56, Sukarasa, Kec. Sukasari, Kota Bandung, Jawa Barat 40152, Indonesia",Bandung,Belum Ada Foto,Belum Ada Deskripsi,3145,4.8,0,0,0,0,1,0,0,0,0,0,1,0,0
ChIJg-QFG0nmaC4R-GkHw0K_D7M,Sajian Sambara,"Jl. Trunojoyo No.64, Citarum, Kec. Bandung Wetan, Kota Bandung, Jawa Barat 40115, Indonesia",Bandung,Belum Ada Foto,Belum Ada Deskripsi,2678,4.3,0,0,0,0,1,0,0,0,0,0,1,0,0
ChIJoTDhEvTnaC4RSuQLzL166iQ,Mosaic Restaurant,"3JM6+3QP, Jl. Lembong, Braga, Kec. Sumur Bandung, Kota Bandung, Jawa Barat 40111, Indonesia",Bandung,Belum Ada Foto,Belum Ada Deskripsi,11,3.4,0,0,0,0,1,0,0,0,0,0,1,0,0
ChIJE0RPNITnaC4RrO7NKO2MOC4,Roemah Kentang 1908,"Jl. Banda No.18, Citarum, Kec. Bandung Wetan, Kota Bandung, Jawa Barat 40115, Indonesia",Bandung,Belum Ada Foto,Belum Ada Deskripsi,1709,4.5,0,0,0,0,1,0,0,0,0,0,1,0,0
