place_id,place_name,place_address,city/regency,image,desc,total_review,ave_rating,amusement_park,aquarium,art_gallery,cafe,church,food,hindu_temple,library,local_government_office,lodging,mosque,museum,natural_feature,park,place_of_worship,restaurant,rv_park,school,shopping_mall,store,travel_agency,zoo
ChIJZ5sY9kM90i0RVsPvSxZD7LY,Sacred Monkey Forest Sanctuary,"Jl. Monkey Forest, Ubud, Kecamatan Ubud, Kabupaten Gianyar, Bali 80571, Indonesia",Bali,Belum Ada Foto,Belum Ada Deskripsi,38207,4.5,0,0,0,0,0,0,0,0,0,0,0,0,0,1,0,0,0,0,0,0,0,0
ChIJx97hVM9E0i0RUVpPBj5miBk,Garuda Wisnu Kencana Cultural Park,"Uluwatu St, Ungasan, South Kuta, Badung Regency, Bali 80364, Indonesia",Bali,Belum Ada Foto,Belum Ada Deskripsi,55052,4.5,0,0,0,0,0,0,0,0,0,0,0,0,0,1,0,0,0,0,0,0,0,0
ChIJXfZP2tYg0i0RUaM-yoiFiXs,Leke Leke Waterfall,"J5PW+7W7, Antapan, Baturiti, Tabanan Regency, Bali 82191, Indonesia",Bali,Belum Ada Foto,Belum Ada Deskripsi,1313,4.4,0,0,0,0,0,0,0,0,0,0,0,0,0,0,0,0,0,0,0,0,0,0
ChIJoQHcmv8X0i0RI6vXSuiyCOo,Kanto Lampo Waterfall,"Jl. Kaliasem, Beng, Kec. Gianyar, Kabupaten Gianyar, Bali 80513, Indonesia",Bali,Belum Ada Foto,Belum Ada Deskripsi,1888,4.5,0,0,0,0,0,0,0,0,0,0,0,0,0,0,0,0,0,0,0,0,0,0
ChIJQ6ocSKAb0i0RP1CIrkak0ws,Tukad Cepung Waterfall,"Central parkir waterfall tukad cepung, Jl. Tembuku, Tembuku, Kec. Tembuku, Kabupaten Bangli, Bali 80671, Indonesia",Bali,Belum Ada Foto,Belum Ada Deskripsi,1924,4.6,0,0,0,0,0,0,0,0,0,0,0,0,0,0,0,0,0,0,0,0,0,0
ChIJkYHLIPxP0i0RlQTbpxuNuQw,Uluwatu Temple,"Pecatu, South Kuta, Badung Regency, Bali, Indonesia",Bali,Belum Ada Foto,Belum Ada Deskripsi,31197,4.6,0,0,0,0,0,0,1,0,0,0,0,0,0,1,1,0,0,0,0,0,0,0
ChIJy52SWnGJ0S0RwgkbkQnE2IA,Daya Tarik Wisata Bedugul,"Jl. Puncak Mangu No.1, Batunya, Buleleng, Kabupaten Tabanan, Bali 82191, Indonesia",Bali,Belum Ada Foto,Belum Ada Deskripsi,776,4.6,0,0,0,0,0,0,0,0,0,0,0,0,0,0,0,0,0,0,0,0,0,0
ChIJFZjn43YI0i0R8hFdqu2zmvw,Taman Ujung,"Ujung Water Palace, Tumbu, Karangasem, Karangasem Regency, Bali 80811, Indonesia",Bali,Belum Ada Foto,Belum Ada Deskripsi,7500,4.6,0,0,0,0,0,0,0,0,0,0,0,1,0,0,0,0,0,0,0,0,0,0
ChIJLRhilH4V0i0Rez5UbFcCNm4,Hidden Canyon Beji Guwang,"97QQ+XMM, Banjar Wangbung, Jl. Sahadewa, Guwang, Kec. Sukawati, Kabupaten Gianyar, Bali 80582, Indonesia",Bali,Belum Ada Foto,Belum Ada Deskripsi,2531,4.5,0,0,0,0,0,0,0,0,0,0,0,0,0,0,0,0,0,0,0,0,0,0
ChIJs4sqTRY70i0RSySGSgASiBE,Alas Kedaton,"F5C4+644, Jl. Raya Alas Kedaton, Kukuh, Kec. Marga, Kabupaten Tabanan, Bali 82121, Indonesia",Bali,Belum Ada Foto,Belum Ada Deskripsi,2273,4.2,0,0,0,0,0,0,0,0,0,0,0,0,0,1,0,0,0,0,0,0,0,0
ChIJpR39aDk90i0RiKhirr8D-5A,Bukit Campuhan,"Jl. Bangkiang Sidem, Kelusa, Kec. Payangan, Kabupaten Gianyar, Bali 80571, Indonesia",Bali,Belum Ada Foto,Belum Ada Deskripsi,2264,4.5,0,0,0,0,0,0,0,0,0,0,0,0,0,1,0,0,0,0,0,0,0,0
ChIJL626sPVA0i0RLJoATqtQcfY,Bajra Sandhi Monument,"Jl. Raya Puputan No.142, Panjer, Denpasar Selatan, Kota Denpasar, Bali 80234, Indonesia",Bali,Belum Ada Foto,Belum Ada Deskripsi,13382,4.6,0,0,0,0,0,0,0,0,0,0,0,0,0,0,0,0,0,0,0,0,0,0
ChIJYQy97hsW0i0RXgxBuN15rsE,Tegenungan Waterfall,"Kemenuh, Sukawati, Gianyar Regency, Bali, Indonesia",Bali,Belum Ada Foto,Belum Ada Deskripsi,25806,4.3,0,0,0,0,0,0,0,0,0,0,0,0,0,0,0,0,0,0,0,0,0,0
ChIJE4Bi4H4i0i0R83X6AGpQQ_Q,Alas Harum Bali,"Jl. Raya Tegallalang, Tegallalang, Kec. Tegallalang, Kabupaten Gianyar, Bali 80561, Indonesia",Bali,Belum Ada Foto,Belum Ada Deskripsi,9202,4.5,0,0,0,1,0,1,0,0,0,0,0,0,0,0,0,1,0,0,0,1,0,0
ChIJNyp2FiCP0S0RNamdBru46Bg,Sekumpul Waterfall,"Bebetin, Sawan, Buleleng Regency, Bali, Indonesia",Bali,Belum Ada Foto,Belum Ada Deskripsi,400,3.9,0,0,0,0,0,0,0,0,0,0,0,0,0,0,0,0,0,0,0,0,0,0
ChIJNa4uW0xB0i0RevpSX7uEVjQ,Barong Tanah Kilap - Sari Wisata Budaya BALI,"Jl. Griya Anyar No.25B, Pemogan, Denpasar Selatan, Kota Denpasar, Bali 80221, Indonesia",Bali,Belum Ada Foto,Belum Ada Deskripsi,1685,4.4,0,0,0,0,0,0,0,0,0,0,0,0,0,0,0,0,0,0,0,0,0,0
ChIJ9XP0yms90i0Rn8QbqnT9E3w,Campuhan Ridge Walk,"Kelusa, Payangan, Jl. Raya Campuhan, Sayan, Kecamatan Ubud, Kabupaten Gianyar, Bali 80571, Indonesia",Bali,Belum Ada Foto,Belum Ada Deskripsi,10264,4.4,0,0,0,0,0,0,0,0,0,0,0,0,0,1,0,0,0,0,0,0,0,0
ChIJ34KP7qNG0i0RpX9A85PWkRI,Waterbom Bali,"Jl. Kartika Plaza, Tuban, Kec. Kuta, Kabupaten Badung, Bali 80361, Indonesia",Bali,Belum Ada Foto,Belum Ada Deskripsi,11726,4.7,1,0,0,0,0,0,0,0,0,0,0,0,0,0,0,0,0,0,0,0,0,0
ChIJo-YhLEkj0i0RwrBdmWw4Fbc,Sangeh Monkey Forest,"Jl. Brahmana, Sangeh, Kec. Abiansemal, Kabupaten Badung, Bali 80353, Indonesia",Bali,Belum Ada Foto,Belum Ada Deskripsi,5837,4.5,0,0,0,0,0,0,0,0,0,0,0,0,0,0,0,0,0,0,0,0,0,0
ChIJ2bn7v86P0S0RQNlEPMKB6JU,Gitgit Waterfall,"Jl. Raya Bedugul - Singaraja, Gitgit, Kec. Sukasada, Kabupaten Buleleng, Bali 81161, Indonesia",Bali,Belum Ada Foto,Belum Ada Deskripsi,2014,4.3,0,0,0,0,0,0,0,0,0,0,0,0,0,0,0,0,0,0,0,0,0,0
ChIJL1XuIURB0i0RNRhRbMMJMLI,Upside Down World Bali,"Jl. Bypass Ngurah Rai No.762, Pemogan, Denpasar Selatan, Kota Denpasar, Bali 80221, Indonesia",Bali,Belum Ada Foto,Belum Ada Deskripsi,3629,4.3,0,0,0,0,0,0,0,0,0,0,0,0,0,0,0,0,0,0,0,0,0,0
ChIJVwisn2yJ0S0RUxvb5GhlJBg,Ulun Danu Beratan Temple,"Danau Beratan, Candikuning, Baturiti, Tabanan Regency, Bali 82191, Indonesia",Bali,Belum Ada Foto,Belum Ada Deskripsi,33213,4.7,0,0,0,0,0,0,1,0,0,0,0,0,0,0,1,0,0,0,0,0,0,0
ChIJDSEiPAyJ0S0RxX3GamOTQ4k,Bali Botanical Garden,"Jl. Kebun Raya, Candikuning, Kec. Baturiti, Kabupaten Tabanan, Bali 82191, Indonesia",Bali,Belum Ada Foto,Belum Ada Deskripsi,14008,4.6,0,0,0,0,0,0,0,0,0,0,0,0,0,1,0,0,0,0,0,0,0,0
ChIJj2WsFphH0i0RpPagQ9ga8cg,Pantai Double - Six,"8526+XVJ, Double Six Beach, Legian, Jl. Double Six, Seminyak, Kec. Kuta, Kabupaten Badung, Bali, Indonesia",Bali,Belum Ada Foto,Belum Ada Deskripsi,1043,4.6,0,0,0,0,0,0,0,0,0,0,0,0,0,0,0,0,0,0,0,0,0,0
ChIJR41mLqND0i0R3vM_t4a9Uj0,Penangkaran Penyu Bali Tanjung Benoa,"Tanjung Benoa, South Kuta, Badung Regency, Bali, Indonesia",Bali,Belum Ada Foto,Belum Ada Deskripsi,4836,4.1,0,0,0,0,0,0,0,0,0,0,0,0,0,0,0,0,0,0,0,0,0,0
ChIJbzqpVBWJ0S0R05zES7guCTk,Bali Handara Gate,"Jl. Raya Singaraja-Denpasar, Pancasari, Kec. Sukasada, Kabupaten Buleleng, Bali 81161, Indonesia",Bali,Belum Ada Foto,Belum Ada Deskripsi,2707,4.1,0,0,0,0,0,0,0,0,0,0,0,0,0,0,0,0,0,0,0,0,0,0
ChIJS7J-82o90i0RMj8cKJr2zUs,Ubud Palace,"Jl. Raya Ubud No.8, Ubud, Kecamatan Ubud, Kabupaten Gianyar, Bali 80571, Indonesia",Bali,Belum Ada Foto,Belum Ada Deskripsi,8907,4.2,0,0,0,0,0,0,0,0,0,0,0,0,0,0,0,0,0,0,0,0,0,0
ChIJD_uUnkcj0i0RRgli0Ct1dFI,Objek Wisata Sangeh,"Jl. Brahmana, Sangeh, Kec. Abiansemal, Kabupaten Badung, Bali 80352, Indonesia",Bali,Belum Ada Foto,Belum Ada Deskripsi,137,4.6,0,0,0,0,0,0,0,0,0,0,0,0,0,1,0,0,0,0,0,0,0,1
ChIJqfTkrG4Z0i0RGTQM35oWGTM,Penglipuran Village,"Jl. Penglipuran, Kubu, Kec. Bangli, Kabupaten Bangli, Bali 80611, Indonesia",Bali,Belum Ada Foto,Belum Ada Deskripsi,16793,4.8,0,0,0,0,0,0,0,0,0,0,0,0,0,0,0,0,0,0,0,0,0,0
ChIJAUB625A70i0R7crEj_IvJq8,Taman Ayun Temple,"Jl. Ayodya No.10, Mengwi, Kec. Mengwi, Kabupaten Badung, Bali 80351, Indonesia",Bali,Belum Ada Foto,Belum Ada Deskripsi,7199,4.6,0,0,0,0,0,0,1,0,0,0,0,0,0,0,1,0,0,0,0,0,0,0
ChIJQWvBDkoj0i0RLYVMkHhMqGw,Taman Mumbul Sangeh,"Jln.brahmana No.38, Sangeh, Kec. Abiansemal, Kabupaten Badung, Bali 80352, Indonesia",Bali,Belum Ada Foto,Belum Ada Deskripsi,2165,4.6,0,0,0,0,0,0,0,0,0,0,0,0,0,0,0,0,0,0,0,0,0,0
ChIJL-o1GhJA0i0R5Abv31St2ck,"Taman Festival Bali, Padang Galak","Jl. Padang Galak No.3, Kesiman, Kec. Denpasar Tim., Kota Denpasar, Bali, Indonesia",Padang,Belum Ada Foto,Belum Ada Deskripsi,1490,4.4,0,0,0,0,0,0,0,0,0,0,0,0,0,1,0,0,0,0,0,0,0,0
ChIJl3dU9cFG0i0RE_JTvoaxSVQ,Pantai Legian Bali,"Jl. Melasti, Legian, Kec. Kuta, Kabupaten Badung, Bali, Indonesia",Bali,Belum Ada Foto,Belum Ada Deskripsi,615,4.6,0,0,0,0,0,0,0,0,0,0,0,0,0,0,0,0,0,0,0,0,0,0
ChIJ-9cMAqsn0i0RmoPm81-HDy8,Jatiluwih Rice Terraces,"Village, Jl. Jatiluwih Kawan No.Desa, Jatiluwih, Kec. Penebel, Kabupaten Tabanan, Bali 82152, Indonesia",Bali,Belum Ada Foto,Belum Ada Deskripsi,8647,4.7,0,0,0,0,0,0,0,0,0,0,0,0,0,0,0,0,0,0,0,0,0,0
ChIJ5_TINIRF0i0Rz6DwJGLEQKw,Honeymoon Beach,"64CV+3HP, Unnamed Road, Jimbaran, South Kuta, Badung Regency, Bali 80361, Indonesia",Bali,Belum Ada Foto,Belum Ada Deskripsi,412,4.5,0,0,0,0,0,0,0,0,0,0,0,0,0,0,0,0,0,0,0,0,0,0
ChIJq95xT4I30i0RaU3j93Diq8o,Tanah Lot,"Beraban, Kediri, Tabanan Regency, Bali 82121, Indonesia",Bali,Belum Ada Foto,Belum Ada Deskripsi,80799,4.6,0,0,0,0,0,0,0,0,0,0,0,0,0,0,0,0,0,0,0,0,0,0
ChIJ5ZiPtys90i0RUok0dF7Lh9w,Bali Swing,"Jl. Dewi Saraswati No.7, Bongkasa Pertiwi, Kec. Abiansemal, Kabupaten Badung, Bali 80352, Indonesia",Bali,Belum Ada Foto,Belum Ada Deskripsi,11288,4.6,1,0,0,0,0,0,0,0,0,0,0,0,0,0,0,0,0,0,0,0,0,0
ChIJbZgU8gRb0i0RmWRatK3bd3I,Pandawa Beach,"553P+R5G, Jl. Pantai Pandawa, Kutuh, Kec. Kuta Sel., Kabupaten Badung, Bali 80361, Indonesia",Bali,Belum Ada Foto,Belum Ada Deskripsi,40133,4.6,0,0,0,0,0,0,0,0,0,0,0,0,0,0,0,0,0,0,0,0,1,0
ChIJRSElPXYR0i0R-l62epaUmSw,Bukit Belong,"Jl. Bukit Belong, Gunaksa, Kec. Dawan, Kabupaten Klungkung, Bali 80761, Indonesia",Bali,Belum Ada Foto,Belum Ada Deskripsi,311,4.3,0,0,0,0,0,0,0,0,0,0,0,0,0,0,0,0,0,0,0,0,0,0
ChIJA-LqptiO0S0RvoHMiW8mfAE,Puncak Wanagiri,"Jl. Raya Wanagiri, Pancasari, Kec. Sukasada, Kabupaten Buleleng, Bali 81161, Indonesia",Bali,Belum Ada Foto,Belum Ada Deskripsi,1734,4.6,0,0,0,0,0,0,0,0,0,0,0,0,0,0,0,0,0,0,0,0,0,0
ChIJ05RvaKAX0i0R0GaluXYojxs,Pengibul Waterfall,"Apuan, Susut, Bangli Regency, Bali 80515, Indonesia",Bali,Belum Ada Foto,Belum Ada Deskripsi,362,4.4,0,0,0,0,0,0,0,0,0,0,0,0,0,0,0,0,0,0,0,0,0,0
ChIJ6WxHo60Y0i0RCfAEsPZKqkQ,Pura Gunung Kawi Sebatu,"Sebatu, Tegallalang, Gianyar Regency, Bali 80511, Indonesia",Bali,Belum Ada Foto,Belum Ada Deskripsi,1722,4.6,0,0,0,0,0,0,1,0,0,0,0,0,0,0,1,0,0,0,0,0,0,0
ChIJ-5G51WyJ0S0R3SGp5T1BdlA,Puncak Indah Bedugul,"Puncak Indah Bedugul No.2, Candikuning, Kec. Baturiti, Kabupaten Tabanan, Bali 82191, Indonesia",Bali,Belum Ada Foto,Belum Ada Deskripsi,550,4.5,0,0,0,0,0,0,0,0,0,0,0,0,0,0,0,0,0,0,0,0,0,0
ChIJhwAqoysh0i0R70f2yLfD06s,Secret Garden Village,"Jl. Raya Denpasar Bedugul km. 36, Mekarsari, Baturiti, Mekarsari, Tabanan, Mekarsari, Kec. Baturiti, Kabupaten Tabanan, Bali 82191, Indonesia",Bali,Belum Ada Foto,Belum Ada Deskripsi,4723,4.6,0,0,0,1,0,1,0,0,0,0,0,0,0,0,0,1,0,0,0,1,0,0
ChIJ4WuUswqG0S0R0_F7ENm3htc,Air Terjun Munduk,"Jl Raya No.Desa, Munduk, Kec. Banjar, Kabupaten Buleleng, Bali 81152, Indonesia",Bali,Belum Ada Foto,Belum Ada Deskripsi,722,4.5,0,0,0,0,0,0,0,0,0,0,0,0,0,0,0,0,0,0,0,0,0,0
ChIJZ7s1gUIj0i0RpJe0WNaJmLw,Pengempu Waterfall,"G6J3+798, Jl. Seribupati, Cau Belayu, Kec. Marga, Kabupaten Tabanan, Bali 82181, Indonesia",Bali,Belum Ada Foto,Belum Ada Deskripsi,565,4.2,0,0,0,0,0,0,0,0,0,0,0,0,0,0,0,0,0,0,0,0,0,0
ChIJ0wc2QtEn0i0RIj-sp3iCImM,Wisata Kayu Putih,"H5VP+CR8, Tua, Marga, Tabanan Regency, Bali 82191, Indonesia",Bali,Belum Ada Foto,Belum Ada Deskripsi,253,4.7,0,0,0,0,0,0,0,0,0,0,0,0,0,0,0,0,0,0,0,0,0,0
ChIJaV4g5mEm0i0RAjJX7VnZwf8,Belulang Hot Springs,"Mengesta, Penebel, Tabanan Regency, Bali 82152, Indonesia",Bali,Belum Ada Foto,Belum Ada Deskripsi,564,4.3,0,0,0,0,0,0,0,0,0,0,0,0,0,0,0,0,0,0,0,0,0,0
ChIJU-tl2bcm0i0RwNe4LQjhgzQ,DESA WISATA PINGE,"J55H+VJF, Pinge Baru, Kec. Marga, Kabupaten Tabanan, Bali 82181, Indonesia",Bali,Belum Ada Foto,Belum Ada Deskripsi,220,4.5,0,0,0,0,0,0,0,0,0,0,0,0,0,0,0,0,0,0,0,0,0,0
ChIJpR8_7qCJ0S0RHlO03mW65YY,The Blooms Garden,"Br. Batusesa, Candikuning, Baturiti, Tabanan Regency, Bali 82191, Indonesia",Bali,Belum Ada Foto,Belum Ada Deskripsi,3365,4.6,0,0,0,0,0,1,0,0,0,1,0,0,0,0,0,1,0,0,0,0,0,0
ChIJqY3rbqsm0i0RaRCP8rUVSqw,Bayan Ancient Tree,"H5VP+9QF, Tua, Marga, Tabanan Regency, Bali 82191, Indonesia",Bali,Belum Ada Foto,Belum Ada Deskripsi,374,4.7,0,0,0,0,0,0,0,0,0,0,0,0,0,0,0,0,0,0,0,0,0,0
ChIJ1U5QMNBD0i0R4709gsQdZNU,Pantai Tanjung Benoa,"Tanjung Benoa, South Kuta, Badung Regency, Bali 80361, Indonesia",Bali,Belum Ada Foto,Belum Ada Deskripsi,14,4.9,0,0,0,0,0,0,0,0,0,0,0,0,0,0,0,0,0,0,0,0,0,0
ChIJ_____8OJ0S0RzYLkKOcHW_M,Air Panas Angseri,"J5W4+GFX, Angseri, Bangli, Kec. Baturiti, Kabupaten Tabanan, Bali 82191, Indonesia",Bali,Belum Ada Foto,Belum Ada Deskripsi,1404,4.4,0,0,0,0,0,0,0,0,0,0,0,0,0,0,0,0,0,0,0,0,0,0
ChIJ-2Zw47yJ0S0RRdldgViSw_M,The SILA'S Agrotourism,"Candikuning, Baturiti, Tabanan Regency, Bali 82191, Indonesia",Bali,Belum Ada Foto,Belum Ada Deskripsi,2495,4.4,1,0,0,0,0,0,0,0,0,0,0,0,0,0,0,0,0,0,0,0,0,0
ChIJlXqFDewg0i0RfC9vctP8sUM,Batu Lantang Waterfall,"J6X9+JP2, Pelaga, Petang, Badung Regency, Bali 80353, Indonesia",Bali,Belum Ada Foto,Belum Ada Deskripsi,46,4.6,0,0,0,0,0,0,0,0,0,0,0,0,0,0,0,0,0,0,0,0,0,0
ChIJ2fmvVJdp0S0RcMeSosWckHw,Gili Putih Sumberkima,"Sumberkima, Buleleng Regency, Bali 81155, Indonesia",Bali,Belum Ada Foto,Belum Ada Deskripsi,181,4.6,0,0,0,0,0,0,0,0,0,0,0,0,0,0,0,0,0,0,0,0,0,0
ChIJkRg4rWAI0i0RJV8SNFD1sTg,Pantai Jasri,"GJ9C+WC9, Unnamed Road, Gg. Kangkung, Subagan, Kec. Karangasem, Kabupaten Karangasem, Bali 80811, Indonesia",Bali,Belum Ada Foto,Belum Ada Deskripsi,236,4.5,0,0,0,0,0,0,0,0,0,0,0,0,0,0,0,0,0,0,0,0,0,0
ChIJD9Lz2gCL0S0RofvL0ap4zYo,Marigold (Gumitir Garden),"P69Q+HFW, Belok/Sidan, Petang, Badung Regency, Bali 80353, Indonesia",Bali,Belum Ada Foto,Belum Ada Deskripsi,117,4.4,0,0,0,0,0,0,0,0,0,0,0,0,0,0,0,0,0,0,0,0,0,0
ChIJKzEcPhcn0i0RujZNRP08gv8,Wahana Wisata Sambhrama Ashram,"Senganan, Penebel, Tabanan Regency, Bali 82152, Indonesia",Bali,Belum Ada Foto,Belum Ada Deskripsi,448,4.5,0,0,0,0,0,0,0,0,0,0,0,0,0,0,0,0,0,0,0,0,0,0
ChIJm7V37gcO0i0RtCs-s4-56oo,Pantai Yeh Malet,"Yeh Malet, Antiga Kelod, Kec. Karangasem, Karangasem Regency, Bali 80871, Indonesia",Bali,Belum Ada Foto,Belum Ada Deskripsi,183,4.3,0,0,0,0,0,0,0,0,0,0,0,0,0,0,0,0,0,0,0,0,0,0
ChIJmRTfT9ZC0i0RRB_NXwb5P2k,Waterblow,"Benoa, South Kuta, Badung Regency, Bali 80363, Indonesia",Bali,Belum Ada Foto,Belum Ada Deskripsi,8853,4.4,0,0,0,0,0,0,0,0,0,0,0,0,0,1,0,0,0,0,0,0,0,0
ChIJwwCS2XFA0i0RwGKRquRfi2s,Big Garden Corner,"Sanur, Jl. Bypass Ngurah Rai, Kesiman, Denpasar Selatan, Kota Denpasar, Bali 80237, Indonesia",Bali,Belum Ada Foto,Belum Ada Deskripsi,5705,4.3,0,0,0,0,0,0,0,0,0,0,0,0,0,0,0,0,0,0,0,0,0,0
ChIJAzxT71kf0i0RdZJCraQLT14,Lembah Bidadari (Angel Valley),"Sangaji, Taro, Kec. Tegallalang, Kabupaten Gianyar, Bali 80561, Indonesia",Bali,Belum Ada Foto,Belum Ada Deskripsi,181,4.3,0,0,0,0,0,0,0,0,0,0,0,0,0,0,0,0,0,0,0,0,0,0
ChIJ3fLUUs9E0i0RP8BFf-NGZiU,Main Entrance GWK Cultural Park,"Jl. Kw. Garuda Wisnu Kencana, Ungasan, Kec. Kuta Sel., Kabupaten Badung, Bali 80361, Indonesia",Bali,Belum Ada Foto,Belum Ada Deskripsi,10949,4.5,0,0,0,0,0,0,0,0,0,0,0,0,0,0,0,0,0,0,0,0,0,0
ChIJM03qlyy51C8R4-g6vxspOrY,Danau Cimpago,"3982+FG6, Kelurahan Purus, Kecamatan Padang Barat, Purus, Padang, Kota Padang, Sumatera Barat 25115, Indonesia",Padang,Belum Ada Foto,Belum Ada Deskripsi,664,4.3,0,0,0,0,0,0,0,0,0,0,0,0,0,0,0,0,0,0,0,0,0,0
ChIJHWMIEgC81C8R80L9kSJvNQc,Taman Siti Nurbaya,"29M5+VV6, Batang Arau, Padang Selatan, Padang City, West Sumatra, Indonesia",Padang,Belum Ada Foto,Belum Ada Deskripsi,500,4.6,0,0,0,0,0,0,0,0,0,0,0,0,0,1,0,0,0,0,0,0,0,0
ChIJIVla7SK61C8RiVcKISmpdKU,Nobita Hill,"Kampung Jua Nan XX, Lubuk Begalung, Padang City, West Sumatra 25153, Indonesia",Padang,Belum Ada Foto,Belum Ada Deskripsi,149,4.5,0,0,0,0,0,0,0,0,0,0,0,0,0,0,0,0,0,0,0,0,0,0
ChIJo0JWABq31C8R-s6nG2HFdpY,Air Terjun Sarasah,"3F8X+VM2, Jl. Koto Baru, Indarung, Kec. Pauh, Kota Padang, Sumatera Barat 25157, Indonesia",Padang,Belum Ada Foto,Belum Ada Deskripsi,123,4.3,0,0,0,0,0,0,0,0,0,0,0,0,0,0,0,0,0,0,0,0,0,0
ChIJAQAAALC61C8RlR_svb6Z8t8,Sako Beach,"West Bungus, Bungus Teluk Kabung, Padang City, West Sumatra 25237, Indonesia",Padang,Belum Ada Foto,Belum Ada Deskripsi,331,4.2,0,0,0,0,0,0,0,0,0,0,0,0,0,0,0,0,0,0,0,0,0,0
ChIJ30kpIy251C8RAs6B0sSUWQ4,Pantai Padang,"Jl. Samudera No.16, Olo, Kec. Padang Bar., Kota Padang, Sumatera Barat 25115, Indonesia",Padang,Belum Ada Foto,Belum Ada Deskripsi,354,4.5,0,0,0,0,0,0,0,0,0,0,0,0,0,0,0,0,0,0,0,0,0,0
ChIJ3YdqAMC21C8R-6D3iiRDxQI,Lubuk Paraku,"3G34+6RR, Indarung, Lubuk Kilangan, Padang City, West Sumatra 25168, Indonesia",Padang,Belum Ada Foto,Belum Ada Deskripsi,212,4.3,0,0,0,0,0,0,0,0,0,0,0,0,0,1,0,0,0,0,0,0,0,0
ChIJT3gqMge41C8RlPlMCCLpX0I,Pemandian Lubuk Tampuruang,"4CPJ+72R, Jalan, Pasar Ambacang, Kuranji, Padang City, West Sumatra 25175, Indonesia",Padang,Belum Ada Foto,Belum Ada Deskripsi,277,4.5,0,0,0,0,0,0,0,0,0,0,0,0,0,1,0,0,0,0,0,0,0,0
ChIJ_1F_BJSl1C8RYZTvdosJUfg,Air terjun Lubuk Hitam,"WCXJ+6C5, North Teluk Kabung, Bungus Teluk Kabung, Padang City, West Sumatra, Indonesia",Padang,Belum Ada Foto,Belum Ada Deskripsi,17,4.9,0,0,0,0,0,0,0,0,0,0,0,0,0,0,0,0,0,0,0,0,0,0
ChIJGf3TSBrB1C8RMtRg5673UR8,Pasir Jambak Beach,"57FX+RHJ, Jl. Pasir Jambak, Pasie Nan Tigo, Kec. Koto Tangah, Kota Padang, Sumatera Barat 25586, Indonesia",Padang,Belum Ada Foto,Belum Ada Deskripsi,123,4.4,0,0,0,0,0,0,0,0,0,0,0,0,0,0,0,0,0,0,0,0,0,0
ChIJIduhBvPG1C8RvL5-3-NLpwQ,Pemandian Lori Lubuk Minturun,"Lubuk Minturun, Koto Tangah, Padang City, West Sumatra 25586, Indonesia",Padang,Belum Ada Foto,Belum Ada Deskripsi,206,4.5,0,0,0,0,0,0,0,0,0,0,0,0,0,0,0,0,0,0,0,0,0,0
ChIJjxP3BdHG1C8RL6A3P6-IGGo,Bendungan Niagara Koto Pulai,"5935+82C, Koto Panjang Ikua Koto, Koto Tangah, Padang City, West Sumatra 25586, Indonesia",Padang,Belum Ada Foto,Belum Ada Deskripsi,158,4.2,0,0,0,0,0,0,0,0,0,0,0,0,0,0,0,0,0,0,0,0,0,0
ChIJcRVmd0651C8Re8cvlAEemYE,Museum Adityawarman,"Jl. Diponegoro No.10, Belakang Tangsi, Kec. Padang Bar., Kota Padang, Sumatera Barat 25114, Indonesia",Padang,Belum Ada Foto,Belum Ada Deskripsi,3141,4.4,0,0,0,0,0,0,0,0,0,0,0,1,0,0,0,0,0,0,0,0,0,0
ChIJq6qqSe271C8RQ47Swhf3NEs,Puncak Bukit Gado-gado,"2998+C8J, Unnamed Road, Sel, Air Manis, Padang Selatan, Padang City, West Sumatra 25117, Indonesia",Padang,Belum Ada Foto,Belum Ada Deskripsi,219,4.6,0,0,0,0,0,0,0,0,0,0,0,0,0,0,0,0,0,0,0,0,0,0
ChIJPdKxCsTA1C8RLLKloW1sgZ4,Pantai Tabing Pasir Putih,"Bungo Pasang, Padang, Padang City, West Sumatra 25586, Indonesia",Padang,Belum Ada Foto,Belum Ada Deskripsi,560,4.4,0,0,0,0,0,0,0,0,0,0,0,0,0,0,0,0,0,0,0,0,0,0
ChIJ01a-tITB1C8RFGjk3lgYvcI,Jambak Sea Turtle Camp,"Jl. Pasir Jambak, Pasie Nan Tigo, Kec. Koto Tangah, Kota Padang, Sumatera Barat 25173, Indonesia",Padang,Belum Ada Foto,Belum Ada Deskripsi,155,4.6,0,0,0,0,0,0,0,0,0,0,0,0,0,0,0,0,0,0,0,0,0,0
ChIJT9wUesPA1C8RaAgop_R4sTc,Pantai Ujuang Batu,"48PJ+3WG, Pasie Nan Tigo, Koto Tangah, Padang City, West Sumatra 25586, Indonesia",Padang,Belum Ada Foto,Belum Ada Deskripsi,299,4.3,0,0,0,0,0,0,0,0,0,0,0,0,0,0,0,0,0,0,0,0,0,0
ChIJ-UJ8ERa51C8RuJM9hRu2sXk,Pantai Puruih Padang,"3982+Q4Q, Purus, Padang Barat, Padang City, West Sumatra 25115, Indonesia",Padang,Belum Ada Foto,Belum Ada Deskripsi,948,4.5,0,0,0,0,0,0,0,0,0,0,0,0,0,0,0,0,0,0,0,0,0,0
ChIJD0aJPenG1C8RUmQN8nD0_Dg,Pemandian Lumin,"595G+MHH, Lubuk Minturun, Koto Tangah, Padang City, West Sumatra 25586, Indonesia",Padang,Belum Ada Foto,Belum Ada Deskripsi,956,4.4,0,0,0,0,0,0,0,0,0,0,0,0,0,0,0,0,0,0,0,0,0,0
ChIJZfQrs0DE1C8R43TIOJwBH_s,Lubuk Ngalauan - River Bangek,"692G+XQ9, Balai Gadang, Koto Tangah, Padang City, West Sumatra 25586, Indonesia",Padang,Belum Ada Foto,Belum Ada Deskripsi,75,4.8,0,0,0,0,0,0,0,0,0,0,0,0,0,0,0,0,0,0,0,0,0,0
ChIJrQXBQU-_1C8RVq_BYWfgZZQ,Taman Muaro Lasak,"39C2+925, Jl. Samudera, Rimbo Kaluang, Kec. Padang Bar., Kota Padang, Sumatera Barat 25115, Indonesia",Padang,Belum Ada Foto,Belum Ada Deskripsi,107,4.3,0,0,0,0,0,0,0,0,0,0,0,0,0,1,0,0,0,0,0,0,0,0
ChIJkWOpoVa_1C8R3c86r627Zrk,Pantai Gajah Padang,"Jl. Gajah III No.14, Air Tawar Bar., Kec. Padang Utara, Kota Padang, Sumatera Barat 25173, Indonesia",Padang,Belum Ada Foto,Belum Ada Deskripsi,374,4.2,0,0,0,0,0,0,0,0,0,0,0,0,0,0,0,0,0,0,0,0,0,0
ChIJGd4hfFjP1C8RjL4WGI4nbTw,Ngungun Saok,"5CWR+978, Lubuk Minturun, Koto Tangah, Padang City, West Sumatra 25586, Indonesia",Padang,Belum Ada Foto,Belum Ada Deskripsi,122,4.7,0,0,0,0,0,0,0,0,0,0,0,0,0,0,0,0,0,0,0,0,0,0
ChIJFZuPviy51C8Rid90lO19yps,Pantai Cimpago Padang,"3982+995, Jl. Samudera, Purus, Kec. Padang Bar., Kota Padang, Sumatera Barat 25115, Indonesia",Padang,Belum Ada Foto,Belum Ada Deskripsi,428,4.5,0,0,0,0,0,0,0,0,0,0,0,0,0,0,0,0,0,0,0,0,0,0
ChIJjcHCdgm71C8R8m6mxAu6PK0,Taman Nirwana,"Teluk Bayur, Padang Selatan, Padang City, West Sumatra 25227, Indonesia",Padang,Belum Ada Foto,Belum Ada Deskripsi,147,4.2,0,0,0,0,0,0,0,0,0,0,0,0,0,0,0,0,0,0,0,0,0,0
ChIJ_VykYZi61C8RLadodbNphDk,Air Terjun Timbulun,"XCHJ+FCG, East Bungus, Bungus Teluk Kabung, Padang City, West Sumatra 25237, Indonesia",Padang,Belum Ada Foto,Belum Ada Deskripsi,18,4.6,0,0,0,0,0,0,0,0,0,0,0,0,0,0,0,0,0,0,0,0,0,0
ChIJhcHu0b7F1C8RpOunWcu_sV0,kawasan wisata sungai bangek,"59P8+QXG, Balai Gadang, Koto Tangah, Padang City, West Sumatra 25586, Indonesia",Padang,Belum Ada Foto,Belum Ada Deskripsi,14,4.6,0,0,0,0,0,0,0,0,0,0,0,0,0,0,0,0,0,0,0,0,0,0
ChIJyQZxzm251C8RYqw6YsA1cbo,Pantai Kota Padang,"Jl. Olo Ladang No.28, Purus, Kec. Padang Bar., Kota Padang, Sumatera Barat, Indonesia",Padang,Belum Ada Foto,Belum Ada Deskripsi,54,4.6,0,0,0,0,0,0,0,0,0,0,0,0,0,0,0,0,0,0,0,0,0,0
ChIJnSWZtaq-1C8RkHquPAiRQ_M,Sitti hill Nurbaya,"29M2+JC2, Jalan Pabayan, Seberang Palinggam, Padang Selatan, Batang Arau, Kec. Padang Sel., Kota Padang, Sumatera Barat 25134, Indonesia",Padang,Belum Ada Foto,Belum Ada Deskripsi,88,4.4,0,0,0,0,0,0,0,0,0,0,0,0,0,1,0,0,0,0,0,0,0,0
ChIJQTCKd5q71C8RcDIGQCwG7Aw,Batu Malin Kundang,"2947+6RG, Air Manis, Indonesia",Padang,Belum Ada Foto,Belum Ada Deskripsi,2182,4.1,0,0,0,0,0,0,0,0,0,0,0,0,0,0,0,0,0,0,0,0,0,0
ChIJyXzR0rG71C8RmPw82NwCUCA,Bukit Paralayang Air Manis,"Air Manis, Padang Selatan, Padang City, West Sumatra 25117, Indonesia",Padang,Belum Ada Foto,Belum Ada Deskripsi,161,4.6,1,0,0,0,0,0,0,0,0,0,0,0,0,0,0,0,0,0,0,0,0,0
ChIJk6UHkbS31C8R4oKb7INrmZg,Air Terjun Ambun Suri,"3FPM+P34, Limau Manis Selatan, Pauh, Limau Manis Sel., Padang, Kota Padang, Sumatera Barat 25175, Indonesia",Padang,Belum Ada Foto,Belum Ada Deskripsi,27,4.3,0,0,0,0,0,0,0,0,0,0,0,0,0,0,0,0,0,0,0,0,0,0
ChIJ5woubOC51C8RqbAxZoBA79s,Pantai Purus Padang,"29V3+28C, Jl. Samudera, Belakang Tangsi, Kec. Padang Bar., Kota Padang, Sumatera Barat, Indonesia",Padang,Belum Ada Foto,Belum Ada Deskripsi,66,4.5,0,0,0,0,0,0,0,0,0,0,0,0,0,0,0,0,0,0,0,0,0,0
ChIJl_MmUNG51C8R6oN7Pu6aiiY,Taplau Pantai Padang,"Jl. Samudera No.66, Olo, Kec. Padang Bar., Kota Padang, Sumatera Barat 25117, Indonesia",Padang,Belum Ada Foto,Belum Ada Deskripsi,32,4.7,0,0,0,0,0,0,0,0,0,0,0,0,0,0,0,0,0,0,0,0,0,0
ChIJ4YxnW5G51C8Ruw-q7ylnVR0,Objek Wisata Batang Arau Padang,"29M5+PHF, Jl. Kp. Batu, Batang Arau, Kec. Padang Sel., Kota Padang, Sumatera Barat, Indonesia",Padang,Belum Ada Foto,Belum Ada Deskripsi,21,4.4,0,0,0,0,0,0,0,0,0,0,0,0,0,0,0,0,0,0,0,0,0,0
ChIJC6A2klm51C8R6UNVCnmXpgY,Kelenteng See Hin Kiong,"29Q7+43X, Jl. Kelenteng, Kp. Pd., Kec. Padang Sel., Kota Padang, Sumatera Barat 25134, Indonesia",Padang,Belum Ada Foto,Belum Ada Deskripsi,535,4.6,0,0,0,0,0,0,0,0,0,0,0,0,0,0,1,0,0,0,0,0,0,0
ChIJSxp73v-71C8R2qax07-OjUM,Pasar Siti Nurbaya,"29M2+FG8, Batang Arau, Padang Selatan, Padang City, West Sumatra, Indonesia",Padang,Belum Ada Foto,Belum Ada Deskripsi,23,4.7,0,0,0,0,0,0,0,0,0,0,0,0,0,0,0,0,0,0,0,0,0,0
ChIJnfsJ1imk1C8RWdxMTNgED6o,"Banana River, Padang Kota subdistrict Bungus","V9MP+8MR, Unnamed Road, Tlk. Kabung Sel., Kec. Bungus Tlk. Kabung, Kota Padang, Sumatera Barat 25237, Indonesia",Padang,Belum Ada Foto,Belum Ada Deskripsi,497,4.4,0,0,0,0,0,0,0,0,0,0,0,0,0,0,0,0,0,0,0,0,0,0
ChIJhbTFfBWl1C8RwbO3tT8bpbQ,Pantai Pesona,"WCQ8+W26, North Teluk Kabung, Bungus Teluk Kabung, Padang City, West Sumatra 25237, Indonesia",Padang,Belum Ada Foto,Belum Ada Deskripsi,95,4.4,0,0,0,0,0,0,0,0,0,0,0,0,0,0,0,0,0,0,0,0,0,0
ChIJvzH9GDO51C8RHwY5chxQ2xU,Padang Beach,"Padang Beach, Purus, Padang Barat, Padang City, West Sumatra 25115, Indonesia",Padang,Belum Ada Foto,Belum Ada Deskripsi,6341,4.5,0,0,0,0,0,0,0,0,0,0,0,0,1,0,0,0,0,0,0,0,0,0
ChIJ24_CtR7F1C8RjNP6YJYPRgU,Taman Wisata Bukit Bidadari Kasang,"6985+HJ6, Jl. Korong Jambak, Kasang, Kec. Koto Tangah, Kota Padang, Sumatera Barat 25586, Indonesia",Padang,Belum Ada Foto,Belum Ada Deskripsi,23,4.6,0,0,0,0,0,0,0,0,0,0,0,0,0,0,0,0,0,0,0,0,0,0
ChIJ8xkjjdm41C8R03CQNCOI-us,Masjid Raya Sumatera Barat,"39G6+7XG, Jl. Khatib Sulaiman, Alai Parak Kopi, Kec. Padang Utara, Kota Padang, Sumatera Barat 25173, Indonesia",Padang,Belum Ada Foto,Belum Ada Deskripsi,19440,4.8,0,0,0,0,0,0,0,0,0,0,1,0,0,0,1,0,0,0,0,0,0,0
ChIJd5h7MB631C8R4nS7mV_AenA,Taman Rusa Bukit Atas,"3F2M+JH9, Indarung, Lubuk Kilangan, Padang City, West Sumatra 25168, Indonesia",Padang,Belum Ada Foto,Belum Ada Deskripsi,12,4.7,0,0,0,0,0,0,0,0,0,0,0,0,0,0,0,0,0,0,0,0,0,0
ChIJKSh8_Uy71C8RuFJJeOyuS9A,Pantai Ujuang Kabun padang sumatera barat.,"29C6+53J, Air Manis, Padang Selatan, Padang City, West Sumatra, Indonesia",Padang,Belum Ada Foto,Belum Ada Deskripsi,16,4.8,0,0,0,0,0,0,0,0,0,0,0,0,0,0,0,0,0,0,0,0,0,0
ChIJO4M75APB1C8R8HCBV2g7jZM,Pantai Pinus Tabing,"48PM+62F, Pasie Nan Tigo, Koto Tangah, Padang City, West Sumatra 25586, Indonesia",Padang,Belum Ada Foto,Belum Ada Deskripsi,11,4.9,0,0,0,0,0,0,0,0,0,0,0,0,0,0,0,0,0,0,0,0,0,0
ChIJgUqtjW271C8RPBSEN5yHIvQ,Pantai Kampoeang Tingga,"Jl. Pantai Air Manis, RT.001/RW.001, Air Manis, Kec. Padang Sel., Kota Padang, Sumatera Barat, Indonesia",Padang,Belum Ada Foto,Belum Ada Deskripsi,51,4.6,0,0,0,0,0,0,0,0,0,0,0,0,0,0,0,0,0,0,0,0,0,0
ChIJ6aH13Na71C8REpoi0QzxqtU,Kelok View Teluk Bayur,"Jl. Padang - Bengkulu No.35-37, Tlk. Bayur, Kec. Padang Sel., Kota Padang, Sumatera Barat 25216, Indonesia",Padang,Belum Ada Foto,Belum Ada Deskripsi,83,4.7,0,0,0,0,0,0,0,0,0,0,0,0,0,0,0,0,0,0,0,0,0,0
ChIJz1sCfKi71C8RKwo8AHBUqMU,Marawa Beach Club,"Pantai, Air Manis, Kec. Padang Sel., Kota Padang, Sumatera Barat 25217, Indonesia",Padang,Belum Ada Foto,Belum Ada Deskripsi,1205,3.9,0,0,0,0,0,1,0,0,0,0,0,0,0,0,0,1,0,0,0,0,0,0
