place_id,place_name,place_address,city/regency,image,desc,total_review,ave_rating,art_gallery,bakery,bar,cafe,food,liquor_store,lodging,meal_delivery,meal_takeaway,night_club,restaurant,school,store
ChIJzRR1QYwWei4Rh_RvD_QvSwE,Taman Bali Vegetarian Restaurant,"Jl. Moh. Saleh Wedisastro No.4, Setabelan, Kec. Banjarsari, Kota Surakarta, Jawa Tengah 57139, Indonesia",Surakarta,Belum Ada Foto,Belum Ada Deskripsi,346,4.6,0,0,0,0,1,0,0,0,0,0,1,0,0
ChIJHUOuL2IWei4R8oOTjOJz10Q,Nasi Campur Bali Gus Yan,"57139, Punggawan, Kec. Banjarsari, Kota Surakarta, Jawa Tengah 57131, Indonesia",Surakarta,Belum Ada Foto,Belum Ada Deskripsi,3,4.0,0,0,0,0,1,0,0,0,0,0,1,0,0
ChIJW5dFG_MWei4RadsJ6wcpGok,Nasi Bali Merthasari,"Jl. Irian No.38, Tegalharjo, Kec. Jebres, Kota Surakarta, Jawa Tengah 57129, Indonesia",Surakarta,Belum Ada Foto,Belum Ada Deskripsi,110,4.5,0,0,0,0,1,0,0,0,0,0,1,0,0
ChIJ9w7P-WsWei4R2PaAqN_T8oM,Nasi Jinggo Bali 58,"Jl. Brigjen Sudiarto, Danukusuman, Kec. Serengan, Kota Surakarta, Jawa Tengah 57156, Indonesia",Surakarta,Belum Ada Foto,Belum Ada Deskripsi,4,5.0,0,0,0,0,1,0,0,0,0,0,1,0,0
ChIJr0dgN4IWei4RzbvoqC6i1Zc,Bali Resto,"LGF , Solo Paragon , JL. Yosodipuro , Keprabon, Banjar Sari, 57130 Solo, Jawa Tengah, Mangkubumen, Banjarsari, Surakarta City, Central Java 57139, Indonesia",Surakarta,Belum Ada Foto,Belum Ada Deskripsi,2,2.0,0,0,0,0,1,0,0,0,0,0,1,0,0
ChIJS3qvnbQXei4RIAFn7wYaHv0,"""Bli Made "" Masakan Khas Bali (Pak Gendut Limolasan)","Jl. RE Martadinata No.98, Sudiroprajan, Kec. Jebres, Kota Surakarta, Jawa Tengah 57121, Indonesia",Surakarta,Belum Ada Foto,Belum Ada Deskripsi,1,3.0,0,0,0,0,1,0,0,0,0,0,1,0,0
ChIJ8yJa_OMXei4Ri0duyVd8hgc,Babi Guling Bli Kadek,"Jl. RE Martadinata No.127, Sudiroprajan, Kec. Jebres, Kota Surakarta, Jawa Tengah 57121, Indonesia",Surakarta,Belum Ada Foto,Belum Ada Deskripsi,1246,4.6,0,0,0,0,1,0,0,0,0,0,1,0,0
ChIJ8RN0UaoXei4R9ol439F6Bzo,Kedai Es Dengan Mas Agung Ala Jawa Bali 354,"CVJ5+JG7, Jl. Ir. Juanda, Pucangsawit, Kec. Jebres, Kota Surakarta, Jawa Tengah 57125, Indonesia",Surakarta,Belum Ada Foto,Belum Ada Deskripsi,5,4.2,0,0,0,0,1,0,0,0,1,0,1,0,0
ChIJu8q8IUkXei4R8w0GvOF7g8c,WAJAN BUDE,"Jl. Bali No.25, Kp. Baru, Kec. Ps. Kliwon, Kota Surakarta, Jawa Tengah 57133, Indonesia",Surakarta,Belum Ada Foto,Belum Ada Deskripsi,1,5.0,0,0,0,0,1,0,0,0,0,0,1,0,0
ChIJNemZW8gVei4R0jDsQohqq8Y,Bali Solo Javanese Resto,"Jl. Apel III No.58, Jajar, Kec. Laweyan, Kota Surakarta, Jawa Tengah 57144, Indonesia",Surakarta,Belum Ada Foto,Belum Ada Deskripsi,131,4.7,0,0,0,0,1,0,0,0,0,0,1,0,0
ChIJwf1_djAXei4Rt6dHPasY3NQ,Bakmi Jowo Mbak Bali,"CR58+5Q4, Bangorwo, Kwarasan, Grogol, Sukoharjo Regency, Central Java 57552, Indonesia",Surakarta,Belum Ada Foto,Belum Ada Deskripsi,2,3.0,0,0,0,0,1,0,0,0,0,0,1,0,0
ChIJ9_hPG_MWei4RWlaGt44XbLc,Merthasari Babi Guling,"Jl. Irian, Tegalharjo, Kec. Jebres, Kota Surakarta, Jawa Tengah 57129, Indonesia",Surakarta,Belum Ada Foto,Belum Ada Deskripsi,45,3.9,0,0,0,0,1,0,0,0,0,0,1,0,0
ChIJf6nY3CAUei4RkIVfHHbTHZs,Pondok Jowi,"Jl. Kasuari II No.1, Manahan, Kec. Banjarsari, Kota Surakarta, Jawa Tengah 57139, Indonesia",Surakarta,Belum Ada Foto,Belum Ada Deskripsi,2108,4.4,0,0,0,0,1,0,0,0,0,0,1,0,0
ChIJU_2akZsXei4RMCls8gaimiU,Dapur Nyonyah Besar Solo,"Jl. Irian No.33, Tegalharjo, Kec. Jebres, Kota Surakarta, Jawa Tengah 57129, Indonesia",Surakarta,Belum Ada Foto,Belum Ada Deskripsi,1,5.0,0,0,0,0,1,0,0,0,0,0,1,0,0
ChIJs-g2Gb4Wei4RMtUHghAQkaA,Angkringan Omahe Whawin,"Jl. Kelud Selatan no.42, Jl. Nayu Utara Kelurahan No.Rt 01/05, Joglo, Kec. Banjarsari, Kota Surakarta, Jawa Tengah 57136, Indonesia",Surakarta,Belum Ada Foto,Belum Ada Deskripsi,2134,4.4,0,0,0,0,1,0,0,0,0,0,1,0,0
ChIJW7F1GFcWei4RWU6mvytkqYg,"Babi Kuah Rica Babi ""Mbak Indri""","CRHW+M7C, Jl. Ir. Juanda, Sewu, Kec. Jebres, Kota Surakarta, Jawa Tengah 57129, Indonesia",Surakarta,Belum Ada Foto,Belum Ada Deskripsi,2,2.0,0,0,0,0,1,0,0,0,0,0,1,0,0
ChIJfa0K0GQWei4R5r8Imyp2ko8,Angkringan Om Dims,"Jl. Gatot Subroto No.144, Jayengan, Kec. Serengan, Kota Surakarta, Jawa Tengah 57152, Indonesia",Surakarta,Belum Ada Foto,Belum Ada Deskripsi,23,4.8,0,0,0,0,1,0,0,0,0,0,1,0,0
ChIJI2U9sBgXei4RBplRTLe7ikA,Alamama Resto,"Jl. Gajahmada No.42, Timuran, Kec. Banjarsari, Kota Surakarta, Jawa Tengah 57131, Indonesia",Surakarta,Belum Ada Foto,Belum Ada Deskripsi,1652,4.8,0,0,0,0,1,0,0,0,0,0,1,0,0
ChIJS2qDAWAWei4RrIwm66MMTLY,Kedai Babi Ming,"Jl. Suryopranoto No.33-51, Kepatihan Wetan, Kec. Jebres, Kota Surakarta, Jawa Tengah 57129, Indonesia",Surakarta,Belum Ada Foto,Belum Ada Deskripsi,25,4.7,0,0,0,0,1,0,0,0,0,0,1,0,0
ChIJx6BJIcZG0i0REuLK4Co7HUI,Un's Restaurant - Bali,"Jl. Pantai Kuta Jl. Poppies II, Kuta, Kec. Kuta, Kabupaten Badung, Bali 80361, Indonesia",Bali,Belum Ada Foto,Belum Ada Deskripsi,499,4.6,0,0,0,0,1,0,0,0,0,0,1,0,0
ChIJy0JszGxH0i0RocRhbrUkd1w,Ling-Ling's Bali,"Jl. Petitenget No.43B, Kerobokan Kelod, Kec. Kuta Utara, Kabupaten Badung, Bali 80316, Indonesia",Bali,Belum Ada Foto,Belum Ada Deskripsi,5298,4.8,0,0,0,0,1,0,0,0,0,0,1,0,0
ChIJvdB3_GpH0i0RlaTq17KvbR0,Barbacoa,"Petitenget St No.14, Kerobokan Kelod, Kuta Utara, Badung Regency, Bali 80361, Indonesia",Bali,Belum Ada Foto,Belum Ada Deskripsi,1640,4.7,0,0,0,0,1,0,0,0,0,0,1,0,0
ChIJAXhicxJH0i0RLNdqBd88iSk,Bambu Bali - Seminyak,"Jl. Petitenget No.198, Kerobokan Kelod, Kec. Kuta Utara, Kabupaten Badung, Bali 80361, Indonesia",Bali,Belum Ada Foto,Belum Ada Deskripsi,1082,4.6,0,0,0,0,1,0,0,0,0,0,1,0,0
ChIJ74RaGRNH0i0RIJ83QmJQS9M,Kaum Bali,"Jl. Petitenget No.51B, Kerobokan Kelod, Kec. Kuta Utara, Kabupaten Badung, Bali 80361, Indonesia",Bali,Belum Ada Foto,Belum Ada Deskripsi,435,4.7,0,0,1,0,1,0,0,0,0,0,1,0,0
ChIJceqfUrYj0i0R3AKPH-aEZmM,Warung Umah Bali,"Jl. Keliki Kawan, Kelusa, Kec. Payangan, Kabupaten Gianyar, Bali 80561, Indonesia",Bali,Belum Ada Foto,Belum Ada Deskripsi,325,5.0,0,0,0,0,1,0,0,0,0,0,1,0,0
ChIJvcoIMohH0i0RoOUc_GcwCoM,Balagra Resto Bali,"Jl. Sunset Road No.88A, Kuta, Kec. Kuta, Kabupaten Badung, Bali 80361, Indonesia",Bali,Belum Ada Foto,Belum Ada Deskripsi,32,4.9,0,0,0,0,1,0,0,0,0,0,1,0,0
ChIJ28dn2hdH0i0RMJGidoQ8ilw,Mamasan Bali,"Jl. Raya Kerobokan No.135, Kerobokan Kelod, Kec. Kuta Utara, Kabupaten Badung, Bali 80361, Indonesia",Bali,Belum Ada Foto,Belum Ada Deskripsi,3031,4.5,0,0,1,0,1,0,0,0,0,1,1,0,0
ChIJ_9jHzR5d0i0Rkm0FXWXqIMY,Pala Restaurant & Rooftop Bar,"Jl. Raya Nusa Dua Selatan, Sawangan, Nusa Dua, Kabupaten Badung, Bali 80361, Indonesia",Bali,Belum Ada Foto,Belum Ada Deskripsi,70,4.8,0,0,0,0,1,0,0,0,0,0,1,0,0
ChIJNz1dVBdH0i0Rpn8u0cr9drY,Cafe Bali,"Jalan Laksmana (Kayu Aya Seminyak Kuta, Kerobokan Kelod, Kec. Kuta Utara, Kabupaten Badung, Bali 80361, Indonesia",Bali,Belum Ada Foto,Belum Ada Deskripsi,1545,4.4,0,0,0,0,1,0,0,0,0,0,1,0,0
ChIJ0x7UGRRH0i0RKa1AnlBmNfQ,Sangsaka Restaurant,"Jalan Pangkung Sari No. 100 Kerobokan, Kerobokan Kelod, Kec. Kuta Utara, Kabupaten Badung, Bali 80361, Indonesia",Bali,Belum Ada Foto,Belum Ada Deskripsi,998,4.7,0,0,0,0,1,0,0,0,0,0,1,0,0
ChIJscGAa6JH0i0RAQWv3Vuav1Q,The bali kitchen warung seminyak,"Jl. Drupadi II, Seminyak, Kec. Kuta, Kabupaten Badung, Bali 80361, Indonesia",Bali,Belum Ada Foto,Belum Ada Deskripsi,11,5.0,0,0,0,0,1,0,0,0,0,0,1,0,0
ChIJp7V6o2FE0i0R0Vpk0XMjS4M,Cuca Restaurant,"Jl. Yoga Perkanthi, Jimbaran, Kec. Kuta Sel., Kabupaten Badung, Bali 80364, Indonesia",Bali,Belum Ada Foto,Belum Ada Deskripsi,2883,4.7,0,0,1,0,1,0,0,0,0,0,1,0,0
ChIJh5_-zCRH0i0RZ-5N2hPzs6A,Uni Restaurant,"Jl. Pantai Berawa No.99, Tibubeneng, Kec. Kuta Utara, Kabupaten Badung, Bali 80361, Indonesia",Bali,Belum Ada Foto,Belum Ada Deskripsi,152,4.4,0,0,1,0,1,0,0,0,0,0,1,0,0
ChIJhYe90IdH0i0R3qavUpKXm_Q,Iwa Restaurant at Hotel Tugu Bali,"Jl. Pantai Batu Bolong, Canggu, Kec. Kuta Utara, Kabupaten Badung, Bali 80361, Indonesia",Bali,Belum Ada Foto,Belum Ada Deskripsi,132,4.7,0,0,0,0,1,0,0,0,0,0,1,0,0
ChIJu1ylVQxH0i0Rq2OcjxipzTU,FIRE,"Jl. Petitenget Kerobokan, Seminyak, Kec. Kuta Utara, Kabupaten Badung, Bali 80361, Indonesia",Bali,Belum Ada Foto,Belum Ada Deskripsi,275,4.6,0,0,0,0,1,0,0,0,0,0,1,0,0
ChIJh3iFG8Rc0i0Rdn7vSvmbcTA,Paon Bali Resto & Bar,"56F9+GHP, Benoa, South Kuta, Badung Regency, Bali, Indonesia",Bali,Belum Ada Foto,Belum Ada Deskripsi,31,4.4,0,0,0,0,1,0,0,0,0,0,1,0,0
ChIJqeMeDN1G0i0R3f77UJU73Os,Balibagus Resto,"Jln Padma Utara St Legian Kuta, Legian, Kec. Kuta, Kabupaten Bandung, Bali 80361, Indonesia",Bali,Belum Ada Foto,Belum Ada Deskripsi,97,4.5,0,0,0,0,1,0,0,0,0,0,1,0,0
ChIJKWD5VBdH0i0ReivZYCJIm24,BATIK Restaurant Bar,"Jalan Kayu Aya, Seminyak, Kerobokan Kelod, Kec. Kuta Utara, Bali, 80361, Indonesia",Bali,Belum Ada Foto,Belum Ada Deskripsi,1285,4.5,0,0,1,0,1,0,0,0,0,0,1,0,0
ChIJo1GWBj490i0RXWp2SA0I2ZA,BLANCO par Mandif,"Kompleks Museum Blanco, Jl. Raya Tjampuhan, Ubud, Sayan, Kec. Gianyar, Kabupaten Gianyar, Bali 80571, Indonesia",Bali,Belum Ada Foto,Belum Ada Deskripsi,268,4.7,0,0,0,0,1,0,0,0,0,0,1,0,0
ChIJYewZo6RG0i0Rz6Dix0xA-dk,Gabah Restaurant & Bar,"Jalan Bakung Sari, Kuta, Kec. Kuta, Kabupaten Badung, Bali 80361, Indonesia",Bali,Belum Ada Foto,Belum Ada Deskripsi,669,4.2,0,0,0,0,1,0,0,0,0,0,1,0,0
ChIJHYu1nRlH0i0RdPb1-zIWMgw,Mauri Restaurant,"Jl. Petitenget No.100, Seminyak, Kec. Kuta Utara, Kabupaten Badung, Bali 80361, Indonesia",Bali,Belum Ada Foto,Belum Ada Deskripsi,677,4.7,0,0,0,0,1,0,0,0,0,0,1,0,0
ChIJURMfBbYi0i0RFB8UdQswuY4,Jungle Fish Bali,"Jl. Raya Sebali, Keliki, Kec. Payangan, Kabupaten Gianyar, Bali 80561, Indonesia",Bali,Belum Ada Foto,Belum Ada Deskripsi,1458,4.6,0,0,0,0,1,0,0,0,0,0,1,0,0
ChIJ2e7HkX4i0i0R_Xq96K4pFd8,Boni Bali Restaurant,"Jl. Pakudui, Kedisan, Kec. Tegallalang, Kabupaten Gianyar, Bali 80561, Indonesia",Bali,Belum Ada Foto,Belum Ada Deskripsi,156,4.3,0,0,0,0,1,0,0,0,0,0,1,0,0
ChIJQZUR291G0i0RW9WfrUPX4jI,Chapter 2 Restaurant & Bar,"8528+6VC, Jl. Werkudara, Legian, Kec. Kuta, Kabupaten Badung, Bali 80361, Indonesia",Bali,Belum Ada Foto,Belum Ada Deskripsi,481,4.4,0,0,0,0,1,0,0,0,0,0,1,0,0
ChIJdZa5pqdD0i0R6S9PqkjLIFY,Bumbu Bali Restaurant & Cooking School,"Jl. Pratama, Tanjung, Benoa, Kec. Kuta Sel., Kabupaten Badung, Bali 80363, Indonesia",Bali,Belum Ada Foto,Belum Ada Deskripsi,905,4.4,0,0,0,0,1,0,0,0,0,0,1,0,0
ChIJZRao86M90i0RWDXbSIypCzw,Wedja Bali,"Jl. Ambarwati No.1, MAS, Kecamatan Ubud, Kabupaten Gianyar, Bali 80571, Indonesia",Bali,Belum Ada Foto,Belum Ada Deskripsi,799,4.8,0,0,0,1,1,0,0,0,0,0,1,0,0
ChIJE1ain2xH0i0RUX3mQnPBkVg,Pendopo Bali,"Jl. Petitenget No.25, Kerobokan Kelod, Kec. Kuta Utara, Kabupaten Badung, Bali 80361, Indonesia",Bali,Belum Ada Foto,Belum Ada Deskripsi,10,4.4,0,0,0,1,1,0,0,0,0,0,1,0,0
ChIJucE2utxG0i0RwWfd1phccH8,Bale Banjar Restaurant,"Jl. Melasti Legian Kelod, Legian, Kec. Kuta, Bali 80361, Indonesia",Bali,Belum Ada Foto,Belum Ada Deskripsi,10,4.5,0,0,0,0,1,0,0,0,0,0,1,0,0
ChIJ63XU7Lwi0i0R1SXlTl1pUx4,Labak Sari Restaurant,"Jl. Tirta Tawar, Br. Abangan, 80571, Ubud 80571, Ubud, Tegallalang, Gianyar Regency, Bali 80571, Indonesia",Bali,Belum Ada Foto,Belum Ada Deskripsi,497,4.7,0,0,0,0,1,0,0,0,0,0,1,0,0
ChIJ7aMbz9Ii0i0RoGosbyjUuNs,Kubu at Mandapa,"Jl. Raya Kedewatan, Banjar, Kedewatan, Kecamatan Ubud, Kabupaten Gianyar, Bali 80571, Indonesia",Bali,Belum Ada Foto,Belum Ada Deskripsi,269,4.8,0,0,0,0,1,0,0,0,0,0,1,0,0
ChIJQVn3YsdG0i0R9PrNddjDEVY,Nasi Bali Restaurant Legian,"Jln Legian No.155, Kuta, Badung Regency, Bali 80361, Indonesia",Bali,Belum Ada Foto,Belum Ada Deskripsi,176,4.3,0,0,1,0,1,0,0,0,0,1,1,0,0
ChIJ32RppuFG0i0RX2mUvnb758E,The Plantation Grill - Seminyak,"Seminyak, Kuta, Badung Regency, Bali 80361, Indonesia",Bali,Belum Ada Foto,Belum Ada Deskripsi,477,4.7,0,0,1,0,1,0,0,0,0,0,1,0,0
ChIJj0tR_mpH0i0RP5h_ieNuzAs,La Baracca Bali,"Petitenget St No.17D, Kerobokan, Kuta Utara, Badung Regency, Bali 80361, Indonesia",Bali,Belum Ada Foto,Belum Ada Deskripsi,796,4.3,0,0,0,0,1,0,0,0,0,0,1,0,0
ChIJsZNw9T1D0i0R5jJEUBWUOC4,Raja Bali - Balinese Authentic Restaurant & Activities (Main Restaurant),"Jl. Pratama No.808 B, Nusa Dua, Kec. Kuta Sel., Kabupaten Badung, Bali 80361, Indonesia",Bali,Belum Ada Foto,Belum Ada Deskripsi,31,5.0,0,0,0,0,1,0,0,0,0,0,1,0,0
ChIJm_sdCNNc0i0RIJmaIzLcoJA,Kayuputi Restaurant,"Kawasan Pariwisata, Nusa Dua, Badung Regency, Bali 80363, Indonesia",Bali,Belum Ada Foto,Belum Ada Deskripsi,423,4.7,0,0,0,0,1,0,0,0,0,0,1,0,0
ChIJ33dBrSU90i0RLfghMTgPn_c,The Sayan House,"Jl. Raya Sayan No.70, Sayan, Kecamatan Ubud, Kabupaten Gianyar, Bali 80571, Indonesia",Bali,Belum Ada Foto,Belum Ada Deskripsi,1535,4.6,0,0,1,0,1,0,0,0,0,0,1,0,0
ChIJTd5rcPY90i0Roq75vXLBX0s,Bali Moon Resto,"C7XJ+XMJ, Jl. Ir. Sutami, Kemenuh, Kec. Sukawati, Kabupaten Gianyar, Bali 80582, Indonesia",Bali,Belum Ada Foto,Belum Ada Deskripsi,155,4.5,0,0,0,0,1,0,0,0,0,0,1,0,0
ChIJJQRm22tH0i0Ri039M0Bg1yE,Nook,"Jl. Umalas 1 No.3, Kerobokan Kelod, Kec. Kuta Utara, Kabupaten Badung, Bali 80361, Indonesia",Bali,Belum Ada Foto,Belum Ada Deskripsi,10692,4.5,0,0,0,0,1,0,0,0,0,0,1,0,0
ChIJJR9--cr10S0R-jkErGbhQ2w,The Amora Bali,"Penelokan Main Rd No.999, Central Batur, Kintamani, Bangli Regency, Bali 80652, Indonesia",Bali,Belum Ada Foto,Belum Ada Deskripsi,2574,4.4,0,0,0,1,1,0,0,0,0,0,1,0,1
ChIJnR2CHVMn0i0RTMiLHPH3cfU,Samiya Restaurant,"Banjar Pacung, Jl. Baturiti - Mekarsari, Mekarsari, Baturiti, Kec. Baturiti, Kabupaten Tabanan, Bali 82191, Indonesia",Bali,Belum Ada Foto,Belum Ada Deskripsi,128,4.3,0,0,0,0,1,0,0,0,0,0,1,0,0
ChIJDwSD1V9H0i0RJmcyC7pyQM8,Jaansan Bali Restaurant,"Jl. Petitenget No.40X, Seminyak, Kec. Kuta Utara, Kabupaten Badung, Bali 80361, Indonesia",Bali,Belum Ada Foto,Belum Ada Deskripsi,481,4.6,0,0,0,0,1,0,0,0,0,0,1,0,0
ChIJk0rRixJH0i0RLUg5-J_2IEE,Merah Putih,"Jl. Petitenget No.100X, Kerobokan Kelod, Kec. Kuta Utara, Kabupaten Badung, Bali 80361, Indonesia",Bali,Belum Ada Foto,Belum Ada Deskripsi,1762,4.5,0,0,0,0,1,0,0,0,0,0,1,0,0
ChIJeXc1-ipb0i0RmdUPeXqvKXk,Warung Bali Bambu Sari,"Jl. Kauripan No.2, Kuta, Kec. Kuta, Kabupaten Badung, Bali 80361, Indonesia",Bali,Belum Ada Foto,Belum Ada Deskripsi,91,4.6,0,0,0,0,1,0,0,0,0,0,1,0,0
ChIJu6_YG74Wei4RtHGPKdjguqg,Ubud Balinya Solo,"Jl.kelud selatan, Jl. Nayu Kelurahan No.42, RW.05, joglo, Kec. Banjarsari, Kota Surakarta, Jawa Tengah 57135, Indonesia",Surakarta,Belum Ada Foto,Belum Ada Deskripsi,174,4.6,0,0,0,1,1,0,0,0,0,0,0,0,0
ChIJj2YYRMBc0i0R4VItC_wL_Hw,"Bejana, Indonesian Restaurant at The Ritz-Carlton, Bali","The Ritz-Carlton, Sawangan, Benoa, Kec. Kuta Sel., Kabupaten Badung, Bali 80361, Indonesia",Bali,Belum Ada Foto,Belum Ada Deskripsi,151,4.7,0,0,0,0,1,0,0,0,0,0,1,0,0
ChIJySXvVVc90i0RdOkVA_NwHEo,CasCades Restaurant,"Jl. Lanyahan, Br. Nagi, Kecamatan Ubud, Kabupaten Gianyar, Bali 80571, Indonesia",Bali,Belum Ada Foto,Belum Ada Deskripsi,307,4.7,0,0,0,0,1,0,0,0,0,0,1,0,0
ChIJn_yYvYtE0i0R-ZZOyt4OBN0,Balique,"Uluwatu St No.39, Jimbaran, South Kuta, Badung Regency, Bali 80361, Indonesia",Bali,Belum Ada Foto,Belum Ada Deskripsi,750,4.4,0,0,0,0,1,0,0,0,0,0,1,0,0
ChIJ_Q5n311A0i0R4yKG_eF9H3I,The Restaurant at The Legian Seminyak,"Jl. Kayu Aya, Seminyak, beach, Kabupaten Badung, Bali, Indonesia",Bali,Belum Ada Foto,Belum Ada Deskripsi,216,4.6,0,0,0,0,1,0,0,0,0,0,1,0,0
ChIJyTMoqWQWei4R1S23pHLQOeM,"RM MASAKAN PADANG SELAMAT BARU ,SOLO","Jl. Dr. Rajiman, Bumi, Kec. Serengan, Kota Surakarta, Jawa Tengah 57151, Indonesia",Surakarta,Belum Ada Foto,Belum Ada Deskripsi,296,4.6,0,0,0,0,1,0,0,0,0,0,1,0,0
ChIJxTDdpGYWei4RHcaS72FiZlY,Ampera Uni Nora,"Jl. K.H Hasyim Ashari No.43, Kauman, Kec. Ps. Kliwon, Kota Surakarta, Jawa Tengah 57112, Indonesia",Surakarta,Belum Ada Foto,Belum Ada Deskripsi,135,4.5,0,0,0,0,1,0,0,0,0,0,1,0,0
ChIJWY8T72sWei4RqcRO5g049i0,Warung Padang Pak Haji Jamal,"Jl. Veteran No.62, Joyosuran, Kec. Ps. Kliwon, Kota Surakarta, Jawa Tengah 57116, Indonesia",Surakarta,Belum Ada Foto,Belum Ada Deskripsi,58,4.3,0,0,0,0,1,0,0,0,0,0,1,0,0
ChIJfxRGnWkWei4RL9enN4UEMNI,Rumah Makan Barokah Riyadh,"CR8H+XCR, Jl. Ibu Pertiwi, Semanggi, Kec. Ps. Kliwon, Kota Surakarta, Jawa Tengah 57118, Indonesia",Surakarta,Belum Ada Foto,Belum Ada Deskripsi,1,4.0,0,0,0,0,1,0,0,0,0,0,1,0,0
ChIJKZMQy2MWei4RERBm9e48xHY,Cahaya 5 Padang Restaurant,"CRHF+PMH, Slamet Riyadi St, Keprabon, Banjarsari, Surakarta City, Central Java 57151, Indonesia",Surakarta,Belum Ada Foto,Belum Ada Deskripsi,107,4.4,0,0,0,0,1,0,0,0,0,0,1,0,0
ChIJJUJOXIcWei4RmzScZyZA3qo,RM Sederhana Padang Kleco,"Slamet Riyadi St No.469, Pajang, Laweyan, Surakarta City, Central Java 57146, Indonesia",Surakarta,Belum Ada Foto,Belum Ada Deskripsi,3374,4.5,0,0,0,0,1,0,0,0,0,0,1,0,0
ChIJhQfn714Xei4RrkKMGNL0KqQ,Rumah Makan Padang Uda Madi,"Jl. Teuku Umar No.72, Keprabon, Kec. Banjarsari, Kota Surakarta, Jawa Tengah 57131, Indonesia",Surakarta,Belum Ada Foto,Belum Ada Deskripsi,165,4.6,0,0,0,0,1,0,0,0,0,0,1,0,0
ChIJ3bZQlIcWei4RpDIQ3IpvO9s,RM Sari Bundo,"Jl. Gajahmada No.36, Timuran, Kec. Banjarsari, Kota Surakarta, Jawa Tengah 57131, Indonesia",Surakarta,Belum Ada Foto,Belum Ada Deskripsi,888,4.2,0,0,0,0,1,0,0,0,0,0,1,0,0
ChIJX1v0xIYWei4RquRJOtUlDt8,WM. Padang Ampera,"Jl. Ronggowarsito No.183, Timuran, Kec. Banjarsari, Kota Surakarta, Jawa Tengah 57131, Indonesia",Surakarta,Belum Ada Foto,Belum Ada Deskripsi,56,4.5,0,0,0,0,1,0,0,0,0,0,1,0,0
ChIJwXbE5nwVei4RMkoNqoIys3A,Resto Bundo Rumah Makan Padang,"Jl. Moh. Yamin No.1, Turi, Cemani, Kec. Grogol, Kabupaten Sukoharjo, Jawa Tengah 57552, Indonesia",Surakarta,Belum Ada Foto,Belum Ada Deskripsi,1,5.0,0,0,0,0,1,0,0,0,0,0,1,0,0
ChIJvf1IZ3wXei4RpnMPM5bchHE,RM Padang Putra Alam,"CR98+HHW, Kratonan, Serengan, Surakarta City, Central Java 57155, Indonesia",Surakarta,Belum Ada Foto,Belum Ada Deskripsi,6,4.3,0,0,0,0,1,0,0,0,0,0,1,0,0
ChIJjf1_-2IWei4RDIeV8EyOoKs,Sate Padang Amura Uda Rico,"Slamet Riyadi St No.132, Timuran, Banjarsari, Surakarta City, Central Java 57131, Indonesia",Surakarta,Belum Ada Foto,Belum Ada Deskripsi,107,4.5,0,0,0,0,1,0,0,0,0,0,1,0,0
ChIJcUilpj8Wei4Rqavs7kRdhdQ,Rumah Makan Ampera Masakan Padang,"Jl. Sungai Serang I No.313, Semanggi, Kec. Ps. Kliwon, Kota Surakarta, Jawa Tengah 57191, Indonesia",Surakarta,Belum Ada Foto,Belum Ada Deskripsi,6,4.2,0,0,0,0,1,0,0,0,0,0,1,0,0
ChIJ0eBmmGYWei4RESM7OdaYpV8,Ketupat Sayur Padang Uni Luci,"CRGG+984, Kauman, Pasar Kliwon, Surakarta City, Central Java 57122, Indonesia",Surakarta,Belum Ada Foto,Belum Ada Deskripsi,2,4.0,0,0,0,0,1,0,0,0,0,0,1,0,0
ChIJOwh69PUXei4RW1qBI2klp4E,Rumah Makan Padang Dara Minang,"Jl. Ledoksari No.15, Purwodiningratan, Kec. Jebres, Kota Surakarta, Jawa Tengah 57128, Indonesia",Surakarta,Belum Ada Foto,Belum Ada Deskripsi,3,5.0,0,0,0,0,1,0,0,0,0,0,1,0,0
ChIJ759VK5AWei4R5onlcU0VQpY,RM. PADANG SEDERHANA BARU,"CRRC+XXH, pasar ayu solo balapan, Kestalan, Kec. Banjarsari, Kota Surakarta, Jawa Tengah 57133, Indonesia",Surakarta,Belum Ada Foto,Belum Ada Deskripsi,153,4.4,0,0,0,0,1,0,0,0,0,0,1,0,0
ChIJhYwIh_sWei4Rik39vvTDVGE,Rumah Makan Masakan Padang Cahaya Sukses,"CRRX+5M4, Jl. Guntur, Jebres, Kec. Jebres, Kota Surakarta, Jawa Tengah 57126, Indonesia",Surakarta,Belum Ada Foto,Belum Ada Deskripsi,7,4.4,0,0,0,0,1,0,0,0,0,0,1,0,0
ChIJBRJRN4sXei4RTmuU9EvNpPY,Rumah Makan Padang Cahayo Minang,"Jl. Jend. Urip Sumoharjo No.211, Tegalharjo, Kec. Jebres, Kota Surakarta, Jawa Tengah 57129, Indonesia",Surakarta,Belum Ada Foto,Belum Ada Deskripsi,8,4.0,0,0,0,0,1,0,0,0,0,0,1,0,0
ChIJjUspPowXei4RgmoUE3wbPVY,"Rumah makan padang ""BAREH SOLOK""","Jl. Tj. Anom No.33, Bangorwo, Kwarasan, Kec. Grogol, Kabupaten Sukoharjo, Jawa Tengah 57552, Indonesia",Surakarta,Belum Ada Foto,Belum Ada Deskripsi,1,5.0,0,0,0,0,1,0,0,0,0,0,1,0,0
ChIJGeNCpEAWei4R1mwwjQCGmvc,Rumah Makan Padang Pagaruyuang,"CR7M+9WF, Jl. Kyai Mojo, Semanggi, Kec. Ps. Kliwon, Kota Surakarta, Jawa Tengah 57191, Indonesia",Surakarta,Belum Ada Foto,Belum Ada Deskripsi,55,4.6,0,0,0,0,1,0,0,0,0,0,1,0,0
ChIJC7zwuYYWei4RiwLkRZ7YzLs,Rumah Makan Padang Denai,"Jl. Prof. DR. Supomo No.43, Mangkubumen, Kec. Banjarsari, Kota Surakarta, Jawa Tengah 57139, Indonesia",Surakarta,Belum Ada Foto,Belum Ada Deskripsi,167,4.6,0,0,0,0,1,0,0,0,0,0,1,0,0
ChIJ-43huGwWei4RSPcEdAPMBv4,Rumah Makan padang EMBUN PAGI,"Jl. Brigjen Sudiarto No.90, Danukusuman, Kec. Serengan, Kota Surakarta, Jawa Tengah 57156, Indonesia",Surakarta,Belum Ada Foto,Belum Ada Deskripsi,182,4.2,0,0,0,0,1,0,0,0,0,0,1,0,0
ChIJ7zZ1mPsWei4RKzBvhKpabG0,Rm Padang Embun Pagi,"Jl. Ir. Sutami No.18, Jebres, Kec. Jebres, Kota Surakarta, Jawa Tengah 57126, Indonesia",Surakarta,Belum Ada Foto,Belum Ada Deskripsi,4,2.0,0,0,0,0,1,0,0,0,0,0,1,0,0
ChIJDRM6AtUVei4RxgjjPVdrAZI,Masakan Padang Mutiara Minang,"CRH3+GWJ, Jl. Dr. Rajiman, Penumping, Kec. Laweyan, Kota Surakarta, Jawa Tengah 57148, Indonesia",Surakarta,Belum Ada Foto,Belum Ada Deskripsi,20,4.0,0,0,0,0,1,0,0,0,0,0,1,0,0
ChIJjeNZI3UXei4R0QlwxbPRUuE,Masakan Padang,"Ps. Klewer, Kedung Lumbu, Kec. Ps. Kliwon, Kota Surakarta, Jawa Tengah 57133, Indonesia",Surakarta,Belum Ada Foto,Belum Ada Deskripsi,3,5.0,0,0,0,0,1,0,0,0,0,0,1,0,0
ChIJocyLqwwWei4R0fTQ8_KayL4,Pondok Salero Masakan Padang,"Ngruki, Cemani, Grogol, Sukoharjo Regency, Central Java, Indonesia",Surakarta,Belum Ada Foto,Belum Ada Deskripsi,3,4.7,0,0,0,0,1,0,0,0,0,0,1,0,0
ChIJc1TVwwUXei4RDvGBEVHYx98,Rumah Makan Padang Gadih Minang,"Jl. Kapten Piere Tendean No.131, Nusukan, Kec. Banjarsari, Kota Surakarta, Jawa Tengah 57135, Indonesia",Surakarta,Belum Ada Foto,Belum Ada Deskripsi,5,4.8,0,0,0,0,1,0,0,0,0,0,1,0,0
ChIJ-1mnlFkWei4RtKVaBtq09Ow,Rumah Makan Tiara Minang,"Jl. RE Martadinata No.211A, Gandekan, Kec. Jebres, Kota Surakarta, Jawa Tengah 57123, Indonesia",Surakarta,Belum Ada Foto,Belum Ada Deskripsi,88,4.5,0,0,0,0,1,0,0,0,0,0,1,0,0
ChIJbeMLQIYWei4RfHqVgdsvudU,Waroeng Berkah Bundo,"Jl. Yosodipuro No.44, Punggawan, Kec. Banjarsari, Kota Surakarta, Jawa Tengah 57131, Indonesia",Surakarta,Belum Ada Foto,Belum Ada Deskripsi,52,4.8,0,0,0,0,1,0,0,0,0,0,1,0,0
ChIJI1CSWOEVei4RHp_Yt8OhkQI,"Rumah Makan Padang ""Uni Linda"" cab. Purwosari","CRP2+CQP, Jl. Melati, Purwosari, Kec. Laweyan, Kota Surakarta, Jawa Tengah 57142, Indonesia",Surakarta,Belum Ada Foto,Belum Ada Deskripsi,4,5.0,0,0,0,0,1,0,0,0,0,0,1,0,0
ChIJ1yMn1gUWei4R-l3aIf38L5o,RM. Padang nusantara,"9RX7+CCP, Dusun I, Madegondo, Grogol, Sukoharjo Regency, Central Java 57552, Indonesia",Surakarta,Belum Ada Foto,Belum Ada Deskripsi,2,5.0,0,0,0,0,1,0,0,0,0,0,1,0,0
ChIJY39AsRkXei4RH654e7dyXb4,rumah makan masakan padang minang rempah,"CR7P+P2V, Semanggi, Pasar Kliwon, Surakarta City, Central Java 57191, Indonesia",Surakarta,Belum Ada Foto,Belum Ada Deskripsi,4,3.8,0,0,0,0,1,0,0,0,0,0,1,0,0
ChIJe2RMINMVei4RQZpQNw5ncvE,Rumah Makan Padang Pondok Indah,"Jl. Dr. Rajiman No.497, Bumi, Kec. Laweyan, Kota Surakarta, Jawa Tengah 57148, Indonesia",Surakarta,Belum Ada Foto,Belum Ada Deskripsi,302,4.5,0,0,0,0,1,0,0,0,0,0,1,0,0
ChIJfdHGU8YXei4RL_S2bRie9yg,RM Padang Pangeran,"Jl. Kapten Mulyadi No.307, Ps. Kliwon, Kec. Ps. Kliwon, Kota Surakarta, Jawa Tengah 57118, Indonesia",Surakarta,Belum Ada Foto,Belum Ada Deskripsi,32,4.4,0,0,0,0,1,0,0,0,0,0,1,0,0
ChIJdfZsjtsVei4RvKYrrWMMofA,Rumah Makan Padang,"Jl. Mawar Raya No.22, Sawah, Sanggrahan, Kec. Grogol, Kabupaten Sukoharjo, Jawa Tengah 57552, Indonesia",Surakarta,Belum Ada Foto,Belum Ada Deskripsi,10,4.3,0,0,0,0,1,0,0,0,0,0,1,0,0
ChIJPcA3oF0Xei4RQmdoHSQg-s0,Masakan padang arha,"Jl. Kartopuran No.241 A, Jayengan, Kec. Serengan, Kota Surakarta, Jawa Tengah 57152, Indonesia",Surakarta,Belum Ada Foto,Belum Ada Deskripsi,3,5.0,0,0,0,0,1,0,0,0,0,0,1,0,0
ChIJn_h0OjcUei4R5n35LPfpYpU,Bundo Kanduang Masakan Padang,"CRW7+X64, Jalan Slamet Riyadi, Pajang, Laweyan, Surakarta City, Central Java 57146, Indonesia",Surakarta,Belum Ada Foto,Belum Ada Deskripsi,14,4.3,0,0,0,0,1,0,0,0,0,0,1,0,0
ChIJ66q-ax4Xei4RhSF-8hDuNeQ,RM Padang Bagindo Jaya,"Jl. Kapten Piere Tendean No.76, Nusukan, Kec. Banjarsari, Kota Surakarta, Jawa Tengah 57135, Indonesia",Surakarta,Belum Ada Foto,Belum Ada Deskripsi,8,3.5,0,0,0,0,1,0,0,0,0,0,1,0,0
ChIJ-ZTEBmwWei4RBwryGCYkBUk,Trio Minang Jaya,"Jl. Veteran No.278, Tipes, Kec. Serengan, Kota Surakarta, Jawa Tengah 57154, Indonesia",Surakarta,Belum Ada Foto,Belum Ada Deskripsi,24,4.8,0,0,0,0,1,0,0,0,0,0,1,0,0
ChIJj27j13EWei4RgvKQEeA1E5E,Anda Masakan Padang,"Jl. Veteran No.142, Kratonan, Kec. Serengan, Kota Surakarta, Jawa Tengah 57155, Indonesia",Surakarta,Belum Ada Foto,Belum Ada Deskripsi,89,4.5,0,0,0,0,1,0,0,0,0,0,1,0,0
ChIJFYKA_9YVei4ReJdOZSKkfXA,Rumah Makan Restu Bundo Masakan Padang,"Jl. Jati No.41, Jati, Cemani, Kec. Grogol, Kabupaten Sukoharjo, Jawa Tengah 57552, Indonesia",Surakarta,Belum Ada Foto,Belum Ada Deskripsi,14,4.1,0,0,0,0,1,0,0,0,0,0,1,0,0
ChIJ1elrb54Wei4RItBYY8K9Ba4,"WM. Masakan Padang "" Bundo Aini ""","Jlan. Kolonel Soetarto, Kampung Mondokan RT.03/RW 28 Sebelah Timur Rumah Sakit Moewardi, Jebres, Kec. Jebres, Kota Surakarta, Jawa Tengah 57126, Indonesia",Surakarta,Belum Ada Foto,Belum Ada Deskripsi,12,3.9,0,0,0,0,1,0,0,0,0,0,1,0,0
ChIJpQhz69gVei4R0TFKxX2fDnw,Rumah Makan Padang Rancak Sari,"Jl. Sidomukti No.10, Jati, Cemani, Kec. Grogol, Kabupaten Sukoharjo, Jawa Tengah 57552, Indonesia",Surakarta,Belum Ada Foto,Belum Ada Deskripsi,138,4.4,0,0,0,0,1,0,0,0,0,0,1,0,0
ChIJEXUhIwAXei4RtmLgZukdmqY,Embun Pagi Restaurant,"Jl. Ir. Sutami No.118, Pucangsawit, Kec. Jebres, Kota Surakarta, Jawa Tengah 57125, Indonesia",Surakarta,Belum Ada Foto,Belum Ada Deskripsi,1039,4.1,0,0,0,0,1,0,0,0,0,0,1,0,0
ChIJnWZyzQkWei4RJpzayhF2C68,Rumah Makan Padang Family Saiyo,"Jalan Raya Solo - Baki Rt 03 Rw II, Kwarasan, Grogol, Dayung, Kwarasan, Kec. Grogol, Kabupaten Sukoharjo, Jawa Tengah 57552, Indonesia",Surakarta,Belum Ada Foto,Belum Ada Deskripsi,18,4.6,0,0,0,0,1,0,0,0,0,0,1,0,0
ChIJU0aEySYUei4RxqxJDqiMOzM,Warung Padang Pak Rizal,"CRW3+98F, Jl. K.S. Tubun, Manahan, Kec. Banjarsari, Kota Surakarta, Jawa Tengah 57139, Indonesia",Surakarta,Belum Ada Foto,Belum Ada Deskripsi,14,4.2,0,0,0,0,1,0,0,0,0,0,1,0,0
