,name,place_id,formatted_address,types,user_ratings_total,rating,lat,long,latlong
644,KANTOR SATPOL PP PROVSU,ChIJEYwqqiIvMTARVCwbnDlLYy8,"Jl. Kapten Muslim No.80, Dwi Kora, Kec. Medan Helvetia, Kota Medan, Sumatera Utara 20123, Indonesia","local_government_office,point_of_interest,establishment",6,4.3,3.596416,98.6449394,"3.596416,98.6449394"
645,Pos Lalu Lintas,ChIJBSVEVv8vMTARwSMmXVXVIr8,"GMR4+72C, Jl. Jenderal Besar A.H. Nasution, Kwala Bekala, Kec. Medan Johor, Sulawesi Utara, Sumatera Utara 20143, Indonesia","police,point_of_interest,establishment",0,0.0,3.540691,98.655017,"3.540691,98.655017"
646,Asrama Polisi Pasar Merah,ChIJtc8CcVgwMTARWIPDWp9ma5k,"Jl. Menteng Raya, Binjai, Kec. Medan Denai, Kota Medan, Sumatera Utara 20228, Indonesia","point_of_interest,establishment",158,4.4,3.5685396,98.7157239,"3.5685396,98.7157239"
687,Polresta Padang,ChIJZWw6aka51C8RWy6BwSbdL_g,"Jl. Moh. Yamin, Belakang Pd., Kec. Padang Bar., Kota Padang, Sumatera Barat 25132, Indonesia","police,point_of_interest,establishment",88,4.1,-0.9511203,100.3627407,"-0.9511203,100.3627407"
688,Police South Padang,ChIJX7ROt1m51C8RaDLoJzWP3Nc,"Jl. Niaga No.291, Kp. Pd., Kec. Padang Bar., Kota Padang, Sumatera Barat 25237, Indonesia","police,point_of_interest,establishment",7,3.0,-0.9611856000000001,100.3631101,"-0.9611856,100.3631101"
689,Polsek Padang Utara,ChIJkxt3haq41C8RPzGWCVC2Vps,"Jl. Prof. Dr. Hamka No.117, Air Tawar Bar., Kec. Padang Utara, Kota Padang, Sumatera Barat 25173, Indonesia","police,point_of_interest,establishment",12,4.3,-0.8914645999999999,100.3520562,"-0.8914646,100.3520562"
690,Police Station Padang Barat,ChIJscMh69S41C8ROElfwofshdY,"Jl. Ir. H. Juanda, Flamboyan Baru, Kec. Padang Bar., Kota Padang, Sumatera Barat, Indonesia","police,point_of_interest,establishment",14,3.9,-0.9250779,100.3515749,"-0.9250779,100.3515749"
691,Polresta Padang Unit Laka Lantas,ChIJh3TpISS51C8R5iP72H-G2wQ,"3988+C9W, Jalan Kis Mangun Sarkoro, Jati Baru, Padang Timur, Jati Baru, Padang, Kota Padang, Sumatera Barat 25129, Indonesia","police,point_of_interest,establishment",9,4.1,-0.9338807,100.365979,"-0.9338807,100.365979"
692,POLSEK KAWASAN TLK BAYUR,ChIJd_bkjLq71C8R-50XKnlcAtQ,"295J+3VW, Teluk Bayur, Padang Selatan, Padang City, West Sumatra 25213, Indonesia","police,point_of_interest,establishment",1,5.0,-0.9922922999999999,100.3822161,"-0.9922923,100.3822161"
693,Pauh police station,ChIJTUA_48y51C8R3JUuJ9n6kiE,"Jl. M. Hatta Pauh, Binuang Kp. Dalam, Kec. Pauh, Kota Padang, Sumatera Barat 25161, Indonesia","police,point_of_interest,establishment",36,3.7,-0.9300249,100.4256905,"-0.9300249,100.4256905"
694,Kantor Polsek Kuranji,ChIJ-6dqfFa41C8RNF34KN9wawQ,"Jl. By Pass No.KM.9, Ps. Ambacang, Kec. Kuranji, Kota Padang, Sumatera Barat 25175, Indonesia","police,point_of_interest,establishment",28,3.1,-0.9233439,100.3972592,"-0.9233439,100.3972592"
695,POLSEK KOTO TANGAH,ChIJ2bplOj7B1C8R1FNS6R4euM8,"Jembatan Timbang Oto Lubuk Buaya, Jalan Adi Negoro, Lubuk Buaya, Padang, Kota Padang, Sumatera Barat 25172, Indonesia","police,point_of_interest,establishment",32,2.9,-0.8189215,100.3236354,"-0.8189215,100.3236354"
696,Kantor Polisi Militer Padang,ChIJQWReCE-51C8R2-a7qJ-Bl8I,"29W5+8JC, Jl. Padang Pasir Raya, Kp. Pd., Kec. Padang Bar., Kota Padang, Sumatera Barat, Indonesia","police,point_of_interest,establishment",0,0.0,-0.9541778999999999,100.3590094,"-0.9541779,100.3590094"
697,Pos Polisi,ChIJx5Pch0e51C8RHPBA06Hq_d8,"3927+VCW, Jalan Jend Sudirman, Sawahan, Kec. Padang Tim., Kota Padang, Sumatera Barat, Indonesia","police,point_of_interest,establishment",0,0.0,-0.9477625,100.3635801,"-0.9477625,100.3635801"
698,Polda Sumatera Barat,ChIJL53whi-51C8RPwLOsvSUomA,"Jl. Jend. Sudirman No.55, Padang Pasir, Kec. Padang Bar., Kota Padang, Sumatera Barat 25113, Indonesia","police,point_of_interest,establishment",91,4.4,-0.9362405,100.3605218,"-0.9362405,100.3605218"
699,Asrama Polisi Alai Padang,ChIJiV_eyd641C8Run2JGl_SGMM,"Jl. KH. Ahmad Dahlan No.37, Alai Parak Kopi, Kec. Padang Utara, Kota Padang, Sumatera Barat 25173, Indonesia","local_government_office,point_of_interest,establishment",29,4.3,-0.9240564000000001,100.3652365,"-0.9240564,100.3652365"
700,Polsek Lubuk Begalung,ChIJEWDEXcq71C8Rdi6P4EUb3H8,"JL By Pass, Jl. Pampangan No.Km. 2, Pampangan Nan XX, Kec. Lubuk Begalung, Kota Padang, Sumatera Barat 25155, Indonesia","police,point_of_interest,establishment",8,3.5,-0.9833143999999999,100.3913685,"-0.9833144,100.3913685"
701,Pos Polisi Padang Baru,ChIJZRx-LNi41C8ROKNnLZ43HOk,"39F6+FHR, Rimbo Kaluang, Padang Barat, Padang City, West Sumatra, Indonesia","police,point_of_interest,establishment",2,3.0,-0.9262572,100.3613872,"-0.9262572,100.3613872"
702,Polsek Padang Timur,ChIJ41EUX3G51C8RQl-6WQXNQZo,"29XQ+822, Jl. Aru, Kubu Marapalam, Kec. Padang Tim., Kota Padang, Sumatera Barat 25143, Indonesia","point_of_interest,establishment",87,4.4,-0.9517266999999999,100.3875119,"-0.9517267,100.3875119"
703,Polsek Bungus Teluk Kabung,ChIJWc9vRzml1C8R2sRj9zE6xnM,"WCW7+679, North Teluk Kabung, Bungus Teluk Kabung, Padang City, West Sumatra 25237, Indonesia","police,point_of_interest,establishment",1,5.0,-1.0544872,100.413203,"-1.0544872,100.413203"
704,Balai Pemuda Hppkp Komplek Polda Balai Baru Padang,ChIJ-dU413q41C8RNtGftqbg48U,"Gunung Sarik, Kuranji, Padang City, West Sumatra, Indonesia","police,point_of_interest,establishment",0,0.0,-0.8997105999999998,100.4034276,"-0.8997106,100.4034276"
705,Asrama Polisi Jati,ChIJf7eXGSS51C8RVGSkfys9rb4,"3988+M8P, Jati Baru, Padang Timur, Padang City, West Sumatra 25129, Indonesia","local_government_office,point_of_interest,establishment",12,4.4,-0.9332838999999999,100.365829,"-0.9332839,100.365829"
706,Direktorat Lalu Lintas Polda Sumbar,ChIJx_0xV1a51C8RaKsXvMcftG8,"Jl. Nipah No.48, Berok Nipah, Kec. Padang Bar., Kota Padang, Sumatera Barat, Indonesia","police,point_of_interest,establishment",2,3.0,-0.9634094000000001,100.3579172,"-0.9634094,100.3579172"
707,Markas Tim Klewang Polresta Padang,ChIJk5gEAm251C8RHEsCkyiK7r4,"Jl. Prof. M. Yamin SH No.mor 1, Kp. Jao, Kec. Padang Bar., Kota Padang, Sumatera Barat 25144, Indonesia","police,point_of_interest,establishment",1,5.0,-0.9509384999999999,100.3626384,"-0.9509385,100.3626384"
708,Pos Polisi Belimbing,ChIJzUxwF2i51C8R-0I1RwzTaFE,"3CX7+9RC, Kuranji, Padang City, West Sumatra 25173, Indonesia","police,point_of_interest,establishment",1,5.0,-0.9015624,100.4145197,"-0.9015624,100.4145197"
709,Satuan Polisi Pamong Praja,ChIJx5I8iDi51C8RXbcibq84fBc,"3937+CG7, Jl. Tan Malaka, Sawahan, Kec. Padang Tim., Kota Padang, Sumatera Barat, Indonesia","point_of_interest,local_government_office,establishment",11,4.2,-0.9464796999999998,100.3638085,"-0.9464797,100.3638085"
710,Pos BM,ChIJv3l5KEq51C8Rkh4k59uumlE,"3924+94P, Olo, Padang Barat, Padang City, West Sumatra, Indonesia","police,point_of_interest,establishment",15,1.0,-0.9489,100.3553201,"-0.9489,100.3553201"
711,Pos Polisi Simpang Kandang,ChIJXaXlAg-51C8RuyZBowy4V9k,"Jl. Jend. Sudirman No.2A, Sawahan, Kec. Padang Tim., Kota Padang, Sumatera Barat, Indonesia","police,point_of_interest,establishment",1,2.0,-0.9478917,100.3631269,"-0.9478917,100.3631269"
712,Poslantas Ulak Karang,ChIJl1AIg7C51C8RV2MsC7qgtlM,"38QX+HX4, Jl. S. Parman, Ulak Karang Utara, Kec. Padang Utara, Kota Padang, Sumatera Barat, Indonesia","police,point_of_interest,establishment",0,0.0,-0.9111191000000001,100.3499576,"-0.9111191,100.3499576"
713,Pospol Kuranji,ChIJYVVVVSq61C8RVtqRbyRyO9Y,"Jl. Kampung Kalawi, Batung Taba Nan XX, Kec. Lubuk Begalung, Kota Padang, Sumatera Barat 25154, Indonesia","police,point_of_interest,establishment",0,0.0,-0.9683874999999998,100.3975599,"-0.9683875,100.3975599"
714,Asrama Polisi,ChIJQRnlnae51C8REp-1TSLQGVU,"Asrama Polisi Lolong PA III No. 22, Flamboyan Baru, Kec. Padang Bar., Kota Padang, Sumatera Barat, Indonesia","point_of_interest,establishment",2,4.0,-0.9252309999999999,100.3536765,"-0.925231,100.3536765"
715,Poslantas Simp. Alai,ChIJJZ5tfqO51C8Rv_JcY2UoldA,"Jl. Gajah Mada No.2a, Alai Parak Kopi, Kec. Padang Utara, Kota Padang, Sumatera Barat 25171, Indonesia","police,point_of_interest,establishment",1,5.0,-0.9247828,100.3676879,"-0.9247828,100.3676879"
716,SEKOLAH POLISI NEGARA POLDA SUMBAR,ChIJdVstFGm31C8Rj96_iu_bNd8,"2FW6+2GM, Jl. Raya Indarung, Padang Besi, Kec. Lubuk Kilangan, Kota Padang, Sumatera Barat 25157, Indonesia","school,point_of_interest,establishment",7,4.7,-0.9549467999999999,100.4612964,"-0.9549468,100.4612964"
717,Ditpolairud Polda Sumbar,ChIJD1TKgTml1C8R1ApfpEgOU30,"Jl. Raya Padang - Painan, Bungus Bar., Kec. Bungus Tlk. Kabung, Kota Padang, Sumatera Barat 25227, Indonesia","police,point_of_interest,establishment",18,4.8,-1.0313802,100.3939119,"-1.0313802,100.3939119"
718,Pos Polisi Rasuna Said,ChIJs2-BdXy51C8RKDaEwq4ZjpY,"3986+8HV, Jl. Rasuna Said, Ujung Gurun, Kec. Padang Bar., Kota Padang, Sumatera Barat 25129, Indonesia","police,point_of_interest,establishment",0,0.0,-0.9341449,100.3614368,"-0.9341449,100.3614368"
719,Pospol Padang Baru,ChIJRSzr1Ce51C8RPMYwcoE98BY,"Jl. Rasuna Said, Rimbo Kaluang, Kec. Padang Bar., Kota Padang, Sumatera Barat 25114, Indonesia","police,point_of_interest,establishment",0,0.0,-0.9307230999999999,100.3612802,"-0.9307231,100.3612802"
720,Pos Polisi Alang Laweh,ChIJBx0WbMG51C8RbsUnAnMPfYw,"Jl. Thamrin No.25, Alang Laweh, Kec. Padang Sel., Kota Padang, Sumatera Barat 25211, Indonesia","police,point_of_interest,establishment",0,0.0,-0.9546908,100.3640342,"-0.9546908,100.3640342"
721,Asrama polisi lolong blok G,ChIJO1m8kMi51C8RROnUZSgkInA,"39G2+4VQ, Jl. Ir. H. Juanda, Rimbo Kaluang, Kec. Padang Bar., Kota Padang, Sumatera Barat, Indonesia","point_of_interest,establishment",0,0.0,-0.9246597999999998,100.3522255,"-0.9246598,100.3522255"
722,Poslantas Padang Teather,ChIJOyB3xz651C8RzqFVdYHz5J0,"Jl. Permindo No.20b, Kp. Jao, Kec. Padang Bar., Kota Padang, Sumatera Barat, Indonesia","police,point_of_interest,establishment",0,0.0,-0.9489368999999999,100.3594281,"-0.9489369,100.3594281"
723,Detasemen Polisi Militer (Denpom) I/4 Padang,ChIJ36K0OE-51C8ROLTh1Uvg-9I,"Jl. Bundo Kanduang No.6, Belakang Tangsi, Kec. Padang Bar., Kota Padang, Sumatera Barat, Indonesia","point_of_interest,establishment",6,4.0,-0.9541025,100.3588055,"-0.9541025,100.3588055"
724,Polres Sektor Lubuk Kilangan,ChIJkxlviOy51C8RRpi3gzCDW5I,"Jl. Raya Indarung-Rimbo Datar No.22, Bandar Buat, Kec. Lubuk Kilangan, Kota Padang, Sumatera Barat 25158, Indonesia","point_of_interest,establishment",47,4.2,-0.9523636999999998,100.4198628,"-0.9523637,100.4198628"
725,Police Station Nanggalo,ChIJ-ydR2L641C8Rx14fXD-RhWg,"Jl. Gajah Mada Dalam No.80, Kp. Olo, Kec. Nanggalo, Kota Padang, Sumatera Barat 25173, Indonesia","police,point_of_interest,establishment",7,4.3,-0.9069662,100.367457,"-0.9069662,100.367457"
726,Asrama Polisi Rimbo Kaluang,ChIJV16G6gy51C8RxD5U9ojpgCs,"blok f Jalan Raden Saleh No.mor 6, Rimbo Kaluang, Kec. Padang Bar., Kota Padang, Sumatera Barat, Indonesia","point_of_interest,establishment",13,4.6,-0.9255191,100.3548854,"-0.9255191,100.3548854"
727,Pos Polisi Olo Padang,ChIJrz9AJ0q51C8R9mmJfaGZ8CQ,"Olo, Padang Barat, Padang City, West Sumatra, Indonesia","point_of_interest,establishment",0,0.0,-0.9488086,100.3553218,"-0.9488086,100.3553218"
728,Asrama Polisi Lolong Blok H/4,ChIJSV0lcwy51C8RurI5gszvq3A,"39G3+99G, Flamboyan Baru, Padang Barat, Padang City, West Sumatra, Indonesia","point_of_interest,establishment",0,0.0,-0.9236451999999999,100.3536351,"-0.9236452,100.3536351"
729,asrama polisi alai padang D26,ChIJQRycXtm41C8RRvDtISOz9Us,"39G8+955, Unnamed Road, Alai Parak Kopi, Kec. Padang Utara, Kota Padang, Sumatera Barat 25173, Indonesia","point_of_interest,establishment",5,4.2,-0.9241149,100.3654818,"-0.9241149,100.3654818"
730,Polsek Batang Anai,ChIJ5UlXwtDc1C8RZEq_M8wHIVo,"7886+HR6, Jl. Raya Padang - Bukittinggi, Ps. Usang, Kec. Batang Anai, Kabupaten Padang Pariaman, Sumatera Barat 25586, Indonesia","police,point_of_interest,establishment",0,0.0,-0.7336003,100.3119896,"-0.7336003,100.3119896"
731,Detasemen A Brimob Sumatera Barat,ChIJA0juPSjB1C8RHhLbdQAQ4-w,"58C7+735, Padang Sarai, Koto Tangah, Padang City, West Sumatra 25586, Indonesia","police,point_of_interest,establishment",0,0.0,-0.8293522999999999,100.312748,"-0.8293523,100.312748"
732,Asrama Polisi Alai Blok G nomor 5,ChIJLaI6_q251C8RroKv6bGKdmw,"Asrama Polisi alai Blok G nomor 5, Alai Parak Kopi, Kec. Padang Utara, Kota Padang, Sumatera Barat 25139, Indonesia","point_of_interest,establishment",0,0.0,-0.9235213999999999,100.3659129,"-0.9235214,100.3659129"
733,Satpol PP Kota Padang,ChIJsajQhzi51C8RHykQ1XJhwhw,"3937+HFJ, Tim., Sawahan, Kec. Padang Tim., Kota Padang, Sumatera Barat, Indonesia","local_government_office,point_of_interest,establishment",16,2.4,-0.9460291999999999,100.3636326,"-0.9460292,100.3636326"
734,Intelkam Polda SUMBAR,ChIJ6ZNEeNa41C8RCRxVKHDhIZA,"39F4+95H, Unnamed Road, Flamboyan Baru, Kec. Padang Bar., Kota Padang, Sumatera Barat, Indonesia","police,point_of_interest,establishment",6,4.0,-0.9265557000000001,100.3555026,"-0.9265557,100.3555026"
735,Poslantas Rumah Potong,ChIJtzb6RUK51C8RM-Auqf09I9g,"Jl. Sawahan Dalam No.23, Sawahan, Kec. Padang Tim., Kota Padang, Sumatera Barat 25121, Indonesia","police,point_of_interest,establishment",0,0.0,-0.9466594,100.3665501,"-0.9466594,100.3665501"
736,asrama polisi marapalam,ChIJW7Nwmfa51C8RWUBsXnKSlFI,"29XP+4P8, Kubu Marapalam, Padang Timur, Padang City, West Sumatra 25143, Indonesia","point_of_interest,establishment",2,5.0,-0.9522092999999998,100.3867925,"-0.9522093,100.3867925"
737,Ditlantas Polda Sumbar,ChIJ-w2yV1a51C8RJ5CzPhLWkfw,"Jl. Nipah No.18, Berok Nipah, Kec. Padang Bar., Kota Padang, Sumatera Barat, Indonesia","police,point_of_interest,establishment",54,2.3,-0.9637049999999999,100.357679,"-0.963705,100.357679"
738,Poslantas Koto Marapak,ChIJayKH_ju51C8RCvkc_BT2Fug,"Jl. Pemuda No.51, Olo, Kec. Padang Bar., Kota Padang, Sumatera Barat, Indonesia","police,point_of_interest,establishment",0,0.0,-0.9462301999999999,100.3544556,"-0.9462302,100.3544556"
739,Asrama Polisi Alai Blok PA 1 Nomor 2,ChIJkzZ7h-y51C8RoiFn3_ISh_0,"39F8+X7Q, Jl. KH. Ahmad Dahlan, Alai Parak Kopi, Kec. Padang Utara, Kota Padang, Sumatera Barat 25173, Indonesia","point_of_interest,establishment",0,0.0,-0.9250651,100.3657453,"-0.9250651,100.3657453"
740,Asrama Polisi Alai Blok C17,ChIJ0YDmwQy51C8RKkLb0B7RxKk,"39G8+93H, Jl. Alai Tim., Alai Parak Kopi, Kec. Padang Utara, Kota Padang, Sumatera Barat, Indonesia","point_of_interest,establishment",0,0.0,-0.9240573,100.3652367,"-0.9240573,100.3652367"
741,Polsek Padang Ganting,ChIJ0zvceIDWKi4R4MdIVMDWLkI,"CPW6+GRX, Atar, Kec. Padang Ganting, Kabupaten Tanah Datar, Sumatera Barat 27281, Indonesia","police,point_of_interest,establishment",1,4.0,-0.5536401,100.7121054,"-0.5536401,100.7121054"
742,Pos Kamling Rw. V,ChIJo7amTEi51C8RCFkH8I1OvEc,"3925+G74, Jl. Kp. Jawa Dalam, Kp. Jao, Kec. Padang Bar., Kota Padang, Sumatera Barat, Indonesia","police,point_of_interest,establishment",0,0.0,-0.9487492,100.3582143,"-0.9487492,100.3582143"
743,Pos SIM Keliling Polda Sumbar,ChIJXTq0FaS41C8RKfYWK2Dt5uU,"4938+95J, Surau Gadang, Padang, Padang City, West Sumatra 25173, Indonesia","local_government_office,point_of_interest,establishment",28,4.2,-0.8965430999999999,100.365386,"-0.8965431,100.365386"
744,Asrama polisi alai Blok B24,ChIJ4-4ydHm51C8RhjYuycGwq5A,"Alai Parak Kopi, Padang Utara, Padang City, West Sumatra 25173, Indonesia","point_of_interest,establishment",0,0.0,-0.9244218999999999,100.3660043,"-0.9244219,100.3660043"
745,Asrama polisi alai blok E.1,ChIJkycM8QS51C8Rul8fMYXQgpM,"39G8+CGR, Alai Parak Kopi, Padang Utara, Padang City, West Sumatra 25173, Indonesia","point_of_interest,establishment",0,0.0,-0.9238174000000001,100.3663472,"-0.9238174,100.3663472"
746,Asrama Polisi Blok PA2,ChIJnYWC99651C8RFAfzv78Z2Nc,"39F8+X8F, Jl. KH. Ahmad Dahlan, Alai Parak Kopi, Kec. Padang Utara, Kota Padang, Sumatera Barat 25173, Indonesia","point_of_interest,establishment",0,0.0,-0.9250548000000001,100.365808,"-0.9250548,100.365808"
787,Polsek Banjarsari,ChIJU9s9GYgWei4RlZ9PnSD2WbQ,"Jl. Kartini No.65, Timuran, Kec. Banjarsari, Kota Surakarta, Jawa Tengah 57131, Indonesia","police,point_of_interest,establishment",35,4.5,-7.5668788,110.8209471,"-7.5668788,110.8209471"
788,Polsek Serengan,ChIJq6qqenAWei4Rv5AEFd3yDW4,"Jl. Veteran No.146, Kratonan, Kec. Serengan, Kota Surakarta, Jawa Tengah 57153, Indonesia","police,point_of_interest,establishment",14,4.4,-7.581611999999999,110.8192054,"-7.581612,110.8192054"
789,Polantas Surakarta,ChIJ5a9eOyoUei4RsUViV-i3weM,"CRP4+885, Purwosari, Laweyan, Surakarta City, Central Java 57142, Indonesia","police,point_of_interest,establishment",9,4.0,-7.564241099999999,110.8058596,"-7.5642411,110.8058596"
790,Polsek Laweyan,ChIJPdacBX8Wei4RiZw5i987KzA,"Jl. Dr. Rajiman No.343, Panularan, Kec. Laweyan, Kota Surakarta, Jawa Tengah 57149, Indonesia","police,point_of_interest,establishment",39,4.4,-7.5717262,110.8098209,"-7.5717262,110.8098209"
791,Pos Polisi Terminal Tirtonadi Surakarta,ChIJo4jv6JkWei4Rkfn2gnsVaVs,"Jl. Tirtonadi No.12, Gilingan, Kec. Banjarsari, Kota Surakarta, Jawa Tengah 57134, Indonesia","police,point_of_interest,establishment",3,3.0,-7.552336099999999,110.8182723,"-7.5523361,110.8182723"
792,Pos Polisi Gladag,ChIJEwGgyGAWei4RRWjEE1_4hkg,"Jl. Insinyur H. Juanda No.26, Purwodiningratan, Kec. Jebres, Kota Surakarta, Jawa Tengah 57121, Indonesia","police,point_of_interest,establishment",3,4.0,-7.572194199999998,110.8297244,"-7.5721942,110.8297244"
793,Polsek Pasarkliwon,ChIJtSXUpGcWei4RhBvo0Uw3vYs,"Jl. Alun Alun Utara No.3, Gajahan, Kec. Ps. Kliwon, Kota Surakarta, Jawa Tengah 57155, Indonesia","point_of_interest,establishment",24,3.9,-7.576032400000001,110.8291132,"-7.5760324,110.8291132"
794,Polsek Jebres,ChIJC7VKnPAWei4Rug97EK6v6vM,"Jl. Kolonel Sutarto, Jebres, Surakarta, Kota Surakarta, Jawa Tengah 57126, Indonesia","police,point_of_interest,establishment",40,3.2,-7.5599067,110.8410959,"-7.5599067,110.8410959"
795,Polresta Surakarta,ChIJxRTb3CsUei4RkuitVNRSRio,"CRP4+J88, Slamet Riyadi St No.328, Purwosari, Laweyan, Surakarta City, Central Java 57142, Indonesia","police,point_of_interest,establishment",21,3.8,-7.564799000000001,110.8050136,"-7.564799,110.8050136"
796,Kantor Satpol PP Kota Surakarta,ChIJjWIYeIoWei4R6vqmbH3A9m8,"CRVX+J6X, Jl. Tentara Pelajar &, Jl. Pedaringan, Jebres, Surakarta City, Central Java 57126, Indonesia","point_of_interest,establishment",32,3.3,-7.555878399999998,110.8481549,"-7.5558784,110.8481549"
797,POSPAM FAROKA,ChIJr8_QJTgUei4RhW0giJ9n0AQ,"CQRP+789, Jl. Slamet Riyadi, Pajang, Kec. Laweyan, Kota Surakarta, Jawa Tengah 57146, Indonesia","police,point_of_interest,establishment",3,4.7,-7.559339700000001,110.785859,"-7.5593397,110.785859"
798,Pos Polisi Sriwedari,ChIJk6uxNFoXei4RT2zjIXWnU7g,"CRM6+8FJ, Sriwedari, Laweyan, Surakarta City, Central Java 57141, Indonesia","police,point_of_interest,establishment",0,0.0,-7.566653499999999,110.8111286,"-7.5666535,110.8111286"
799,"Polsektabes Banjarsari Polisi Masyarakat ""POLMAS""",ChIJ35oAwYQWei4RxLOP0t2EsuE,"Kantor Kelurahan, Jl. R. M. Said No.157, Mangkubumen, Banjarsari, Surakarta City, Central Java 57139, Indonesia","point_of_interest,establishment",0,0.0,-7.5592419,110.8152776,"-7.5592419,110.8152776"
800,Pos Polisi Panggung,ChIJA-quhAgXei4RHRbMEuAIM_E,"CRRP+4WH, Jebres, Surakarta City, Central Java 57126, Indonesia","police,point_of_interest,establishment",0,0.0,-7.5596972,110.8373647,"-7.5596972,110.8373647"
801,Kantor Staf Samapta Polresta Surakarta,ChIJNxuO2lUVei4RmHiqZtuABvw,"CRP4+277, Slamet Riyadi St, Purwosari, Laweyan, Surakarta City, Central Java 57142, Indonesia","police,point_of_interest,establishment",0,0.0,-7.5649479,110.8056775,"-7.5649479,110.8056775"
802,Mabes TLC,ChIJb_aOFnwWei4R7nMw2dzqS10,"Jl. Dr. Rajiman No.289, Panularan, Kec. Laweyan, Kota Surakarta, Jawa Tengah 57149, Indonesia","police,point_of_interest,establishment",0,0.0,-7.572433500000001,110.8144477,"-7.5724335,110.8144477"
803,Detasemen Polisi Militer IV/4 Ska Pomdam IV/Diponegoro,ChIJMSV2JYsWei4RG4A27vzy_t4,"CRJJ+J2R, Jl. Arifin, Kepatihan Wetan, Kec. Jebres, Kota Surakarta, Jawa Tengah 57129, Indonesia","point_of_interest,establishment",4,5.0,-7.5683864,110.8300027,"-7.5683864,110.8300027"
804,RESMOB POLRESTA SURAKARTA,ChIJ8yqRDxkVei4Rj3oeoBCLS7s,"Jl. Kepodhang No.5a, Manahan, Kec. Banjarsari, Kota Surakarta, Jawa Tengah 57139, Indonesia","police,point_of_interest,establishment",16,4.9,-7.553368099999999,110.8017009,"-7.5533681,110.8017009"
805,Pos Polisi Perempatan Manahan,ChIJg_TbP-wVei4R9n-NCnSE5TA,"CQWX+7PV, Jl. Raya Solo, Kerten, Kec. Laweyan, Kota Surakarta, Jawa Tengah 57143, Indonesia","police,point_of_interest,establishment",0,0.0,-7.5542704,110.7993615,"-7.5542704,110.7993615"
806,KANTOR BPKB SATLANTAS POLRESTA SURAKARTA,ChIJRQO8Y1wVei4RRs3P1VMK-zw,"Jl. Dahlia No.20, Purwosari, Kec. Laweyan, Kota Surakarta, Jawa Tengah 57142, Indonesia","police,point_of_interest,establishment",3,1.0,-7.563367599999999,110.8052317,"-7.5633676,110.8052317"
807,Pos Polisi Fajar Indah,ChIJiXISPz4Uei4RtJymx3XHiUE,"Jajar, Laweyan, Surakarta City, Central Java, Indonesia","police,point_of_interest,establishment",0,0.0,-7.5503082,110.788157,"-7.5503082,110.788157"
808,Markas Brimob Batalyon C Pelopor Surakarta,ChIJVciL_o0Wei4R8mjwiwOFOOM,"CRW2+3XR, Gilingan, Banjarsari, Surakarta City, Central Java 57134, Indonesia","police,point_of_interest,establishment",5,4.8,-7.554748500000001,110.8023935,"-7.5547485,110.8023935"
809,Satpas SIM Satlantas Polresta Surakarta,ChIJQ_EVgykUei4RpGoQKDcj5GY,"CRP3+PXW, Purwosari, Laweyan, Surakarta City, Central Java 57142, Indonesia","local_government_office,point_of_interest,establishment",641,4.3,-7.563130900000001,110.8049856,"-7.5631309,110.8049856"
810,Pos Polisi Grogol,ChIJN6KDMfg9ei4RhwlUaKag67k,"9RQ9+CCH, Dusun II, Langenharjo, Grogol, Sukoharjo Regency, Central Java 57552, Indonesia","point_of_interest,establishment",2,4.5,-7.6114446,110.8186147,"-7.6114446,110.8186147"
811,Denpom IV/4 Surakarta,ChIJp65ePWAWei4RC255YL6kAtg,"CRJH+MRV, Jl. Arifin, Kp. Baru, Kec. Ps. Kliwon, Kota Surakarta, Jawa Tengah 57133, Indonesia","point_of_interest,establishment",14,4.8,-7.5682795,110.8296297,"-7.5682795,110.8296297"
812,"Balai Kemitraan Polisi Masyarakat ""BKPM""",ChIJSdenwYQWei4R3oaT-vQFFHA,"Kantor Kelurahan, Jl. R. M. Said No.157, Mangkubumen, Banjarsari, Surakarta City, Central Java 57139, Indonesia","point_of_interest,establishment",0,0.0,-7.5592419,110.8152776,"-7.5592419,110.8152776"
813,Pos Kamling FKPM RW 08,ChIJh64fN48Vei4Rm6cBQB1Ge1w,"CQPP+3CX, Pajang, Laweyan, Surakarta City, Central Java 57146, Indonesia","police,point_of_interest,establishment",1,5.0,-7.5647627,110.7860611,"-7.5647627,110.7860611"
814,warung bu eko polisi,ChIJZ90q6-UXei4R_O97qjA9dAk,"Ngoresan RT.02/RW.22, No. 89, Jebres, Kec. Jebres, Kota Surakarta, Jawa Tengah 57126, Indonesia","restaurant,food,point_of_interest,establishment",6,5.0,-7.5521151,110.8609431,"-7.5521151,110.8609431"
815,Polsek Tawangsari,ChIJtS5Sp5w5ei4RABWjxHP_OfU,"7Q5W+WXM, Jl. Yos Sudarso No.33, Satu, Lorog, Kec. Tawangsari, Kabupaten Sukoharjo, Jawa Tengah 57561, Indonesia","police,point_of_interest,establishment",14,4.6,-7.738001099999999,110.7958836,"-7.7380011,110.7958836"
816,Polsek Sukoharjo Kota,ChIJOwxMpww8ei4RxYFkHSiOqcM,"8R5H+6JX, Jl. Kh Samanhudi, Pangin, Jetis, Kec. Sukoharjo, Kabupaten Sukoharjo, Jawa Tengah 57511, Indonesia","police,point_of_interest,establishment",14,4.2,-7.6918842,110.8291063,"-7.6918842,110.8291063"
817,Aspol Kadipiro,ChIJh8rNlMkWei4RvhelFJwCOOg,"FR8M+J3P, Kadipiro, Banjarsari, Surakarta City, Central Java 57136, Indonesia","point_of_interest,establishment",34,4.5,-7.533406500000001,110.8326756,"-7.5334065,110.8326756"
818,Polrestabes Surakarta,ChIJU8Yi3JEWei4RN49Rg2aj9rs,"CRRG+V7G, Gilingan, Banjarsari, Surakarta City, Central Java 57134, Indonesia","police,point_of_interest,establishment",1,5.0,-7.5578297,110.8257143,"-7.5578297,110.8257143"
819,Heri polisi,ChIJ_5kZYhoXei4RYyWZ5r3UIkU,"Jl. Tegal Mulyo No.001/004, Mojosongo, Kec. Jebres, Kota Surakarta, Jawa Tengah 57127, Indonesia","clothing_store,store,point_of_interest,establishment",0,0.0,-7.5486188,110.8363113,"-7.5486188,110.8363113"
873,Pakualaman Police Station,ChIJpWluSoBXei4R2v86eUNwSdU,"Jl. Purwanggan No.53, Purwokinanti, Pakualaman, Kota Yogyakarta, Daerah Istimewa Yogyakarta 55262, Indonesia","police,point_of_interest,establishment",17,3.9,-7.7978432,110.3765788,"-7.7978432,110.3765788"
874,Umbulharjo Police Station,ChIJBSJnKqBXei4R5817laC9qJA,"Jl. Menteri Supeno No.105, Pandeyan, Kec. Umbulharjo, Kota Yogyakarta, Daerah Istimewa Yogyakarta 55161, Indonesia","police,point_of_interest,establishment",33,3.9,-7.816848200000001,110.3858142,"-7.8168482,110.3858142"
875,Tegalrejo Police Station,ChIJNyIHyjhYei4R1QbIJhRph-8,"Magelang St No.184, Karangwaru, Tegalrejo, Yogyakarta City, Special Region of Yogyakarta 55281, Indonesia","police,point_of_interest,establishment",33,4.4,-7.7722103,110.3615107,"-7.7722103,110.3615107"
876,Polsek Gondomanan,ChIJo6T--4RXei4Rtq3b3fizacU,"Jl. Lobaningratan No.1, Prawirodirjan, Kec. Gondomanan, Kota Yogyakarta, Daerah Istimewa Yogyakarta 55122, Indonesia","police,point_of_interest,establishment",23,4.3,-7.803827499999999,110.3701109,"-7.8038275,110.3701109"
877,Gedongtengen Police Station,ChIJv-Gb_CVYei4RJkzjbzm3qoo,"Jl. Ps. Kembang No.12, Pringgokusuman, Gedong Tengen, Kota Yogyakarta, Daerah Istimewa Yogyakarta 55271, Indonesia","police,point_of_interest,establishment",24,4.3,-7.7894833,110.3612428,"-7.7894833,110.3612428"
878,Mergangsan Police Station,ChIJ34knkKFXei4RpEHSomD_vHs,"Jl. Sisingamangaraja No.55A, Brontokusuman, Kec. Mergangsan, Kota Yogyakarta, Daerah Istimewa Yogyakarta 55153, Indonesia","police,point_of_interest,establishment",21,3.9,-7.8180832,110.37326,"-7.8180832,110.37326"
