,name,place_id,formatted_address,types,user_ratings_total,rating,lat,long,latlong
196,Rehabhatipunggurkepri,ChIJZyvrJC6F2TERXvdiJgQtfLo,"kampung panau punggur, kecamatan Nongsa kelurahan kabil no. 03, 085278315545, Kecamatan Nongsa, Kota Batam, Kepulauan Riau 29467, Indonesia","hospital,health,point_of_interest,establishment",0,0.0,1.0883495,104.1330297,"1.0883495,104.1330297"
197,Pondok Bersalin Desa Teluk Mata Ikan,ChIJkwrs4f0p2jERYNNkGIOyD_8,"54P6+XV4, Sambau, Nongsa, Batam City, Riau Islands, Indonesia","hospital,health,point_of_interest,establishment",1,5.0,1.1873878,104.1122039,"1.1873878,104.1122039"
198,Klinik dan Apotek Fels Medika,ChIJ-W_DAtmJ2TERmnV7fdw1HHc,"Ruko Mega Legenda 2 Blok B1 No. 03, Kota Batam, Kepulauan Riau 29431, Indonesia","hospital,health,point_of_interest,establishment",8,5.0,1.1021523,104.0612116,"1.1021523,104.0612116"
199,Poliklinik Spesialis Bedah,ChIJdZI-TTuL2TER5TE5-ISkzsc,"4WHJ+W8M, Tanjung Pinggir, Sekupang, Batam City, Riau Islands, Indonesia","hospital,health,point_of_interest,establishment",0,0.0,1.1298393,103.9308053,"1.1298393,103.9308053"
200,Klinik Permata Hati,ChIJn43ra0uJ2TERrElfTNetv5E,"42M8+478, Lubuk Baja Kota, Lubuk Baja, Batam City, Riau Islands 29444, Indonesia","hospital,health,point_of_interest,establishment",8,4.1,1.132785,104.0156973,"1.132785,104.0156973"
201,Rosa Anugrah Utama,ChIJ7ftnR-uJ2TERER25OV1LBS0,"Bengkong Shopping Centre, Blok D, No. 4, Batam, Bengkong Laut, Bengkong, Batam City, Riau Islands 29444, Indonesia","hospital,health,point_of_interest,establishment",2,3.0,1.158155,104.026056,"1.158155,104.026056"
202,Klinik Batam Sehat,ChIJwZGqCqOI2TERRPyUjId1ZxA,"438R+GHF, Belian, Batam Kota, Batam City, Riau Islands 29433, Indonesia","hospital,health,point_of_interest,establishment",0,0.0,1.1163223,104.0914165,"1.1163223,104.0914165"
203,Berobat ke Malaysia,ChIJHZ-hFGKL2TER6CPh8MjNz0c,"5243+C6Q, Jl. Komp. Orchid Mas, Sungai Jodoh, Kec. Batu Ampar, Kota Batam, Kepulauan Riau, Indonesia","hospital,health,point_of_interest,establishment",0,0.0,1.1560805,104.0031013,"1.1560805,104.0031013"
204,Jakarta Hospital,ChIJKcinQFXxaS4RFUdJXOSVpLk,"Jl. Jend. Sudirman No.Kav 49, RT.5/RW.4, Karet Semanggi, Kecamatan Setiabudi, Kota Jakarta Selatan, Daerah Khusus Ibukota Jakarta 12930, Indonesia","hospital,doctor,health,point_of_interest,establishment",743,4.0,-6.2182371,106.8161788,"-6.2182371,106.8161788"
205,Tarakan Regional General Hospital,ChIJj4e7i3v2aS4RrelAlH_dyI8,"Jl. Kyai Caringin No.7, RT.11/RW.4, Cideng, Kecamatan Gambir, Kota Jakarta Pusat, Daerah Khusus Ibukota Jakarta 10150, Indonesia","hospital,health,point_of_interest,establishment",1950,3.9,-6.1718315,106.8103201,"-6.1718315,106.8103201"
206,Puri Medika Hospital,ChIJ3c0LpuAfai4Rwj4l2Woh9Dw,"Jl. Sungai Bambu No.5, RT.5/RW.9, Sungai Bambu, Kec. Tj. Priok, Jkt Utara, Daerah Khusus Ibukota Jakarta 14330, Indonesia","hospital,doctor,health,point_of_interest,establishment",541,3.5,-6.1289453,106.8902219,"-6.1289453,106.8902219"
207,RS. KHUSUS BEDAH HALIMUN (IGD 24 JAM),ChIJU5yRJQ70aS4R-ySxot8VIcc,"Jl. Halimun Raya No.9, RT.8/RW.2, Guntur, Kecamatan Setiabudi, Kota Jakarta Selatan, Daerah Khusus Ibukota Jakarta 12980, Indonesia","hospital,doctor,health,point_of_interest,establishment",67,4.6,-6.2063092,106.8339052,"-6.2063092,106.8339052"
208,RS Kramat 128,ChIJdwpdY0j0aS4RCYEnOei23J0,"Jl. Kramat Raya No.128, RT.1/RW.8, Kenari, Kec. Senen, Kota Jakarta Pusat, Daerah Khusus Ibukota Jakarta 10430, Indonesia","hospital,health,point_of_interest,establishment",277,3.9,-6.1855402,106.8440879,"-6.1855402,106.8440879"
209,Radjak Hospital Salemba,ChIJc8ke30L0aS4Rn_sEBkQeyhY,"Jl. Salemba Tengah No.24-28, Paseban, Kec. Senen, Kota Jakarta Pusat, Daerah Khusus Ibukota Jakarta 10440, Indonesia","hospital,health,point_of_interest,establishment",1613,4.2,-6.1936839,106.8520944,"-6.1936839,106.8520944"
210,Abdi Waluyo Hospital,ChIJv170zST0aS4RFrrR6kjFJ5k,"Jl. HOS. Cokroaminoto No.31-33, RT.1/RW.3, Gondangdia, Kec. Menteng, Kota Jakarta Pusat, Daerah Khusus Ibukota Jakarta 10350, Indonesia","hospital,doctor,health,point_of_interest,establishment",1182,4.4,-6.1898084,106.8292816,"-6.1898084,106.8292816"
211,St. Carolus Hospital,ChIJUXRwJGj0aS4RheHK-ifoIKg,"Jl. Salemba Raya No.41, RT.3/RW.5, Paseban, Kec. Senen, Kota Jakarta Pusat, Daerah Khusus Ibukota Jakarta 10440, Indonesia","hospital,dentist,health,point_of_interest,establishment",1153,3.9,-6.1955107,106.8513711,"-6.1955107,106.8513711"
212,RS Cikini,ChIJXc-qsUD0aS4RbMAHTJ3Bpjw,"Jl. Raden Saleh Raya No.40, RT.12/RW.2, Cikini, Kec. Menteng, Kota Jakarta Pusat, Daerah Khusus Ibukota Jakarta 10330, Indonesia","hospital,health,point_of_interest,establishment",19,3.8,-6.1914813,106.842062,"-6.1914813,106.842062"
213,Bunda Hospital Jakarta,ChIJz8Otij70aS4RDIgTUzBVt1k,"Jl. Teuku Cik Ditiro No.21, RT.9/RW.2, Gondangdia, Kec. Menteng, Kota Jakarta Pusat, Daerah Khusus Ibukota Jakarta 10350, Indonesia","hospital,health,point_of_interest,establishment",338,3.6,-6.1959424,106.8369665,"-6.1959424,106.8369665"
214,Patria Hospital IKKT,ChIJHac6o-r2aS4ROAwWAwjB0O8,"Komplek Kemhan TNI Slipi, Kel, Jl. Cendrawasih No.1, RT.5/RW.2, Palmerah, Kec. Palmerah, Kota Jakarta Barat, Daerah Khusus Ibukota Jakarta 11480, Indonesia","hospital,health,point_of_interest,establishment",337,3.1,-6.197076699999999,106.7926812,"-6.1970767,106.7926812"
215,Tria Dipa Hospital,ChIJbatNN7bzaS4RfVTeN5WgAA4,"Jl. Raya Pasar Minggu No.3A, RT.4/RW.1, Pancoran, Kec. Pancoran, Kota Jakarta Selatan, Daerah Khusus Ibukota Jakarta 12780, Indonesia","hospital,health,point_of_interest,establishment",302,3.3,-6.2508174,106.8418891,"-6.2508174,106.8418891"
216,RSUP Persahabatan,ChIJy0pyGJf0aS4RAHLjCH8B1uc,"Jl. Persahabatan Raya No.1, RT.16/RW.13, Rawamangun, Kec. Pulo Gadung, Kota Jakarta Timur, Daerah Khusus Ibukota Jakarta 13230, Indonesia","hospital,doctor,health,point_of_interest,establishment",1282,3.1,-6.2026942,106.8851868,"-6.2026942,106.8851868"
217,RS Khusus Bedah Rawamangun,ChIJO6d45JT0aS4R-QVHxDUUUeI,"Jl. Balai Pustaka No.29 - 31, RT.6/RW.15, Rawamangun, Kec. Pulo Gadung, Kota Jakarta Timur, Daerah Khusus Ibukota Jakarta 13220, Indonesia","hospital,health,point_of_interest,establishment",190,3.4,-6.1963893,106.8855167,"-6.1963893,106.8855167"
218,Rumah Sehat Untuk Jakarta RSUD Kebayoran Baru,ChIJgzwdFJnxaS4R1SWntNhIF1k,"Jl. Abdul Majid Raya No.28, Cipete Utara, Kec. Kby. Baru, Kota Jakarta Selatan, Daerah Khusus Ibukota Jakarta 12150, Indonesia","hospital,doctor,health,point_of_interest,establishment",430,4.1,-6.2655199,106.7986675,"-6.2655199,106.7986675"
219,Medistra Hospital,ChIJ4zXhycPzaS4RK9V7xBws5Rs,"Jl. Gatot Subroto No.59, RT.1/RW.4, Kuningan Tim., Kecamatan Setiabudi, Kota Jakarta Selatan, Daerah Khusus Ibukota Jakarta 12950, Indonesia","hospital,doctor,health,point_of_interest,establishment",830,4.0,-6.2397217,106.8338307,"-6.2397217,106.8338307"
220,"Tebet Regional Public Hospital, South Jakarta",ChIJBwh0-ZPzaS4RZklxwl4HmGY,"Jl. Prof. DR. Soepomo SH No.54, RT.13/RW.2, Tebet Bar., Kec. Tebet, Kota Jakarta Selatan, Daerah Khusus Ibukota Jakarta 12810, Indonesia","hospital,doctor,health,point_of_interest,establishment",544,3.6,-6.2316972,106.8466389,"-6.2316972,106.8466389"
221,RSUD Sawah Besar,ChIJ4Wv99eX1aS4RtM5Cd-5AYD0,"Jl. Dwiwarna Raya No.6-8, RT.15/RW.9, Karang Anyar, Kecamatan Sawah Besar, Kota Jakarta Pusat, Daerah Khusus Ibukota Jakarta 10740, Indonesia","hospital,health,point_of_interest,establishment",218,3.6,-6.148940199999999,106.8298665,"-6.1489402,106.8298665"
222,Jakarta Islamic Hospital,ChIJK4EdVwH1aS4Rz1YAnN1gOA0,"Jl. Cemp. Putih Tengah I Jl. Cempaka Putih Tengah XXX No.1, RT.11/RW.5, Cemp. Putih Tim., Kec. Cemp. Putih, Kota Jakarta Pusat, Daerah Khusus Ibukota Jakarta 10510, Indonesia","hospital,health,point_of_interest,establishment",1150,4.0,-6.1706772,106.8708824,"-6.1706772,106.8708824"
223,Columbia Asia Hospital Pulomas,ChIJCfObQCD1aS4RzpAZ6ShUrYA,"Jl. Kayu Putih Raya No.1, RW.16, Kayu Putih, Kec. Pulo Gadung, Kota Jakarta Timur, Daerah Khusus Ibukota Jakarta 13210, Indonesia","hospital,health,point_of_interest,establishment",1477,4.3,-6.1821006,106.8912829,"-6.1821006,106.8912829"
224,Royal Taruma Hospital,ChIJy3ic4UT2aS4RhvAwLfCCuY8,"Jl. Daan Mogot No.34, RW.1, Tj. Duren Utara, Kec. Grogol petamburan, Kota Jakarta Barat, Daerah Khusus Ibukota Jakarta 11470, Indonesia","hospital,doctor,point_of_interest,health,establishment",839,3.7,-6.1664004,106.7855103,"-6.1664004,106.7855103"
225,Rumah Sakit Ibu dan Anak Al-Fauzan,ChIJHeD_a37taS4RJnrgVG4Es8w,"Jl. Pedati No.3, RT.5/RW.7, Kp. Tengah, Kec. Kramat jati, Kota Jakarta Timur, Daerah Khusus Ibukota Jakarta 13540, Indonesia","hospital,point_of_interest,health,establishment",71,4.1,-6.2997804,106.8693534,"-6.2997804,106.8693534"
226,Budi Kemuliaan Hospital,ChIJjTfw6Rn1aS4RaUywvPLbdq0,"Jl. Budi Kemuliaan No.25, RT.2/RW.3, Gambir, Kecamatan Gambir, Kota Jakarta Pusat, Daerah Khusus Ibukota Jakarta 10110, Indonesia","hospital,point_of_interest,health,establishment",612,4.2,-6.1806975,106.8182917,"-6.1806975,106.8182917"
227,Rumah Sakit Gandaria,ChIJTfNuiBPxaS4RjITwwJ1SEAk,"Jl. Gandaria Tengah II No.6, RW.1, Kramat Pela, Kec. Kby. Baru, Kota Jakarta Selatan, Daerah Khusus Ibukota Jakarta 12130, Indonesia","hospital,point_of_interest,health,establishment",205,3.4,-6.244013100000001,106.790662,"-6.2440131,106.790662"
228,Rs Johar baru tanah tinggi Jakarta pusat,ChIJd9GSzQ_1aS4RiJXrdpWH9mo,"Jl. Tanah Tinggi XII No.15, RT.5/RW.9, Tanah Tinggi, Johar Baru, Central Jakarta City, Jakarta 10540, Indonesia","hospital,point_of_interest,health,establishment",4,2.5,-6.181593899999999,106.8512996,"-6.1815939,106.8512996"
229,Murni Teguh Sudirman Jakarta Hospital,ChIJVw7R9QL0aS4R_szQgffxhnc,"Kawasan Sahid City, Jl. Jenderal Sudirman No.86, RW.11, Karet Tengsin, Kecamatan Tanah Abang, Kota Jakarta Pusat, Daerah Khusus Ibukota Jakarta 10220, Indonesia","hospital,point_of_interest,health,establishment",215,4.0,-6.2095398,106.8194704,"-6.2095398,106.8194704"
230,Dr. Mintohardjo Naval Hospital,ChIJFVFBM6n2aS4RszwE2G1zn2E,"4, Jl. Bendungan Hilir No.17, RT.4/RW.3, Bend. Hilir, Kecamatan Tanah Abang, Kota Jakarta Pusat, Daerah Khusus Ibukota Jakarta 10210, Indonesia","hospital,point_of_interest,health,establishment",525,3.6,-6.21092,106.81201,"-6.21092,106.81201"
231,Rumah Sakit YPK Mandiri,ChIJubzVniT0aS4RoMsPZVv3raI,"22, Jl. Gereja Theresia No.22, RT.7/RW.4, Gondangdia, Kec. Menteng, Kota Jakarta Pusat, Daerah Khusus Ibukota Jakarta 10350, Indonesia","hospital,point_of_interest,health,establishment",341,4.2,-6.191368700000001,106.827903,"-6.1913687,106.827903"
232,RSUD Cempaka Putih,ChIJzzoqCvr0aS4RxmiOb4s9ffc,"Jl. Rawasari Sel. No.1, RT.16/RW.2, Cemp. Putih Tim., Kec. Cemp. Putih, Kota Jakarta Pusat, Daerah Khusus Ibukota Jakarta 10510, Indonesia","hospital,doctor,point_of_interest,health,establishment",327,3.6,-6.1847813,106.8724572,"-6.1847813,106.8724572"
233,MMC Hospital,ChIJsdC_blXxaS4Rc1KlN69LkPU,"Metropolitan Medical Centre, Jl. H. R. Rasuna Said No.C-21, RT.1/RW.7, Karet Kuningan, Kecamatan Setiabudi, Kota Jakarta Selatan, Daerah Khusus Ibukota Jakarta 12940, Indonesia","hospital,point_of_interest,health,establishment",438,4.1,-6.219863699999999,106.8323987,"-6.2198637,106.8323987"
234,RSUD Tanah Abang,ChIJSalmNJz2aS4RY9HMtNuWW08,"Jl. K.H. Mas Mansyur No.30, RT.5/RW.7, Kb. Kacang, Kecamatan Tanah Abang, Kota Jakarta Pusat, Daerah Khusus Ibukota Jakarta 10240, Indonesia","hospital,point_of_interest,health,establishment",247,4.3,-6.190887,106.814577,"-6.190887,106.814577"
235,Mother and Child Hospital Budhi Jaya,ChIJSRn4UorzaS4REgUUFivmf84,"Jl. Dr. Saharjo No.120, RT.1/RW.8, Menteng Atas, Kecamatan Setiabudi, Kota Jakarta Selatan, Daerah Khusus Ibukota Jakarta 12960, Indonesia","hospital,point_of_interest,health,establishment",144,3.9,-6.218895900000001,106.8450804,"-6.2188959,106.8450804"
236,Rumah Sakit Anggrek Mas,ChIJAQeo73v3aS4Rll58W742WwE,"Jl. Anggrek No.2B, RT.9/RW.2, Klp. Dua, Kec. Kb. Jeruk, Kota Jakarta Barat, Daerah Khusus Ibukota Jakarta 11550, Indonesia","hospital,point_of_interest,health,establishment",459,4.1,-6.2030719,106.7726612,"-6.2030719,106.7726612"
237,RUMAH SAKIT TEBET,ChIJ2z2Ax6vzaS4RqdRGpmz9LIU,"MT Haryono St No.Kav.13, West Tebet, Tebet, South Jakarta City, Jakarta 12810, Indonesia","dentist,hospital,point_of_interest,health,establishment",1717,4.7,-6.242804899999999,106.8501878,"-6.2428049,106.8501878"
238,Rumah Sakit Agung,ChIJsTXefXH0aS4RAO9LnfuVHvQ,"Jl. Sultan Agung No.67, RT.1/RW.8, Ps. Manggis, Kecamatan Setiabudi, Kota Jakarta Selatan, Daerah Khusus Ibukota Jakarta 12970, Indonesia","hospital,point_of_interest,health,establishment",490,3.1,-6.209101899999999,106.8464209,"-6.2091019,106.8464209"
239,Pasar Rebo Regional General Hospital,ChIJUx0VJILtaS4RDHY8DuB2dpQ,"Jl. TB Simatupang No.30, RT.9/RW.2, Gedong, Kec. Ps. Rebo, Kota Jakarta Timur, Daerah Khusus Ibukota Jakarta 13760, Indonesia","hospital,point_of_interest,health,establishment",2428,4.2,-6.3035748,106.8620939,"-6.3035748,106.8620939"
240,Primaya Evasari Hospital,ChIJKQlvZV70aS4Rq198Z8HqnRc,"Jl. Rawamangun No.47, RW.3, Rawasari, Kec. Cemp. Putih, Kota Jakarta Pusat, Daerah Khusus Ibukota Jakarta 10570, Indonesia","hospital,point_of_interest,health,establishment",685,4.2,-6.1935465,106.8597841,"-6.1935465,106.8597841"
241,Mediros Hospital,ChIJdSzw0dD0aS4RCRcjYrQEH_o,"Jl. Perintis Kemerdekaan Kav. 149 Pulo Gadung RT.1, RT.1/RW.1, Pulo Gadung, East Jakarta City, Jakarta 13260, Indonesia","hospital,point_of_interest,health,establishment",85,3.6,-6.1798543,106.9037935,"-6.1798543,106.9037935"
242,RS Premier Jatinegara,ChIJ5886Uv3zaS4RhR8qb6JOKYQ,"Jl. Jatinegara Timur No.85-87, RW.2, Bali Mester, Kecamatan Jatinegara, Kota Jakarta Timur, Daerah Khusus Ibukota Jakarta 13310, Indonesia","hospital,point_of_interest,health,establishment",587,3.5,-6.2216352,106.868675,"-6.2216352,106.868675"
243,Menteng Mitra Afia Hospital,ChIJAc0D6Dn0aS4Ra2cOj7cEx_o,"Jl. Kali Pasir No.9, RT.14/RW.10, Kb. Sirih, Kec. Menteng, Kota Jakarta Pusat, Daerah Khusus Ibukota Jakarta 10340, Indonesia","hospital,physiotherapist,doctor,point_of_interest,health,establishment",305,3.8,-6.1868957,106.8383149,"-6.1868957,106.8383149"
244,ESMR Room Sahid Sahirman Memorial Hospital,ChIJFfjV9QL0aS4R7N1BIO2r0WA,"Jalan Jenderal Sudirman No.Kav.86, RT.10/RW.11, Karet Tengsin, Tanah Abang, RT.10/RW.11, Karet Tengsin, Kecamatan Tanah Abang, Kota Jakarta Pusat, Daerah Khusus Ibukota Jakarta 10220, Indonesia","hospital,health,point_of_interest,establishment",0,0.0,-6.2096306,106.8197254,"-6.2096306,106.8197254"
245,RSCM Building A,ChIJo_7e40H0aS4RIbAYxss0yR8,"Gedung A, Jl. Pangeran Diponegoro No.71, RW.5, Kenari, Kec. Senen, Kota Jakarta Pusat, Daerah Khusus Ibukota Jakarta 10430, Indonesia","hospital,health,point_of_interest,establishment",309,3.6,-6.1961274,106.8465183,"-6.1961274,106.8465183"
246,RSUD Johar Baru,ChIJTfV4m070aS4RggjY0BNSUKU,"Jl. Tanah Tinggi XII No.15-23, RT.10/RW.9, Tanah Tinggi, Kec. Johar Baru, Kota Jakarta Pusat, Daerah Khusus Ibukota Jakarta 10540, Indonesia","hospital,health,point_of_interest,establishment",332,3.8,-6.1818835,106.8504347,"-6.1818835,106.8504347"
247,CMU 2 Rumah Sakit Umum Pusat Nasional Dr. Cipto Mangunkusumo,ChIJE5Q7Gmr0aS4RNKOM2sEae-U,"Jl. Pangeran Diponegoro No.71, RW.5, Kenari, Kec. Senen, Kota Jakarta Pusat, Daerah Khusus Ibukota Jakarta 10430, Indonesia","hospital,health,point_of_interest,establishment",3,5.0,-6.1970429,106.8466532,"-6.1970429,106.8466532"
248,RSUD Pasar Minggu,ChIJt8qmfhHyaS4RC5qlxCmCMrA,"Jl. TB Simatupang No.1, RW.5, Ragunan, Ps. Minggu, Kota Jakarta Selatan, Daerah Khusus Ibukota Jakarta 12550, Indonesia","hospital,health,point_of_interest,establishment",1520,4.0,-6.2937995,106.8200275,"-6.2937995,106.8200275"
249,Unit Radiologi RS Jakarta,ChIJGbLIIqHxaS4RCHXHtWrgnUQ,"Lt.1 Gedung RS Jakarta, Jl. Garnisun 1 Jl. Jenderal Sudirman, RT.5/RW.4, Karet Semanggi, Kecamatan Setiabudi, Kota Jakarta Selatan, Daerah Khusus Ibukota Jakarta 12930, Indonesia","hospital,health,point_of_interest,establishment",0,0.0,-6.218554600000001,106.8163011,"-6.2185546,106.8163011"
250,Budhi Asih Hospital,ChIJISSowarzaS4RoQNrDYOEHgU,"Jl. Dewi Sartika No.200, RT.1/RW.3, Cawang, Kec. Kramat jati, Kota Jakarta Timur, Daerah Khusus Ibukota Jakarta 13640, Indonesia","hospital,health,point_of_interest,establishment",1143,3.6,-6.255885,106.8630997,"-6.255885,106.8630997"
251,Dharma Nugraha Hospital,ChIJOdLLQ5X0aS4R9eYLHztqyoY,"Jl. Balai Pustaka Baru No.19, RT.7/RW.7, Rawamangun, Kec. Pulo Gadung, Kota Jakarta Timur, Daerah Khusus Ibukota Jakarta 13220, Indonesia","hospital,health,point_of_interest,establishment",133,3.8,-6.1962363,106.8863043,"-6.1962363,106.8863043"
252,Kemang Medical Care Hospital,ChIJ4SZPjh3yaS4RqGN-RwNMLr4,"Jl. Ampera Raya No.34, Ragunan, Ps. Minggu, Kota Jakarta Selatan, Daerah Khusus Ibukota Jakarta 12540, Indonesia","hospital,health,point_of_interest,establishment",322,3.9,-6.286162099999999,106.8192103,"-6.2861621,106.8192103"
253,Rumah Sakit Jakarta Medical Center (JMC),ChIJrwvQchnyaS4RelwtOrbP0Fw,"Jl. Buncit Raya No.15, RT.1/RW.9, Kalibata, Kec. Pancoran, Kota Jakarta Selatan, Daerah Khusus Ibukota Jakarta 12740, Indonesia","doctor,hospital,health,point_of_interest,establishment",810,4.2,-6.271399499999999,106.8302645,"-6.2713995,106.8302645"
254,Rsb. Angkasa,ChIJr4ZJQSr0aS4RbXbO35cmKYg,"Jl. Budi Kemuliaan No.12, Gambir, Kecamatan Gambir, Kota Jakarta Pusat, Daerah Khusus Ibukota Jakarta 10110, Indonesia","hospital,health,point_of_interest,establishment",0,0.0,-6.1801605,106.819657,"-6.1801605,106.819657"
255,Jakarta Heart Centre,ChIJTXlq4370aS4RybfPi4L6uAk,"Jl. Matraman Raya No.23, RT.2/RW.1, Palmeriam, Kec. Matraman, Kota Jakarta Timur, Daerah Khusus Ibukota Jakarta 13140, Indonesia","hospital,health,point_of_interest,establishment",1326,4.7,-6.200256899999999,106.8553287,"-6.2002569,106.8553287"
256,YARSI Hospital,ChIJ1eIwywb1aS4RvZCQMjrnAG0,"Jl. Letjen Suprapto No.Kav 13, RT.10/RW.5, Cemp. Putih Tim., Kec. Cemp. Putih, Kota Jakarta Pusat, Daerah Khusus Ibukota Jakarta 10510, Indonesia","hospital,health,point_of_interest,establishment",699,4.5,-6.1697669,106.8693057,"-6.1697669,106.8693057"
257,Regional General Hospital Matraman,ChIJobOZ5Yf0aS4RdLbeEBKBApc,"Jalan Kebon Kelapa No.29, RT.1/RW.10, Utan Kayu Sel., Kec. Matraman, Kota Jakarta Timur, Daerah Khusus Ibukota Jakarta 13120, Indonesia","hospital,health,point_of_interest,establishment",471,3.6,-6.2061227,106.8660452,"-6.2061227,106.8660452"
258,Rumah Sakit Dharma Nugraha,ChIJN67IOGb0aS4RNdkEAMwvrXI,"Jl. Balai Pustaka Baru No.9, Palmeriam, Kec. Matraman, Kota Jakarta Timur, Daerah Khusus Ibukota Jakarta 13220, Indonesia","hospital,health,point_of_interest,establishment",0,0.0,-6.199342,106.8546,"-6.199342,106.8546"
259,Rumah Sakit Harapan Jayakarta,ChIJ_edwC7b0aS4R3k5TGVxvPrQ,"Blok KM No.18, Jl. Raya Bekasi No.7, RW.11, Jatinegara, Kec. Cakung, Kota Jakarta Timur, Daerah Khusus Ibukota Jakarta 13930, Indonesia","hospital,health,point_of_interest,establishment",371,3.0,-6.1949967,106.9062321,"-6.1949967,106.9062321"
260,Primaya Hospital PGI Cikini,ChIJWVesV0f0aS4RIzUynEuekFc,"Jl. Raden Saleh Raya No.40, RT.12/RW.2, Cikini, Kec. Menteng, Kota Jakarta Pusat, Daerah Khusus Ibukota Jakarta 10330, Indonesia","hospital,health,point_of_interest,establishment",579,4.1,-6.1915629,106.8419314,"-6.1915629,106.8419314"
261,Rumah Sakit Umum Daerah Tamansari,ChIJv4ZMDf31aS4RjAFOFx0OTVQ,"Jl. Madu No.10A, RT.2/RW.3, Mangga Besar, Kec. Taman Sari, Kota Jakarta Barat, Daerah Khusus Ibukota Jakarta 11180, Indonesia","doctor,hospital,health,point_of_interest,establishment",321,3.6,-6.143787199999999,106.8192196,"-6.1437872,106.8192196"
262,RSUD Kebayoran Lama,ChIJR5Cv0hHxaS4R6Tc7-iExRGE,"Jl. Jatayu, RT.1/RW.12, Kby. Lama Sel., Kec. Kby. Lama, Kota Jakarta Selatan, Daerah Khusus Ibukota Jakarta 12240, Indonesia","hospital,health,point_of_interest,establishment",710,4.7,-6.2487219,106.7856259,"-6.2487219,106.7856259"
263,RS Dharmais,ChIJ91BSmI32aS4Rt0W2MtJv-q4,"Letjen S. Parman St No.Kav 84-86, RT.4/RW.9, South Bambu City, Palmerah, West Jakarta City, Jakarta 11420, Indonesia","hospital,health,point_of_interest,establishment",98,3.7,-6.1867534,106.7978816,"-6.1867534,106.7978816"
264,Rumah sakit ibu dan anak jakarta,ChIJBXWZAD70aS4RdCAT5G54I5U,"RR3P+F6W, RT.10/RW.2, Gondangdia, Menteng, Central Jakarta City, Jakarta 10310, Indonesia","hospital,health,point_of_interest,establishment",1,5.0,-6.196263399999999,106.8355712,"-6.1962634,106.8355712"
265,Satya Negara Hospital,ChIJ8-y7vn71aS4RdpsAqmX-dKY,"Jl. Agung Utara Raya Blok A No.1, Sunter, Jkt Utara, Daerah Khusus Ibukota Jakarta 14350, Indonesia","hospital,health,point_of_interest,establishment",441,3.7,-6.1389656,106.8616849,"-6.1389656,106.8616849"
266,Rumah Sakit Haji Jakarta,ChIJucc8cKLyaS4RGih3jYUAvT8,"Jl. Raya Pd. Gede No.4, RT.1/RW.1, Lubang Buaya, Kec. Makasar, Kota Jakarta Timur, Daerah Khusus Ibukota Jakarta 13650, Indonesia","hospital,health,point_of_interest,establishment",529,3.5,-6.2898748,106.8892801,"-6.2898748,106.8892801"
267,Hospital Manuela,ChIJoQ_Ro931aS4R4INRjGLYTII,"Jl. Mangga Besar VIII No.23, RT.4/RW.1, Taman Sari, Kec. Taman Sari, Kota Jakarta Barat, Daerah Khusus Ibukota Jakarta 11150, Indonesia","hospital,health,point_of_interest,establishment",5,4.6,-6.150455,106.8258098,"-6.150455,106.8258098"
268,RS Medika Permata Hijau,ChIJdTTnN9P2aS4RFQyCpqmt-rk,"Jl. Raya Kby. Lama No.64, RW.8, Sukabumi Sel., Kec. Kb. Jeruk, Kota Jakarta Barat, Daerah Khusus Ibukota Jakarta 11560, Indonesia","hospital,health,point_of_interest,establishment",542,3.3,-6.2181589,106.7779555,"-6.2181589,106.7779555"
269,RSIA TAMBAK,ChIJf69x4nH0aS4RDQNa0p9g9z8,"Jl. Tambak No.18, Pegangsaan, Kec. Menteng, Kota Jakarta Pusat, Daerah Khusus Ibukota Jakarta 10320, Indonesia","hospital,health,point_of_interest,establishment",318,4.3,-6.2062368,106.8484765,"-6.2062368,106.8484765"
270,RSIA Lombok Dua Dua Surabaya,ChIJHTXJEcX71y0R9egY3JgtjT4,"Jl. Flores No.12, Ngagel, Kec. Wonokromo, Surabaya, Jawa Timur 60246, Indonesia","hospital,health,point_of_interest,establishment",312,4.3,-7.278480999999999,112.748947,"-7.278481,112.748947"
271,Rumah Sakit RSIA Lombok Dua Dua Lontar,ChIJI7l0EzP81y0RzLRSx-X_DAI,"Jl. Raya Lontar No.109, Lontar, Kec. Sambikerep, Surabaya, Jawa Timur 60216, Indonesia","hospital,doctor,health,point_of_interest,establishment",237,3.9,-7.284427300000001,112.6695692,"-7.2844273,112.6695692"
272,Rumah Sakit Metro Medika Lombok,ChIJ2yX6nMHAzS0R1-Iw0cEHlAI,"Jl. Jend. Sudirman No.18a, Rembiga, Kec. Selaparang, Kota Mataram, Nusa Tenggara Bar. 83124, Indonesia","hospital,doctor,health,point_of_interest,establishment",52,3.4,-8.5628069,116.1124334,"-8.5628069,116.1124334"
273,Rumah Sakit Umum Daerah Kabupaten Lombok Utara,ChIJq6qqqjrbzS0R-BTNdvSxPhQ,"J5V5+XXW, Jl. Tioq Tata, Tunaq, Tanjung, North Lombok Regency, West Nusa Tenggara 83352, Indonesia","hospital,doctor,health,point_of_interest,establishment",53,3.7,-8.3550002,116.1599494,"-8.3550002,116.1599494"
274,Rumah Sakit Risa Sentra Medika Lombok Timur,ChIJAVUE3B9MzC0RNskZCmRagtg,"Jl. Pejanggik No.78, Majidi, Kec. Selong, Kabupaten Lombok Timur, Nusa Tenggara Bar. 83611, Indonesia","dentist,hospital,health,point_of_interest,establishment",172,4.2,-8.6524533,116.519008,"-8.6524533,116.519008"
275,Saint Antonius Catholic Hospital,ChIJj66mqGfAzS0R8Q1IEVz6ubc,"Jl. Koperasi No.61, Dayan Peken, Kec. Ampenan, Kota Mataram, Nusa Tenggara Bar. 83111, Indonesia","hospital,doctor,health,point_of_interest,establishment",40,4.2,-8.5704712,116.0795213,"-8.5704712,116.0795213"
276,RS INTERNATIONAL LOMBOK,ChIJnXbgcbivzS0RAbwuxP1BU0A,"57QR+9VF, Sengkol, Pujut, Central Lombok Regency, West Nusa Tenggara 83573, Indonesia","hospital,health,point_of_interest,establishment",0,0.0,-8.8115735,116.292182,"-8.8115735,116.292182"
277,RSUD Lombok Timur,ChIJCw_DIrZPzC0RzpCnN6iHpsQ,"Labuhan Haji, East Lombok Regency, West Nusa Tenggara 83616, Indonesia","hospital,health,point_of_interest,establishment",54,4.1,-8.692573399999999,116.5685057,"-8.6925734,116.5685057"
278,General Hospital Selong,ChIJ6WNhgbxOzC0RCzYqj8s-hPA,"Jl. DR. Cipto Mangun Kusumo No.6, Majidi, Kec. Selong, Kabupaten Lombok Timur, Nusa Tenggara Bar. 83611, Indonesia","dentist,hospital,health,point_of_interest,establishment",96,4.0,-8.6513157,116.5281754,"-8.6513157,116.5281754"
279,RS Hermina Lombok,ChIJm4mHg4O_zS0ROhnoY2zhVGw,"93MX+5F3, Pagutan, Mataram, Mataram City, West Nusa Tenggara 83116, Indonesia","hospital,health,point_of_interest,establishment",0,0.0,-8.617119299999999,116.0986641,"-8.6171193,116.0986641"
280,Rsup mataram lombok,ChIJx_EURTS_zS0RYS3YoWs1Xcg,"94RJ+MQR, Dasan Cermen, Sandubaya, Mataram City, West Nusa Tenggara 83232, Indonesia","hospital,health,point_of_interest,establishment",9,2.2,-8.608257199999999,116.1318808,"-8.6082572,116.1318808"
281,Harapan Keluarga Hospital,ChIJJ7XURVfHzS0RHmZgMZdGVqk,"Jl. Ahmad Yani No.9, Selagalas, Kec. Sandubaya, Kota Mataram, Nusa Tenggara Bar. 83237, Indonesia","hospital,health,point_of_interest,establishment",441,4.2,-8.579299899999999,116.1468253,"-8.5792999,116.1468253"
282,Islamic Hospital Namira,ChIJR4kc46VOzC0Rpi3OAGWaOLs,"Jl. KH Ahmad Dahlan No.17, Pancor, Kec. Selong, Kabupaten Lombok Timur, Nusa Tenggara Bar. 83612, Indonesia","hospital,doctor,health,point_of_interest,establishment",251,4.1,-8.6473136,116.5199088,"-8.6473136,116.5199088"
283,Rs Tanjung,ChIJx0Prp1rdzS0RUiLpgv7d7eI,"H3J2+3X2, Malaka, Pemenang, North Lombok Regency, West Nusa Tenggara 83352, Indonesia","hospital,health,point_of_interest,establishment",0,0.0,-8.4198687,116.0523837,"-8.4198687,116.0523837"
284,RS Sumbawa,ChIJj8HzV1mwzS0RXFOM1JZ5AUk,"Jl. Gajah Mada No.1, Leneng, Kec. Praya, Kabupaten Lombok Tengah, Nusa Tenggara Bar. 83521, Indonesia","hospital,health,point_of_interest,establishment",1,5.0,-8.700838599999999,116.2607001,"-8.7008386,116.2607001"
