,name,place_id,formatted_address,types,user_ratings_total,rating,lat,long,latlong
382,Rumah Sakit Umum Harapan Keluarga,ChIJdcsqcHcp1i0RDU1wbYwLLBw,"2MJ9+R2Q, Keduyo, Mangliawan, Kec. Pakis, Kabupaten Malang, Jawa Timur 65154, Indonesia","hospital,health,point_of_interest,establishment",0,0.0,-7.967920700000001,112.6676082,"-7.9679207,112.6676082"
383,BKIA RS PANTI WALUYA SAWAHAN RKZ,ChIJKRJ4DXsp1i0RRcGVlOj3gv0,"Jl. Yulius Usman No.49, Kasin, Kec. Klojen, Kota Malang, Jawa Timur 65117, Indonesia","hospital,health,point_of_interest,establishment",0,0.0,-7.985436399999999,112.6250345,"-7.9854364,112.6250345"
384,ICU Rs Panti Waluya Malang,ChIJYc6GuBUp1i0RZ7K24qeP1pk,"Jl. Nusakambangan No.56, Kasin, Kec. Klojen, Kota Malang, Jawa Timur 65117, Indonesia","hospital,health,point_of_interest,establishment",0,0.0,-7.987102999999999,112.624778,"-7.987103,112.624778"
385,Kkp Rsa Malang,ChIJr1lJAzAo1i0Re_o1PmcHd-s,"2JHJ+JR3, Klojen, Malang City, East Java 65111, Indonesia","hospital,health,point_of_interest,establishment",4,1.0,-7.970996,112.6320582,"-7.970996,112.6320582"
386,IGD RSSA,ChIJeSDuATAo1i0RVS0RwH7v5mE,"Jl. Jaksa Agung Suprapto No.2, Klojen, Kec. Klojen, Kota Malang, Jawa Timur 65111, Indonesia","hospital,health,point_of_interest,establishment",56,3.2,-7.9723572,112.6314089,"-7.9723572,112.6314089"
387,OK PJT RSSA,ChIJTTFVqDoo1i0RNEEehg3BT7s,"Jl. Jaksa Agung Suprapto No.20, Rampal Celaket, Kec. Klojen, Kota Malang, Jawa Timur 65111, Indonesia","hospital,health,point_of_interest,establishment",2,5.0,-7.971526000000001,112.6321025,"-7.971526,112.6321025"
388,RS.sahabat,ChIJi0Sv04wp1i0RPKcXDYPE5H0,"3J4R+VP6, Jl. Raya Surabaya - Malang, Suwayuwo, Kec. Blimbing, Kota Malang, Jawa Timur, Indonesia","hospital,health,point_of_interest,establishment",0,0.0,-7.942841199999999,112.6417717,"-7.9428412,112.6417717"
389,Rumah Bersalin Rindam V Brawijaya,ChIJfzwN5kEo1i0RRxGPLV7e7Jw,"2J9X+VCC, JL. Kalimosodo, Jodipan, Kedungkandang, Polehan, Kec. Blimbing, Kota Malang, Jawa Timur 65137, Indonesia","hospital,health,point_of_interest,establishment",1,4.0,-7.9803048,112.648506,"-7.9803048,112.648506"
390,Poli Dokter Spesialis Melati Husada,ChIJpUXkEyco1i0R7iY0xBZE7ys,"Taman Slamet St No.30, Gading Kasri, Klojen, Malang City, East Java 65115, Indonesia","hospital,health,point_of_interest,establishment",198,4.8,-7.9757883,112.621565,"-7.9757883,112.621565"
391,Gedung Pemeriksaan Gigi Rumah Sakit Universitas Brawijaya,ChIJa3H32mMp1i0RBKnLLsZ_Q7s,"3J5C+GR6, Jatimulyo, Lowokwaru, Malang City, East Java 65141, Indonesia","hospital,health,point_of_interest,establishment",2,5.0,-7.941208,112.6220134,"-7.941208,112.6220134"
392,"Praktek BPJS Kesh. dr.Bambang Prijadi, MS",ChIJ1UhKcqAp1i0RDpjPWpLvhrg,"Jl. Danau Bratan Raya H2A-46, Sawojajar, Kec. Kedungkandang, Kota Malang, Jawa Timur 65138, Indonesia","hospital,health,point_of_interest,establishment",0,0.0,-7.977105099999999,112.6647985,"-7.9771051,112.6647985"
393,Poli Hemodialisa,ChIJC3Ixgksp1i0RqTCu7Vtk-4s,"Jl. Tumenggung Suryo No.1, Bunulrejo, Kec. Blimbing, Kota Malang, Jawa Timur 65111, Indonesia","hospital,health,point_of_interest,establishment",2,4.5,-7.9655699,112.6383436,"-7.9655699,112.6383436"
394,PMI RSSA,ChIJp33uHDAo1i0R6oPXhEL1PlQ,"2JHJ+JRV, Jl. Jaksa Agung Suprapto, Klojen, Kec. Klojen, Kota Malang, Jawa Timur 65111, Indonesia","hospital,health,point_of_interest,establishment",3,4.7,-7.9708795,112.6320378,"-7.9708795,112.6320378"
395,Trapisi Agus Kuswanto Seorang Trapisi Kariawan Nuansafajar Yang Bersertifikat.,ChIJLZdWVKgp1i0Rvo0PAEWRZKQ,"Jl. Panglima Sudirman Utara No.73, Rampal Celaket, Kec. Klojen, Kota Malang, Jawa Timur 65111, Indonesia","hospital,health,point_of_interest,establishment",0,0.0,-7.968863199999999,112.6373276,"-7.9688632,112.6373276"
396,Igd,ChIJk3WB_xgo1i0Ru_ot9BGiozA,"Jl. Kyai H. Wahid Hasyim No.100, Kauman, Kec. Klojen, Kota Malang, Jawa Timur 65119, Indonesia","hospital,health,point_of_interest,establishment",0,0.0,-7.9844014,112.6287598,"-7.9844014,112.6287598"
397,Murni Teguh Memorial Hospital,ChIJn7WK4scxMTARUJgAOomUDf8,"Jl. Jawa No.2, Gg. Buntu, Kec. Medan Tim., Kota Medan, Sumatera Utara 20231, Indonesia","pharmacy,hospital,doctor,health,store,point_of_interest,establishment",1751,3.9,3.5907419,98.6815369,"3.5907419,98.6815369"
398,Deli General Hospital,ChIJrzTaWrExMTARUWyjDBsmPDc,"Jl. Merbabu No.18, Pusat Ps., Kec. Medan Kota, Kota Medan, Sumatera Utara 20212, Indonesia","hospital,doctor,health,point_of_interest,establishment",94,3.5,3.585829,98.688346,"3.585829,98.688346"
399,General Hospital H. Adam Malik,ChIJt7LME6IlMTARVVnxKzFi9vM,"Jl. Bunga Lau No.17, Kemenangan Tani, Kec. Medan Tuntungan, Kota Medan, Sumatera Utara 20136, Indonesia","hospital,doctor,health,point_of_interest,establishment",837,2.9,3.5184086,98.608638,"3.5184086,98.608638"
400,Advent Hospital Medan,ChIJi7d38C8uMTARSTz6YTZ3DTY,"Jl. Gatot Subroto No.Km 4, Sei Sikambing D, Kec. Medan Petisah, Kota Medan, Sumatera Utara 20118, Indonesia","hospital,doctor,health,point_of_interest,establishment",480,4.0,3.5895533,98.6498394,"3.5895533,98.6498394"
401,Rumah Sakit Universitas Sumatera Utara,ChIJU9xy_tgvMTARNuIFxbrXTFo,"Jl. Dr. Mansyur No.66, Merdeka, Kec. Medan Baru, Kota Medan, Sumatera Utara 20154, Indonesia","hospital,health,point_of_interest,establishment",333,3.1,3.56782,98.657399,"3.56782,98.657399"
402,Siti Hajar Hospital,ChIJGTd1HCgwMTARzJHa7-ME5aU,"Jl. Jamin Ginting No.2, Merdeka, Kec. Medan Baru, Kota Medan, Sumatera Utara 20222, Indonesia","hospital,health,point_of_interest,establishment",240,3.2,3.5713727,98.6604368,"3.5713727,98.6604368"
403,Sarah Hospital,ChIJHRgHX9YxMTAR6MJ7tBN2VYY,"Jl. Baja Raya No.10, Petisah Tengah, Kec. Medan Petisah, Kota Medan, Sumatera Utara 20111, Indonesia","hospital,doctor,health,point_of_interest,establishment",135,3.9,3.587030999999999,98.6630528,"3.587031,98.6630528"
404,Columbia Asia Hospital Medan,ChIJLQwkUskxMTARk1DLc7M-Y5E,"Jl. Listrik No.2A, Petisah Tengah, Kec. Medan Petisah, Kota Medan, Sumatera Utara 20112, Indonesia","hospital,health,point_of_interest,establishment",2855,4.6,3.585727,98.6768429,"3.585727,98.6768429"
405,RSU Madani,ChIJ_f4aCFYwMTAR5Ut4-_w7pjk,"Jl. Arief Rahman Hakim No.168, Sukaramai I, Kec. Medan Area, Kota Medan, Sumatera Utara 20227, Indonesia","hospital,health,point_of_interest,establishment",500,3.5,3.5749163,98.7032209,"3.5749163,98.7032209"
406,RSU Sufina Aziz,ChIJt090XOMxMTARcKLRJTN2dag,"Jl. Karya Baru No.1, Helvetia Tim., Kec. Medan Helvetia, Kota Medan, Sumatera Utara 20124, Indonesia","hospital,doctor,health,point_of_interest,establishment",170,4.2,3.6167141,98.6630071,"3.6167141,98.6630071"
407,Bunda Thamrin Hospital,ChIJ5R-7OzIuMTARcyI0yDhr0FY,"Jl. Sei Batang Hari No.28-30-42, Babura Sunggal, Kec. Medan Sunggal, Kota Medan, Sumatera Utara 20112, Indonesia","hospital,doctor,health,point_of_interest,establishment",513,3.6,3.5853127,98.6514487,"3.5853127,98.6514487"
408,RS Bhayangkara,ChIJmVUGt9cvMTARjdG-cnq9eR4,"Jl. K.H. Wahid Hasyim No.1, Merdeka, Kec. Medan Baru, Kota Medan, Sumatera Utara 20222, Indonesia","hospital,health,point_of_interest,establishment",138,4.3,3.5725508,98.6584678,"3.5725508,98.6584678"
409,Bina Kasih General Hospital,ChIJKYO4BgEvMTARM-6sjBmfpwk,"Jl. Jend, Jl. Tahi Bonar Simatupang No.148, Sunggal, Kec. Medan Sunggal, Kota Medan, Sumatera Utara 20127, Indonesia","hospital,health,point_of_interest,establishment",508,2.1,3.5784933,98.6129567,"3.5784933,98.6129567"
410,Putri Hijau Hospital,ChIJFd4Ob8YxMTARSG7ZRHYICzo,"Jl. Putri Hijau No.17, Kesawan, Kec. Medan Bar., Kota Medan, Sumatera Utara 20111, Indonesia","hospital,health,point_of_interest,establishment",184,4.0,3.5997072,98.6727002,"3.5997072,98.6727002"
411,"RS Martha Friska Medan ,",ChIJFyHkB0owMTARHwvbIyyBf-s,"Jl. Multatuli No.1, A U R, Kec. Medan Maimun, Kota Medan, Sumatera Utara 20212, Indonesia","hospital,health,point_of_interest,establishment",153,3.7,3.5759674,98.6829579,"3.5759674,98.6829579"
412,Royal Prima University Hospital,ChIJCyWJeyEuMTARE_3uMUvr6_s,"Jl. Ayahanda No.68A, Sei Putih Tengah, Kec. Medan Petisah, Kota Medan, Sumatera Utara 20118, Indonesia","hospital,doctor,health,point_of_interest,establishment",597,3.2,3.5981204,98.6542565,"3.5981204,98.6542565"
413,Methodist Hospital,ChIJxYmOwLsxMTARutudbnF9nxM,"Jl. M.H Thamrin No.105, Sei Rengas Permata, Kec. Medan Area, Kota Medan, Sumatera Utara 20211, Indonesia","hospital,health,point_of_interest,establishment",165,3.4,3.5836498,98.6928638,"3.5836498,98.6928638"
414,Siloam Hospitals Dhirga Surya,ChIJYXmumTkwMTARco_PsUK66fI,"Jl. Imam Bonjol No.6, Petisah Tengah, Kec. Medan Petisah, Kota Medan, Sumatera Utara 20212, Indonesia","hospital,health,point_of_interest,establishment",3255,4.6,3.5858922,98.6735991,"3.5858922,98.6735991"
415,RSU MITRA SEJATI,ChIJf1PadQcwMTARcGly16FnQQY,"Jl. Jenderal Besar A.H. Nasution No.7, Pangkalan Masyhur, Kec. Medan Johor, Kota Medan, Sumatera Utara 20219, Indonesia","hospital,health,point_of_interest,establishment",438,2.6,3.5409601,98.6798975,"3.5409601,98.6798975"
416,RS Murni Teguh Susanna Wesley,ChIJa-LQqOwvMTAR-c6SYChGtME,"Jl. Harmonika Baru Jl. Setia Budi Ps. II, Padang Bulan Selayang II, Kec. Medan Selayang, Kota Medan, Sumatera Utara 20132, Indonesia","hospital,health,point_of_interest,establishment",115,4.0,3.5550008,98.638437,"3.5550008,98.638437"
417,Rumah Sakit Mata Medan Baru,ChIJ9btp6tUvMTARRun6nlBfdBg,"Jl. Abdullah Lubis No.67, Merdeka, Kec. Medan Baru, Kota Medan, Sumatera Utara 20222, Indonesia","hospital,point_of_interest,health,establishment",78,4.0,3.5766436,98.6587621,"3.5766436,98.6587621"
418,RSIA Stella Maris,ChIJC7HUZTYwMTAR98bF1gw0O68,"Jl. Samanhudi No.20, J A T I, Kec. Medan Maimun, Kota Medan, Sumatera Utara 20152, Indonesia","hospital,doctor,point_of_interest,health,establishment",482,4.0,3.5728233,98.6808004,"3.5728233,98.6808004"
419,RSU Tere Margareth,ChIJG6XW-a8vMTARMBV0ssWVhls,"Jl. Ring Road No.11-15, Tj. Sari, Kec. Medan Selayang, Kota Medan, Sumatera Utara 20131, Indonesia","hospital,point_of_interest,health,establishment",54,3.7,3.5610032,98.6264577,"3.5610032,98.6264577"
420,RSU Bahagia,ChIJZYWH0VgwMTARO-Y7KjNbQsM,"Jl. Bahagia No.85, Teladan Tim., Kec. Medan Kota, Kota Medan, Sumatera Utara 20217, Indonesia","hospital,point_of_interest,health,establishment",18,4.3,3.563069,98.70186,"3.563069,98.70186"
421,Estomihi Hospital,ChIJiSZfW2YwMTAR7qIkdXDLIRc,"Jl. Sisingamangaraja No.235, Sudirejo II, Kec. Medan Kota, Kota Medan, Sumatera Utara 20217, Indonesia","hospital,point_of_interest,health,establishment",80,3.0,3.5567617,98.6951406,"3.5567617,98.6951406"
422,Dr. Pirngadi Regional General Hospital,ChIJKR9S0L0xMTARe-VFFMUhT3c,"Jl. Prof. H. M. Yamin No.47, Perintis, Kec. Medan Tim., Kota Medan, Sumatera Utara 20234, Indonesia","hospital,doctor,point_of_interest,health,establishment",347,3.0,3.598040499999999,98.6883868,"3.5980405,98.6883868"
423,Rumah Sakit (RS) Hisarma,ChIJb88UVSUuMTARr9OnAD-IxTQ,"Jl.Jend Gatot Subroto Km 4.5 No.128, Sei Sikambing C. II, Kec. Medan Helvetia, Kota Medan, Sumatera Utara 20123, Indonesia","hospital,point_of_interest,health,establishment",6,4.7,3.5910347,98.6418891,"3.5910347,98.6418891"
424,Rumah Sakit (RS) Pusat Medan Tuntungan,ChIJ52U7MSAwMTARGhd52hi1VS8,"Jl. B Lau No.17, Padang Bulan, Medan Baru, Kota Medan, Sumatera Utara 20157, Indonesia","hospital,point_of_interest,health,establishment",5,3.4,3.5183672,98.6088932,"3.5183672,98.6088932"
425,Fajar General Hospital,ChIJQcozCgUwMTAREhyggmlvvsA,"Jl. Cempaka No.35, Sari Rejo, Kec. Medan Polonia, Kota Medan, Sumatera Utara 20158, Indonesia","hospital,point_of_interest,health,establishment",19,4.6,3.5482885,98.6695775,"3.5482885,98.6695775"
426,Rumah Sakit Umum Imelda Pekerja Indonesia,ChIJDxdRKRwyMTARlpY-uCX9wa8,"Jl. Bilal No.24, Pulo Brayan Darat I, Kec. Medan Tim., Kota Medan, Sumatera Utara 20239, Indonesia","hospital,point_of_interest,health,establishment",264,3.2,3.6227167,98.6749486,"3.6227167,98.6749486"
427,Bandung Public Hospital,ChIJPUYelTouMTARV_Ib--qy4e4,"Jl. Mistar No.39-43, Sei Putih Bar., Kec. Medan Petisah, Kota Medan, Sumatera Utara 20118, Indonesia","hospital,point_of_interest,health,establishment",69,3.6,3.5918224,98.6496887,"3.5918224,98.6496887"
428,Rumah Sakit Umum Bakti,ChIJpbozFlowMTARx8WgKDYMzNY,"Jl. HM. Joni No.64, Teladan Tim., Kec. Medan Kota, Kota Medan, Sumatera Utara 20216, Indonesia","hospital,point_of_interest,health,establishment",20,2.7,3.5683358,98.7017439,"3.5683358,98.7017439"
429,RSU Muhammadiyah,ChIJGaQbYw8xMTAR5TI-gM-3nVk,"Jl. Mandala By Pass No.27, Tegal Sari Mandala I, Kec. Medan Denai, Kota Medan, Sumatera Utara 20223, Indonesia","hospital,point_of_interest,health,establishment",127,4.1,3.5830641,98.710688,"3.5830641,98.710688"
430,Herna General Hospital,ChIJWzrhWtMxMTARg4xJA9fRiYQ,"Jl. Mojopahit No.118A, Petisah Hulu, Kec. Medan Baru, Kota Medan, Sumatera Utara 20152, Indonesia","hospital,point_of_interest,health,establishment",88,4.0,3.5795814,98.6658312,"3.5795814,98.6658312"
431,RS Materna Medan,ChIJw4qd9s0xMTARs6zsJcMHkbE,"Jl. Teuku Umar No.9-11, Petisah Tengah, Kec. Medan Petisah, Kota Medan, Sumatera Utara 20112, Indonesia","hospital,point_of_interest,health,establishment",137,4.2,3.5844034,98.6714143,"3.5844034,98.6714143"
432,Rumah Sakit Gleneagles Medan,ChIJ3zmnss4xMTARFB5SUkPYq-E,"Jl. Listrik No.2A, Petisah Tengah, Kec. Medan Kota, Kota Medan, Sumatera Utara, Indonesia","hospital,point_of_interest,health,establishment",0,0.0,3.5860368,98.6764804,"3.5860368,98.6764804"
433,RSU. Mitra Medika-Amplas,ChIJ4USxA3k6MTARgr08Ep3aCSk,"Jl. Sisingamangaraja, Harjosari I, Kec. Medan Amplas, Kota Medan, Sumatera Utara 20148, Indonesia","hospital,point_of_interest,health,establishment",499,3.9,3.5373755,98.711876,"3.5373755,98.711876"
434,Martha Friska Hospital,ChIJx6_PUQ4yMTARtaHWZ8n7qlc,"Jl. Kol. Yos Sudarso No.91, Tanjung Mulia, Medan Deli, Medan City, North Sumatra 20239, Indonesia","hospital,point_of_interest,health,establishment",122,3.3,3.6329592,98.6690249,"3.6329592,98.6690249"
435,Rumah Sakit Umum Mitra Medika,ChIJlQWLs3UyMTAR-kLb-5PtrNQ,"Jl. Kol. Yos Sudarso No.KM. 7,5, Tj. Mulia, Kec. Medan Deli, Kota Medan, Sumatera Utara 20241, Indonesia","hospital,point_of_interest,health,establishment",235,3.0,3.6440022,98.6626716,"3.6440022,98.6626716"
436,RS umum bina kasih,ChIJgf3Xo8QxMTARmZ-7_y88B3I,"Jl. Sei Deli No.39b-52, Silalas, Kec. Medan Bar., Kota Medan, Sumatera Utara 20236, Indonesia","hospital,point_of_interest,health,establishment",2,1.0,3.5951956,98.6722227,"3.5951956,98.6722227"
437,Rumah Sakit Ibu dan Anak Rosiva,ChIJtWTH4bcxMTAR0ChTe8IQX0g,"Jl. Bangka No.15, Gg. Buntu, Kec. Medan Tim., Kota Medan, Sumatera Utara 20212, Indonesia","hospital,health,point_of_interest,establishment",97,4.5,3.589477,98.682321,"3.589477,98.682321"
438,Rumah Sakit Islam Malahayati,ChIJlesIbc4xMTARrzRaY4j5jMA,"Jl. Pangeran Diponegoro No.2 - 4, Petisah Tengah, Kec. Medan Petisah, Kota Medan, Sumatera Utara 20112, Indonesia","hospital,health,point_of_interest,establishment",246,3.7,3.5861541,98.6724015,"3.5861541,98.6724015"
439,BOLONI HOSPITAL,ChIJ6aYVji8wMTAR36oz_H51ynA,"Jl. Mongonsidi No.11, Polonia, Kec. Medan Polonia, Kota Medan, Sumatera Utara 20152, Indonesia","hospital,health,point_of_interest,establishment",19,3.7,3.5709188,98.6687453,"3.5709188,98.6687453"
440,RUMAH SAKIT UMUM PUSAT H. ADAM MALIK IGD,ChIJIz29xKMlMTARXtPcxSfhU34,"GJ95+2WV, Kemenangan Tani, Medan Tuntungan, Medan City, North Sumatra 20136, Indonesia","hospital,health,point_of_interest,establishment",8,3.8,3.51761,98.6098118,"3.51761,98.6098118"
441,General Hospital Delima,ChIJ7cWiNpfNNjARo9eEJft_ezQ,"Jalan Yos Sudarso KM 13.6 No.19A, Martubung, Kec. Medan Labuhan, Kota Medan, Sumatera Utara 20251, Indonesia","hospital,doctor,health,point_of_interest,establishment",98,3.1,3.6962611,98.6731478,"3.6962611,98.6731478"
442,RSIA Sri Ratu,ChIJXc2V_NkxMTARWo_e4om-rkE,"Jl. Nibung Raya No.204-212, Petisah Tengah, Kec. Medan Petisah, Kota Medan, Sumatera Utara 20112, Indonesia","hospital,health,point_of_interest,establishment",41,3.8,3.5908581,98.6650697,"3.5908581,98.6650697"
443,Rumah Sakit Bahagia Medan,ChIJMTP0c18wMTARf8ACyZquwYc,"Jalan Bahagia 85 Ds, Jl. Teladan, Kec. Medan Kota, Sumatera Utara 20217, Indonesia","hospital,health,point_of_interest,establishment",0,0.0,3.562986,98.702975,"3.562986,98.702975"
444,RS Sehat,ChIJvYSKewsxMTARgVz0wqmj0R0,"HPXG+8R9, JL. Letda Sujono, Bandar Selamat, Bantan Tim., Kec. Medan Tembung, Kota Medan, Sumatera Utara 20223, Indonesia","hospital,health,point_of_interest,establishment",8,4.8,3.598292499999999,98.7271141,"3.5982925,98.7271141"
445,Santa Elisabeth Hospital,ChIJdyF6ATQwMTARO6C3ibC8mpI,"Jl. H. Misbah No.7, J A T I, Kec. Medan Maimun, Kota Medan, Sumatera Utara 20151, Indonesia","hospital,health,point_of_interest,establishment",463,3.9,3.57491,98.6767201,"3.57491,98.6767201"
446,Rumah Sakit Mulia,ChIJFbBvTUIwMTAROE6emrwHP1Q,"Jl. Brigjend Katamso No.2, Sei Mati, Kec. Medan Maimun, Kota Medan, Sumatera Utara 20215, Indonesia","hospital,health,point_of_interest,establishment",1,5.0,3.5626673,98.6895748,"3.5626673,98.6895748"
447,Rumah sakit medan labuhan,ChIJ68iRdezNNjARB82EfOXQ9GM,"Jl. Kol. Yos Sudarso No.22, Pekan Labuhan, Kec. Medan Labuhan, Kota Medan, Sumatera Utara 20253, Indonesia","hospital,health,point_of_interest,establishment",14,4.6,3.7348324,98.6761136,"3.7348324,98.6761136"
448,Hermina Hospital Medan,ChIJ8yyqukQuMTAR3ybUwNpJJUU,"Jl. Asrama, Sei Sikambing C. II, Kec. Medan Helvetia, Kota Medan, Sumatera Utara 20123, Indonesia","hospital,doctor,health,point_of_interest,establishment",790,4.2,3.5952845,98.6277923,"3.5952845,98.6277923"
449,RSU Bina Sejahtera,ChIJh30L6_AxMTARxIo2kmGZkcI,"Jl. Kol. Yos Sudarso, Glugur Kota, Kec. Medan Bar., Kota Medan, Sumatera Utara 20238, Indonesia","hospital,health,point_of_interest,establishment",3,2.3,3.6140694,98.6725861,"3.6140694,98.6725861"
450,Rumah Sakit Sari Cipta,ChIJ10KkGnkyMTARyr4W6SSX9TY,"MM37+H98, Tanjung Mulia, Medan Deli, Medan City, North Sumatra, Indonesia","hospital,health,point_of_interest,establishment",0,0.0,3.653922,98.663467,"3.653922,98.663467"
451,Rumah Sakit Mama,ChIJOVxpVnsxMTARZ3TeMwwggrc,"Jl. Medan Tenggara VII No.42, Medan Tenggara, Kec. Medan Denai, Kota Medan, Sumatera Utara 20226, Indonesia","hospital,health,point_of_interest,establishment",0,0.0,3.5546712,98.7166172,"3.5546712,98.7166172"
452,Rumah Sakit Lanu Dokter ABD Malik,ChIJudfWpjQwMTARG7dqkjBa70M,"Jl. Imam Bonjol No.1, Hamdan, Kec. Medan Maimun, Kota Medan, Sumatera Utara 20212, Indonesia","hospital,health,point_of_interest,establishment",0,0.0,3.579528,98.676753,"3.579528,98.676753"
453,RUMAH SAKIT AL-QADRI,ChIJh7ubsgcvMTARvf0VdnSNfns,"Jl. Medan - Binjai No.16, Sei Sikambing B, Kec. Medan Sunggal, Kota Medan, Sumatera Utara 20123, Indonesia","hospital,health,point_of_interest,establishment",1,4.0,3.5917701,98.6239651,"3.5917701,98.6239651"
454,RSIA Badrul Aini,ChIJS0OkffwwMTARKh4nWRKBy_4,"Jl. Bromo Jl. Syukri No.18, Tegal Sari III, Kec. Medan Area, Kota Medan, Sumatera Utara 20216, Indonesia","hospital,health,point_of_interest,establishment",120,4.5,3.5772193,98.7057741,"3.5772193,98.7057741"
455,RSU Eshmun,ChIJv1LDRlktMTARYCUFFPxaBYo,"Jl. Marelan Raya No.173A, Tanah Enam Ratus, Kec. Medan Marelan, Kota Medan, Sumatera Utara 20244, Indonesia","hospital,health,point_of_interest,establishment",368,4.3,3.6868115,98.6557182,"3.6868115,98.6557182"
456,RSIA Artha Mahinrus,ChIJ4R17w4gxMTARRV2gOhMpuTM,"Jl. Rakyat No.178, Tegal Rejo, Kec. Medan Perjuangan, Kota Medan, Sumatera Utara 20236, Indonesia","hospital,health,point_of_interest,establishment",76,4.4,3.616629,98.691194,"3.616629,98.691194"
457,Rumah Sakit Umum Haji Medan,ChIJff6ozGQxMTARhXGHwXgz7Xw,"Jl. Rumah Sakit H. No.47, Kenangan Baru, Kec. Percut Sei Tuan, Kabupaten Deli Serdang, Sumatera Utara 20371, Indonesia","hospital,health,point_of_interest,establishment",243,3.3,3.6133801,98.7145484,"3.6133801,98.7145484"
458,Tebak Rs.mandiri Medan,ChIJG34jms8xMTARC4AsrMg9wD4,"Jl. Kapten Maulana Lubis No.8, Petisah Tengah, Kec. Medan Petisah, Kota Medan, Sumatera Utara 20236, Indonesia","hospital,health,point_of_interest,establishment",0,0.0,3.5897902,98.6733808,"3.5897902,98.6733808"
459,General Hospital Ridos,ChIJXTphNJIwMTARyg-l9gVPa5I,"Jl. Menteng VII No.62, Medan Tenggara, Kec. Medan Denai, Kota Medan, Sumatera Utara 20228, Indonesia","hospital,health,point_of_interest,establishment",17,3.6,3.556019,98.7176449,"3.556019,98.7176449"
460,RUMAH SAKIT MARIO4D,ChIJM6oZgAYxMTARvc_8q3IG71k,"HMC9+7M8, Polonia, Medan Polonia, Medan City, North Sumatra 20152, Indonesia","hospital,health,point_of_interest,establishment",0,0.0,3.5706538,98.6692145,"3.5706538,98.6692145"
461,Rumah Sakit Advent,ChIJAQAAAHQlMTARSpLnYIXIWYU,"HJQX+RRV, Simpang Selayang, Kec. Medan Tuntungan, Medan City, North Sumatra 20135, Indonesia","hospital,health,point_of_interest,establishment",5,4.0,3.5896206,98.6495536,"3.5896206,98.6495536"
462,Rsu Gran Theresia Herna,ChIJMYvFdqUvMTARg86AqOEVopE,"Jl. Ps. III Tapian Nauli No.8, Sunggal, Kec. Medan Sunggal, Kota Medan, Sumatera Utara 20128, Indonesia","hospital,health,point_of_interest,establishment",10,4.6,3.570122,98.6251107,"3.570122,98.6251107"
463,Rumah Sakit,ChIJCRh_bCQxMTARpqHPm3S3o4U,"HMWC+3VH, Silalas, Medan Barat, Medan City, North Sumatra, Indonesia","hospital,health,point_of_interest,establishment",0,0.0,3.5951956,98.6722227,"3.5951956,98.6722227"
464,Rumah Sakit Ibu & Anak Az - Zakiyah,ChIJsYNtPB4yMTAR32zaz1-Mbaw,"Jl. Mustafa No.4 A, Glugur Darat I, Kec. Medan Tim., Kota Medan, Sumatera Utara 20238, Indonesia","hospital,health,point_of_interest,establishment",6,4.8,3.6180017,98.6782531,"3.6180017,98.6782531"
465,RSU.PRIMA,ChIJt4eggJIzMTARkCvY6udaDdI,"JMGH+269, Gg. Wijaya, Pulo Brayan Darat II, Kec. Medan Tim., Kota Medan, Sumatera Utara 20239, Indonesia","hospital,health,point_of_interest,establishment",0,0.0,3.6250411,98.6781139,"3.6250411,98.6781139"
466,Kasih Abadi General Hospital,ChIJdXV1jQowMTARibxctxfNNwE,"Jl. Jenderal Besar A.H. Nasution No.7, Pangkalan Masyhur, Kec. Medan Johor, Kota Medan, Sumatera Utara 20219, Indonesia","hospital,health,point_of_interest,establishment",0,0.0,3.5409792,98.6798781,"3.5409792,98.6798781"
467,UGD 24 Jam Rumah Sakit Umum Permata Bunda,ChIJT79HzLQxMTARCm--VAeN9A8,"Jl. Sambas No.59/63, Mesjid, Kec. Medan Kota, Kota Medan, Sumatera Utara 20212, Indonesia","hospital,health,point_of_interest,establishment",1,5.0,3.5806266,98.6857174,"3.5806266,98.6857174"
468,Rumah Sakit Universitas Andalas,ChIJXd0KjZm31C8RMLuneJS20jA,"Komp Kampus Unand Jalan Universitas Andalas, Limau Manis, Kec. Pauh, Kota Padang, Sumatera Barat 25176, Indonesia","hospital,health,point_of_interest,establishment",175,3.9,-0.9205468,100.4565349,"-0.9205468,100.4565349"
469,Hospital for Special Surgery Padang Ropanasuri,ChIJr9pugi-51C8RXIDEUmPprNg,"Jl. Aur No.8, Ujung Gurun, Kec. Padang Bar., Kota Padang, Sumatera Barat 25142, Indonesia","hospital,doctor,health,point_of_interest,establishment",167,4.2,-0.935352,100.3593886,"-0.935352,100.3593886"
470,RSU Selaguri,ChIJx1Yiyja51C8RWoPHhmcV8P0,"Jl. Jend. A Yani No.26, Padang Pasir, Kec. Padang Bar., Kota Padang, Sumatera Barat 25112, Indonesia","hospital,health,point_of_interest,establishment",67,3.4,-0.9426902,100.3581259,"-0.9426902,100.3581259"
471,Islamic Hospital Siti Rahmah,ChIJKYYKsWK41C8R1-li3xbDCzY,"Jl. By Pass No.KM.15, Aie Pacah, Kec. Koto Tangah, Kota Padang, Sumatera Barat 25586, Indonesia","hospital,health,point_of_interest,establishment",250,3.3,-0.8709768000000001,100.3840553,"-0.8709768,100.3840553"
472,Hermina Hospital Padang,ChIJ77eCjs-41C8R1ZNQF-Z4WC4,"Jl. Khatib Sulaiman, Lolong Belanti, Kec. Padang Utara, Kota Padang, Sumatera Barat 25173, Indonesia","hospital,doctor,health,point_of_interest,establishment",689,4.1,-0.9177899,100.3604524,"-0.9177899,100.3604524"
473,Rumah Sakit Umum Pusat Dr. M. Djamil Kota Padang Sumatera Barat,ChIJDcc7fzu51C8RSgbLIW7AMBI,"Jl. Perintis Kemerdekaan, Sawahan Tim., Kec. Padang Tim., Kota Padang, Sumatera Barat 25171, Indonesia","hospital,doctor,health,point_of_interest,establishment",1377,4.0,-0.9437875,100.3671843,"-0.9437875,100.3671843"
474,RSU BUNDA PADANG,ChIJ21XvPEy51C8RDdLRObcxnHk,"Jl. Proklamasi No.31 - 37, Ganting Parak Gadang, Kec. Padang Tim., Kota Padang, Sumatera Barat 25132, Indonesia","hospital,health,point_of_interest,establishment",559,3.5,-0.9510184,100.36752,"-0.9510184,100.36752"
475,RS NAILI DBS,ChIJd1sbpDe51C8RPtc3hv56q-g,"Jl. Ratulangi No.24, Kp. Jao, Kec. Padang Bar., Kota Padang, Sumatera Barat, Indonesia","atm,hospital,finance,health,point_of_interest,establishment",135,4.1,-0.9454293,100.3592989,"-0.9454293,100.3592989"
476,Rumah Sakit dr. Reksodiwiryo Padang.,ChIJ___b4j-51C8RgC6OF_clvHg,"Jl. Dr. Wahidin No.1, Ganting Parak Gadang, Kec. Padang Tim., Kota Padang, Sumatera Barat 25132, Indonesia","hospital,health,point_of_interest,establishment",507,4.6,-0.9510264,100.3720251,"-0.9510264,100.3720251"
477,Rumah Sakit Ibu & Anak Mutiara Bunda,ChIJvczVL8241C8RqVupo-gK_3Q,"Jl. S. Parman No.142, Ulak Karang Sel., Kec. Padang Utara, Kota Padang, Sumatera Barat 25136, Indonesia","hospital,health,point_of_interest,establishment",62,3.5,-0.9172675999999998,100.3505376,"-0.9172676,100.3505376"
478,RS. Bhayangkara,ChIJa6DxrCa51C8R2sJ2LSQbg5E,"Jl. Jati No.1, Jati, Kec. Padang Tim., Kota Padang, Sumatera Barat 25171, Indonesia","hospital,health,point_of_interest,establishment",22,4.0,-0.9329749,100.3659962,"-0.9329749,100.3659962"
479,Rumah Sakit Umum Aisyiyah,ChIJDTuzTji51C8RGU-0UmDdh-4,"Jl. H. Agus Salim No.6, Sawahan, Kec. Padang Tim., Kota Padang, Sumatera Barat 25171, Indonesia","hospital,health,point_of_interest,establishment",88,3.6,-0.9476724,100.3635671,"-0.9476724,100.3635671"
